apps,Iteration turn,Denser_Summary,Missing_Entities,pos_ents,neg_ents,neu_ents,#pos_ents,#neg_ents,#neu_ents,#entities,entity density,#raw_tokens,#tokens
headspace,5,"Users frequently mention the effectiveness of breathing exercises and mindfulness techniques available in the app, citing them as instrumental in achieving calming effects during periods of stress. The structured daily practice and guided sessions contribute to this sense of tranquility, fostering emotional stability over time. While the app's variety of content and ability to personalize the experience remain appreciated, users' perceptions are still impacted by the user interface and the ongoing debate over the value of free versus subscription-based content.",breathing exercises;mindfulness techniques;calming effects,structured daily practice;guided sessions;app's variety of content;ability to personalize the experience;breathing exercises;mindfulness techniques,debate over the value of free versus subscription-based content,,6,1,0,7,0.08641975308641975,88,81
uber,1,"This application, designed to facilitate transportation and delivery services, has been met with a variety of user experiences. Some have encountered less than satisfactory interactions with customer service, which has been a significant point of contention. Others have noted occasional app glitches that can disrupt the service's utility. Additionally, there are mentions of fare discrepancies, where users have observed unexpected charges or changes in fare estimates after booking. These issues have contributed to a mixed reception of the app, with some users expressing frustration over these operational challenges.",customer service;app glitches;fare discrepancies,,customer service;occasional app glitches;fare discrepancies,,0,3,0,3,0.03409090909090909,100,88
uber,2,"Users report frequent driver cancellations and unexpected price surges as recurrent issues. The unpredictability of cancellations often leads to inconvenience and delays, while sudden fare increases strain users' budgets. Additionally, there are grievances about account deactivation without clear justification, leaving users unable to access services and causing further distress. These operational challenges, alongside previously mentioned customer service inadequacies, app glitches, and fare discrepancies, paint a picture of an app that struggles to deliver consistent and reliable service.",driver cancellations;price surges;account deactivation,,driver cancellations;unexpected price surges;account deactivation without clear justification;customer service;app glitches;fare discrepancies,,0,6,0,6,0.07792207792207792,89,77
uber,3,"Safety concerns have surfaced, with some users feeling uneasy about their experiences. Unauthorized charges on users' accounts have also been reported, adding financial worries to the list of user grievances. The app's refund policies have come under scrutiny for not adequately addressing users' issues when services fall short of expectations. These new points, combined with driver cancellations, price surges, account deactivation issues, and the previously identified customer service problems, app glitches, and fare discrepancies, highlight systemic issues within the app's operation.",safety concerns;unauthorized charges;refund policies,,Safety concerns;Unauthorized charges;refund policies;driver cancellations;price surges;account deactivation issues;customer service;app glitches;fare discrepancies,,0,9,0,9,0.1111111111111111,98,81
uber,4,"Navigation errors leading to incorrect pickup or drop-off locations have frustrated users. The lack of accessibility options for disabled individuals is another critical shortfall. Moreover, ride availability has been inconsistent, with some users facing long wait times or no available rides at all. These operational flaws, alongside safety concerns, unauthorized charges, problematic refund policies, frequent driver cancellations, significant price surges, and arbitrary account deactivations, exacerbate the already challenging issues of poor customer service, app glitches, and fare discrepancies.",navigation errors;accessibility options;ride availability,,lack of accessibility options for disabled individuals;long wait times;no available rides;safety concerns;unauthorized charges;problematic refund policies;frequent driver cancellations;significant price surges;arbitrary account deactivations;poor customer service;app glitches;fare discrepancies;Navigation errors,,0,13,0,13,0.16455696202531644,93,79
uber,5,"Complaints extend to vehicle cleanliness and driver professionalism, with some drivers' conduct falling below user expectations. Peak time reliability is another pain point, with users finding it difficult to secure rides during high-demand periods. These shortcomings add to the list of navigation errors, insufficient accessibility options, inconsistent ride availability, safety concerns, unauthorized charges, unsatisfactory refund policies, driver cancellations, price surges, account deactivations, customer service issues, app glitches, and fare discrepancies, cumulatively reflecting a service that often fails to meet user needs.",vehicle cleanliness;driver professionalism;peak time reliability,,vehicle cleanliness;driver professionalism;secure rides during high-demand periods;navigation errors;accessibility options;ride availability;safety concerns;unauthorized charges;refund policies;driver cancellations;price surges;account deactivations;customer service;app glitches;fare discrepancies,,0,15,0,15,0.18292682926829268,99,82
lyft,1,"The application in question provides a service that is generally seen as a necessity for individuals who do not possess their own mode of transportation. While it offers a certain level of convenience, there are notable concerns regarding its operation. Users have reported instances of what they perceive as price gouging, where the cost of a service can unexpectedly increase under certain conditions such as inclement weather or high demand periods. Additionally, there are grievances about unauthorized charges appearing on users' accounts, leading to frustration and financial inconvenience. Another point of contention is the frequency of driver cancellations, which can disrupt users' plans and contribute to a negative experience. Lastly, the effectiveness of the customer service provided by the application is called into question, with users expressing dissatisfaction with the support received during dispute resolution.",price gouging;unauthorized charges;driver cancellation;customer service,level of convenience,price gouging;unauthorized charges appearing on users' accounts;driver cancellations;customer service,,1,4,0,5,0.037037037037037035,150,135
lyft,2,"Users have encountered technical issues with the app, including crashes that disrupt service and lead to booking challenges. Complaints about being double charged for rides add to the financial concerns, exacerbating the dissatisfaction with the app's billing practices. Comparisons with other ride-sharing services suggest competitive discrepancies, with some users finding alternatives more reliable or cost-effective. Safety concerns are also prevalent, with reports of drivers behaving inappropriately or creating uncomfortable situations for passengers. These issues, combined with previous mentions of price gouging, unauthorized charges, frequent driver cancellations, and poor customer service, paint a picture of an app that struggles to maintain user trust and deliver a consistently positive experience.",app crashes;double charging;ride-share comparison;safety concerns,,"technical issues with the app, including crashes;double charged for rides;drivers behaving inappropriately or creating uncomfortable situations for passengers;price gouging;unauthorized charges;frequent driver cancellations;poor customer service",,0,7,0,7,0.06363636363636363,123,110
lyft,3,"The quality of drivers varies significantly, affecting the overall satisfaction with each journey. Misleading estimated times of arrival (ETAs) contribute to user frustration, especially when drivers are rerouted or cancel unexpectedly. The app's refund policy is criticized for not being responsive or fair, particularly when dealing with unauthorized charges or double charging. Scheduling rides in advance does not guarantee reliability, as last-minute cancellations by drivers can still occur, leaving users stranded. These concerns are compounded by previous issues such as app crashes, safety worries, price hikes during peak times, and subpar customer service, making it difficult for users to depend on the app for their transportation needs.",driver quality;misleading ETA;refund policy;ride scheduling,,quality of drivers;Misleading estimated times of arrival (ETAs);refund policy;Scheduling rides in advance;app crashes;safety worries;price hikes during peak times;customer service;unauthorized charges;double charging;drivers are rerouted;cancel unexpectedly,,0,12,0,12,0.1111111111111111,124,108
lyft,4,"Inaccuracies in GPS functionality lead to pick-up and drop-off complications, while the process for retrieving lost items is cumbersome and often unsuccessful. Users report discriminatory practices by drivers who refuse rides based on destination or passenger characteristics. The lack of robust accessibility features for disabled individuals further limits the app's usability. These issues add layers to existing complaints about driver quality, misleading ETAs, an unhelpful refund policy, and unreliable ride scheduling. Despite these drawbacks, the app remains a widely used platform for ride-sharing, although it continues to face criticism for its handling of safety incidents, technical stability, pricing strategies during high-demand periods, and overall customer service effectiveness.",GPS accuracy;lost items;discriminatory practices;accessibility features,,"Inaccuracies in GPS functionality lead to pick-up and drop-off complications;retrieving lost items;discriminatory practices by drivers who refuse rides based on destination or passenger characteristics;accessibility features for disabled individuals;driver quality;misleading ETAs;refund policy,;ride scheduling;handling of safety incidents;technical stability;pricing strategies during high-demand;customer service",,0,12,0,12,0.10810810810810811,122,111
lyft,5,"Surge pricing during peak hours leads to unexpectedly high fares, causing budgetary concerns for users. Account suspensions without clear explanations or resolutions create barriers to accessing the service. Communication breakdowns between drivers and passengers exacerbate issues related to pick-up coordination and lost items retrieval. Ride cancellation fees imposed on users when drivers fail to show up or cancel last minute are seen as unfair penalties. These points compound existing frustrations regarding GPS inaccuracy, discriminatory actions by drivers, and inadequate accessibility options. Together with earlier identified problems such as varying driver quality, deceptive ETAs, a problematic refund policy, and challenges with scheduled rides, they underscore the need for significant improvements in the app's operational reliability and customer support.",surge pricing;account suspension;driver communication;ride cancellation fees,,Surge pricing during peak hours;Account suspensions without clear explanations or resolutions;Communication breakdowns between drivers and passengers;pick-up coordination;lost items retrieval;Ride cancellation fees;GPS inaccuracy;discriminatory actions by drivers;accessibility options;driver quality;deceptive ETAs;refund policy;scheduled rides;customer support,,0,14,0,14,0.11864406779661017,131,118
