apps,Iteration turn,Denser_Summary,Missing_Entities,pos_ents,neg_ents,neu_ents,#pos_ents,#neg_ents,#neu_ents,#entities,entity density,#raw_tokens,#tokens
bumble,1,"The app in question seems to have a variety of user experiences, with some finding it beneficial for creating meaningful connections, while others express frustration over certain operational aspects. A notable number of users have raised safety concerns, which appear to be a significant issue that the app's team may need to address more effectively. Additionally, there are reports of photo verification issues, where users encounter difficulties in getting their profiles verified, leading to disruptions in using the app's services. Another point of contention for users is the cost associated with the app's subscription model, which some find to be expensive compared to the value received. These factors contribute to a mixed reception among its user base.",safety concerns;photo verification issues;expensive subscription,beneficial for creating meaningful connections,"photo verification issues,;cost associated with the app's subscription model;safety concerns,",,1,3,0,4,0.03418803418803419,132,117
bumble,2,"Users are encountering safety concerns and expensive subscriptions on the app, with additional grievances about limited swipes that hinder the experience. The presence of fake profiles is another challenge that users face, detracting from the authenticity of interactions on the platform. Moreover, there are issues with photo verification that frustrate users, as they struggle to prove their identity and maintain access to the app's features. The app's approach to gender options also garners attention, as it influences the matching process and affects user satisfaction. These elements collectively shape the user experience, with some finding success in connecting with others, while many express dissatisfaction with the app's functionality and policies.",limited swipes;fake profiles;gender options,success in connecting with others,safety concerns;expensive subscriptions;limited swipes;fake profiles;photo verification;gender options,,1,6,0,7,0.06422018348623854,124,109
bumble,3,"The app's user base reports persistent safety concerns and challenges with an expensive subscription model. Limited swipes and a prevalence of fake profiles exacerbate user frustration, while photo verification issues and restrictive gender options limit accessibility. Users also face unresponsive matches, which leads to unfulfilled potential connections and dissatisfaction. The app's guidelines are criticized for being unclear, causing confusion and potential unfair treatment. Furthermore, non-binary individuals feel excluded due to the app's gender options, highlighting a need for more inclusive practices. These factors contribute to a complex user experience that varies widely across the app's community.",unresponsive matches;unclear guidelines;non-binary exclusion,,safety concerns;expensive subscription model;fake profiles;Limited swipes;photo verification;restrictive gender options;unresponsive matches;app's guidelines are criticized for being unclear;non-binary individuals feel excluded due to the app's gender options,,0,9,0,9,0.09278350515463918,111,97
bumble,4,"Users express dissatisfaction with safety concerns, expensive subscriptions, and limited swipes, compounded by fake profiles and problematic photo verification. The app's biased algorithms and unclear guidelines further frustrate users seeking genuine connections. Unresponsive matches and non-binary exclusion raise questions about inclusivity and effectiveness. Additionally, issues with profile visibility suggest that the app may not fairly present all users, potentially affecting match rates. Users also report annoyance with frequent push notifications, which disrupt the user experience and contribute to the overall sense of dissatisfaction. These challenges highlight areas where the app could improve to better serve its diverse user base.",biased algorithms;profile visibility;push notifications,,safety concerns;expensive subscriptions;limited swipes;fake profiles;problematic photo verification;unclear guidelines;Unresponsive matches;non-binary exclusion;profile visibility;match rates;push notifications,,0,11,0,11,0.11,112,100
bumble,5,"The platform faces criticism for safety concerns, costly subscriptions, limited swipes, and an influx of fake profiles. Users struggle with photo verification and biased algorithms that affect profile visibility. Unresponsive matches, unclear guidelines, and non-binary exclusion are problematic, while intrusive push notifications aggravate users. Account bans without clear explanations or recourse have led to further discontent among users. A significant lack of responsive customer support exacerbates these issues, leaving users feeling neglected. Additionally, auto-renewal issues with subscriptions have caused financial frustrations for users who feel trapped by the app's payment policies. These collective shortcomings signal a need for more transparent and user-friendly practices.",account bans;lack of customer support;auto-renewal issues,,safety concerns;costly subscriptions;limited swipes;fake profiles;photo verification;biased algorithms that affect profile visibility;Unresponsive matches;unclear guidelines;non-binary exclusion;push notifications;Account bans without clear explanations or recourse;responsive customer support;auto-renewal issues with subscriptions,,0,13,0,13,0.12264150943396226,119,106
tinder,1,"Users have expressed dissatisfaction with the prevalence of fake profiles on the app, which often lead nowhere or direct users to other services. Many have encountered sudden account bans without any clear justification or prior warning, leaving them confused and unable to access the service. Additionally, there is a sentiment that the subscriptions for the app are quite expensive, and even after paying, the benefits seem negligible, leading to a disappointing experience for those who have invested money. The lack of transparency and communication from the app's customer service when addressing these bans has been a point of frustration for affected users.",fake profiles;banned without reason;expensive subscriptions,,"fake profiles;account bans without any clear justification or prior warning;subscriptions for the app are quite expensive;even after paying, the benefits seem negligible;customer service",,0,5,0,5,0.049019607843137254,113,102
tinder,2,"The app's customer service is criticized for its unresponsiveness, particularly regarding unexplained bans. Users find themselves permanently banned with no recourse or appeal process available. The expensive subscriptions do not seem to improve the user experience, as fake profiles and bot accounts still pervade the platform. These issues contribute to a general sense of frustration and dissatisfaction among users, who feel their investment in the app is not yielding the expected social connections or support.",customer service;no appeal process;bot accounts,,customer service;unexplained bans;banned with no recourse or appeal process available;expensive subscriptions;fake profiles;bot accounts;investment in the app is not yielding the expected social connections or support,,0,7,0,7,0.09333333333333334,83,75
tinder,3,"Users are frustrated with the app's handling of gender preferences, leading to unwanted matches. The visibility of profiles seems to be affected by paid features, with some suspecting that not paying leads to fewer matches. The customer service's lack of engagement on issues like unexplained bans and the absence of an appeal process exacerbates user dissatisfaction. Despite investing in expensive subscriptions, many report an abundance of bot accounts and a scarcity of genuine interactions.",gender preferences;profile visibility;lack of matches,,gender preferences;visibility of profiles;not paying leads to fewer matches;customer service's;unexplained bans;absence of an appeal process;expensive subscriptions;bot accounts;scarcity of genuine interactions,,0,9,0,9,0.12162162162162163,83,74
tinder,4,"The app's algorithm is called into question for its effectiveness in providing matches according to user preferences, with many reporting issues such as misleading notifications about likes and matches. Users also face restrictions on profile editing, which can lead to bans without clear reasons. The customer service is noted for its inadequate response to these concerns, particularly regarding the lack of an appeal process for bans related to gender preferences or profile visibility.",algorithm issues;misleading notifications;profile editing restrictions,,matches according to user preferences;misleading notifications about likes and matches;restrictions on profile editing;bans without clear reasons;customer service;lack of an appeal process for bans related to gender preferences or profile visibility,,0,6,0,6,0.0821917808219178,80,73
tinder,5,"In-app purchases, including expensive subscriptions, fail to resolve issues with the algorithm that affects profile visibility and match frequency. Users are also dissatisfied with location-based matching, which often shows profiles outside their set preferences. Transparency from the app regarding its operations and decision-making processes, especially concerning bans and customer service interactions, remains a significant concern. The lack of clear communication compounds user frustration over editing restrictions and misleading notifications.",in-app purchases;location-based matching;transparency,,expensive subscriptions;profile visibility;match frequency;location-based matching;bans;customer service;editing restrictions;misleading notifications,,0,8,0,8,0.1111111111111111,78,72
robinhood,1,"The Robinhood app, designed to introduce users to the world of trading, has been the subject of discussion for its policies and functionalities. Users have expressed their journey of developing trading skills through the platform, highlighting its user-friendly nature that simplifies the investment process. A notable feature is the ability to trade in crypto currency, which has attracted a diverse user base seeking to invest in digital assets. However, there have been concerns regarding the instant deposit feature, where restrictions have led to frustrations among users who wish to capitalize on market opportunities promptly.",Robinhood app;trading skills;crypto currency;instant deposit,user-friendly nature that simplifies the investment process;trade in crypto currency,instant deposit feature,,2,1,0,3,0.031578947368421054,104,95
robinhood,2,"The Robinhood app has faced criticism for alleged market manipulation, particularly during high-volume trading periods where users found themselves unable to execute trades. Customer service is another pain point, with reports of slow response times exacerbating issues like account restriction. Users have encountered obstacles when attempting to resolve such restrictions, often related to identity verification processes that hinder access to funds and trading capabilities. These challenges have marred the app's reputation, despite its appeal to novice traders.",market manipulation;customer service;account restriction;identity verification,,"market manipulation, particularly during high-volume trading periods;Customer service;account restriction;identity verification processes",,0,4,0,4,0.05128205128205128,86,78
robinhood,3,"While Robinhood's user interface is praised for its simplicity, aiding in option trading for beginners, the app has been embroiled in controversy over security concerns and a class action lawsuit. The lawsuit stems from users' inability to buy certain stocks, perceived as market manipulation. Security issues include data breaches and questionable handling of sensitive information. These incidents have led to a loss of trust among some users, despite the platform's efforts to democratize stock trading.",user interface;option trading;security concerns;class action lawsuit,praised for its simplicity;option trading,"inability to buy certain stocks, perceived as market manipulation;data breaches;questionable handling of sensitive information",,2,3,0,5,0.06666666666666667,86,75
robinhood,4,"Users report platform crashes during crucial trading times, undermining Robinhood's reliability. Accusations of favoring hedge funds and selling user data for profit raise ethical concerns. The app's recent liquidity issues, leading to trading restrictions, have sparked outrage and legal scrutiny. These events question Robinhood's commitment to its users and highlight the need for transparency and stability in trading platforms.",platform crashes;hedge funds;selling user data;liquidity issues,,crashes during crucial trading times;Accusations of favoring hedge funds;selling user data for profit;trading restrictions,,0,4,0,4,0.06779661016949153,69,59
robinhood,5,"Robinhood's vision of financial freedom is challenged by users' experiences with dividend income tracking and requests for a drip loyalty plan. While aiming to empower investors, the app's shortcomings in these areas suggest a gap between user needs and the platform's offerings. Addressing these gaps could reinforce Robinhood's mission and enhance user satisfaction.",financial freedom;dividend income tracking;drip loyalty plan,,dividend income tracking;requests for a drip loyalty plan,,0,2,0,2,0.03773584905660377,62,53
acorn,1,"This app offers a platform for users to engage in saving and investing activities. However, numerous users have expressed dissatisfaction with the customer service, describing it as unhelpful and difficult to reach. There's also frustration over the subscription fee, which some users claim continues to be charged even after attempting to cancel their accounts. The withdrawal process is another point of contention, with complaints about delays and lack of access to funds. Additionally, there are grievances regarding the referral bonus, with users stating that promised bonuses were not received or that the criteria were misleading.",customer service;subscription fee;withdrawal process;referral bonus,,"customer service,;subscription fee,;charged even after attempting to cancel their accounts;withdrawal process;referral bonus",,0,5,0,5,0.05263157894736842,107,95
acorn,2,"Users report issues with account locking, hindering access to funds and causing inconvenience. Security concerns are raised due to the app's request for sensitive documents. Investment returns are criticized for being lower than expected, especially considering the subscription fee. Moreover, there are complaints about automatic investments restarting without user consent, leading to unexpected charges. The referral bonus system is also problematic, with users feeling deceived when bonuses are not honored as advertised.",account locking;security concerns;investment returns;automatic investments,,account locking;app's request for sensitive documents;Investment returns;subscription fee;automatic investments restarting without user consent;referral bonus system,,0,6,0,6,0.08333333333333333,83,72
acorn,3,"The app's user interface is mentioned as confusing and cluttered with ads, complicating account setup and management. Users express disappointment with minimal market gains on their investments, questioning the value of the service. Concerns about fraudulent charges and the app's response to unauthorized transactions are noted, with some users experiencing significant delays in resolving these issues. The automatic investment feature, while intended to facilitate saving, leads to frustration when funds are withdrawn unexpectedly.",user interface;account setup;market gains;fraudulent charges,,"interface is mentioned as confusing and cluttered with ads, complicating account setup and management;minimal market gains;fraudulent charges;response to unauthorized transactions;funds are withdrawn",,0,5,0,5,0.0684931506849315,84,73
acorn,4,"The app's limited investment options leave users wanting more control over their finances. Customer support response times are slow, exacerbating issues like account locking and withdrawal delays. Problems with bank account linking are frequent, causing transaction verification hurdles and unauthorized charges. Despite these issues, some users appreciate the app's concept of rounding up purchases for savings but find the execution lacking in transparency and efficiency.",investment options;customer support response;bank account linking;transaction verification,rounding up purchases for savings,limited investment options;Customer support;account locking;withdrawal delays;bank account linking;unauthorized charges;transaction verification,,1,7,0,8,0.12307692307692308,74,65
acorn,5,"Users criticize the app for late tax document availability, complicating their financial planning. Closing an account is a difficult process, often leading to continued unwanted subscription fees. Hidden fees are a common complaint, with users feeling misled about the cost of using the app. Despite its potential as an investment platform, reliability is questioned due to issues like unresponsive customer support and challenges in accessing invested funds.",tax document availability;account closure difficulty;hidden fees;investment platform reliability,,tax document availability;Closing an account;unwanted subscription fees;Hidden fees;customer support;challenges in accessing invested funds,,0,6,0,6,0.08955223880597014,75,67
calm,1,"This application, designed to assist individuals with anxiety and sleep difficulties, has garnered feedback highlighting the subscription cost as a significant barrier. Users express frustration over the locked content, which restricts access to most features without a paid subscription. Sleep stories, a popular feature, are also behind the paywall, limiting free use. The app's potential for anxiety relief is acknowledged, but the cost factor is a recurring theme in user reviews. Many find the pricing unreasonable for an app aimed at providing relief for conditions like anxiety and sleeplessness, suggesting a more accessible pricing model could be beneficial.",subscription cost;locked content;sleep stories;anxiety relief,potential for anxiety relief,"locked content, which restricts access to most features without a paid subscription;pricing unreasonable;Sleep stories, a popular feature, are also behind the paywall,",,1,3,0,4,0.04081632653061224,112,98
calm,2,"Users are critical of the premium pricing model, which locks essential features such as sleep stories and anxiety relief behind a subscription, making the free version very limited. The app offers a free trial, but users report challenges navigating the user interface to cancel subscriptions, leading to unwanted charges. Payment issues have caused dissatisfaction, with some users experiencing unexpected charges after attempting to cancel. While the app is praised for its content and potential benefits for anxiety and sleep problems, the financial commitment and interface difficulties are significant drawbacks mentioned in user reviews.",premium pricing;free trial;user interface;payment issues,praised for its content and potential benefits for anxiety and sleep problems,"free trial,;unexpected charges after attempting to cancel;locks essential features such as sleep stories;anxiety relief behind a subscription;navigating the user interface to cancel subscriptions",,1,5,0,6,0.06451612903225806,103,93
calm,3,"The app's premium pricing and locked content remain points of contention, with users finding the subscription cost prohibitive. While the meditation content and calming music are appreciated for their quality and effectiveness in improving sleep, customer service issues, particularly regarding payment and subscription cancellations, overshadow these benefits. Users seeking anxiety relief and sleep improvement express frustration with the lack of accessible customer support when facing billing problems. Despite the app's potential to aid with relaxation and mental health, these service-related challenges are a hurdle for many users.",customer service;meditation content;calming music;sleep improvement,meditation content;calming music,premium pricing;locked content;customer service;payment and subscription cancellations,,2,4,0,6,0.06818181818181818,98,88
calm,4,"The app's meditation practices and calming music are valued for contributing to sleep improvement and mental health management. However, users criticize the premium pricing structure that limits access to full content and express difficulties with billing problems when trying to navigate the free trial or cancel subscriptions. The presence of diverse narrators in sleep stories is a positive aspect, yet it's overshadowed by the frustration over locked content and customer service issues. While the app offers benefits for those struggling with anxiety, the financial and service barriers present challenges for users.",meditation practices;billing problems;diverse narrators;mental health,diverse narrators in sleep stories;meditation practices;calming music;offers benefits for those struggling with anxiety,billing problems when trying to navigate the free trial or cancel subscriptions;premium pricing structure that limits access to full content;customer service issues,,4,3,0,7,0.07692307692307693,100,91
calm,5,"The app's soundscapes and breathing exercises are highlighted as effective tools for managing anxiety and enhancing user experience during meditation practices. Despite this, the subscription model continues to be a major drawback due to premium pricing and locked content that hinders full access. Users appreciate the diverse narrators and the potential mental health benefits but face persistent billing problems and interface issues. The need for improved customer service is evident as users seek easier management of their subscriptions. Overall, while the app aids in sleep improvement, its value is diminished by these recurring financial and usability concerns.",soundscapes;breathing exercises;user experience;subscription model,diverse narrators;soundscapes;breathing exercises;aids in sleep improvement,billing problems;interface issues;customer service;premium pricing and locked content that hinders full access.,,4,4,0,8,0.08247422680412371,106,97
headspace,1,"The application in question seems to have a subscription cost associated with its use, which some users find to be a barrier, particularly when seeking meditation guidance. A number of individuals have expressed satisfaction with the app's ability to aid in sleep improvement, suggesting that it has been beneficial in helping them achieve a more restful state. Additionally, there are indications that the app has been utilized for stress management, with varying degrees of success reported by users. The overall sentiment appears to be mixed, with some finding value in the app's offerings, while others are dissuaded by the cost of subscription.",subscription cost;meditation guidance;sleep improvement;stress management,"app's ability to aid in sleep improvement;utilized for stress management, with varying degrees of success",subscription cost,,2,1,0,3,0.029411764705882353,115,102
headspace,2,"Users have noted that the app's user interface is a key factor in their experience, with some finding it helpful and others expressing difficulty in navigation. The availability of free content, or lack thereof, is also a point of contention among users, as some were expecting more accessible features without financial commitment. Despite these concerns, several users have testified to the mental health benefits provided by the app, including better handling of anxiety and enhanced overall well-being. However, these advantages are sometimes overshadowed by frustrations regarding accessibility and usability.",user interface;free content;mental health benefits,"testified to the mental health benefits provided by the app, including better handling of anxiety and enhanced overall well-being",user interface;availability of free content,,1,2,0,3,0.03333333333333333,101,90
headspace,3,"Feedback on customer service has been mixed, with some users experiencing prompt support while others face challenges in communication. The app's variety of content is praised for its breadth and depth, offering a range of options from sleep aids to anxiety management. Users appreciate the personalized experience, which allows them to tailor their journey towards mental wellness. However, the impact of these positive aspects is at times diminished by issues with user interface design and the limited availability of free content, which affects user satisfaction.",customer service;variety of content;personalized experience,personalized experience;variety of content is praised for its breadth and depth,customer service;user interface design;limited availability of free content,,2,3,0,5,0.058823529411764705,95,85
headspace,4,"The daily practice feature of the app is highlighted as a significant contributor to users' emotional stability, with regular use leading to noticeable improvements in mood and stress levels. The guided sessions are particularly lauded for their structure and clarity, providing users with a sense of direction in their meditation journey. While the variety of content and personalized experience continue to be strong points, ongoing concerns about customer service responsiveness and the balance between free and paid content persist, influencing the overall user experience.",daily practice;emotional stability;guided sessions,guided sessions;variety of content;personalized experience;daily practice feature,customer service;balance between free and paid content,,4,2,0,6,0.07142857142857142,92,84
