uuid,date,review,rating
a33d741c-d368-4612-9a0a-629d581b5de5,2022-07-03 16:25:42,"I’d consider myself to be pretty strong with investing and saving for different time horizons, and I already have portfolios I do my weekly dollar cost averaging into. 

This is my piggy bank :) A great way to *round up* my savings and keep me pushing. My wife and I have separate accounts, linked to the same cards, so we double dip and can see what the difference our time horizons have made on our small portfolios. $5/wk is a great start!",5
400a4154-e3cf-4977-9ee0-0b20eb7776f8,2023-03-17 18:10:44,"Dont sign up, they will literally scam you and take ur money and lock ur account so you can’t withdraw the funds",1
a8cd13b6-1ca9-4dae-b01c-da3164c1ae08,2022-05-19 20:52:08,"Continued charging me after cancelling subscription, continue taking money from my bank account for “investments” for an account that no longer exists. No support option to fix this issue and “accounts are closing we’ll cancel your subscription once accounts are closed” has been the only option on my screen for months despite all money being withdrawn. No recourse from acorns, terrible lack of service, have to go to the bank now to dispute these charges and block them from further charging my account.",1
2804c13f-db7b-4a25-a5c2-915fa2aacece,2022-06-03 23:14:44,Stuck on loading screen and won’t let me cancel the subscription and keeps taking money out of my bank even though i don’t use it anymore.,1
c230a732-e3d8-45e2-bb78-d2f8dfe9fad6,2022-10-13 00:22:50,"If I could give them a 0 I would, there promo they got going on when you refer 3 friends is a one big scam just to get you hyped up. Does not work at all, the link they give you doesn’t work, doesn’t even show that the referral is in process and when you tell them that your friends signed up and can prove it through a screenshot text of the link, they say no they have to use the link and not exit out of it because then it will cancel the entire link. I’m not even sure whether to trust them with investing if they tried this, unbelievable, wouldn’t even work with me, just giving me a whole run around about how the link didn’t work because maybe the person exited out of it and then had to start all over. TOTAL WASTE OF MY TIME!!!",1
ecc40836-28d0-4209-a95e-85a9ac4eeec4,2022-10-21 20:55:40,The log in is extremely annoying can’t just log in with my pin anymore goes through a 5 step process to log in.,1
bc458db7-5fa1-4b0b-9073-4971f9252d33,2022-04-08 15:51:01,I bank with a local bank and I understand that there are small banks that probably won’t be on here but I wanted to bank with a small bank the same way that I want to shop local. It’s just a bummer because the idea behind this is great I just am not able to participate.,1
5849910e-782d-4687-ba41-5f2d864e70f0,2023-10-24 19:51:19,I put money on the card while I am traveling for work and it makes me feel safe to use everywhere I go.,5
1e96886b-56ec-439e-9225-ab577215d227,2022-05-31 08:23:24,"I haven’t used acorns in years, but never bothered to close my account incase I did decide to use it again in the future. They switched to a subscription business model and charged me multiple times despite my profile being inactive for such a long period of time. They have a 0 refunds policy so even though I never received any benefits I still was charged for something I never wanted nor was ever informed about. They should’ve sent an email about changing business practices before charging people for a service they’re not getting.",1
e7d07d0e-bee7-4b57-8bbf-39023b55d8bc,2023-03-21 05:04:34,"It is extremely easy to start reoccurring investments, but not so simple stop it, and takes way too long to get the withdrawals. They charge you the taxes by the withdrawal, even if there was no profit (or even losses) on you investment.
A $5 monthly fee drains your entire profit that you can possibly make, (which I made none…)
You cannot close your account unless you money is withdrawn, the issue with that is, that because it takes so long for the withdrawal to process, you get charged a monthly fee in between…
I will stick w Robinhood etc. no thanks.",1
236c3bf2-699d-46ee-b6ae-52d9b664c32f,2022-02-10 05:21:53,"I’d highly recommend this app to those who are new to investing and/or starting new retirement accounts. I found the cost to be worth it, but keep in mind you need to be putting in a decently significant amount of money for it to be worthwhile, putting in $20 a month when fees are $3 a month won’t get you anywhere. I’d suggest doing roundups and adding a multiplier. Also sometimes the referral bonuses they offered were downright amazing. Eventually I became more experienced with investing and wanted to have more control over investments in a more aggressive portfolio than what acorns offered so I closed my account.",5
6831522a-4b4c-4e1a-9d1e-7af0996eeed5,2023-03-17 18:40:46,"You might as well invest with Bernie madoff instead of this app? They do scams with other apps , I cashed out on survey junkey for ten lousy dollars and they gave me a hard time and wouldn’t honor it . You need all the round ups on the planet bc a monkey throwing darts could invest better than these losers ! Please go bankrupt . Go to vanguard instead , safer .",1
5f01aa98-ad5e-4c38-8bf0-ba8fbaa3ed1d,2022-11-18 23:30:33,Keeps taking money out when I changed it so now I keep going negative because even after I change how much it takes out it still takes out twice as much. This has made me lose more money than gain because of how many times it’s made me overdraft think twice before using this app I’m very unsatisfied!,1
c21eb9c0-f353-4b12-8a14-f67b92acfcf7,2022-06-25 23:11:18,"DO NOT GET ACORNS!!! 

After opening my account acorns closed it shortly thereafter and told me to talk to customer support I did so multiple times over a two week period and still have gotten the answer that an internal team will review my case in a timely manner. 

On top of that they are still charging me a $5 subscription fee for a service they are refusing me!",1
f4c3633b-6697-4c62-8c5f-e3790e02891a,2023-05-06 23:52:16,So I opened the accounts (both investing and checking) several years ago. I ran into a spot where I could no longer afford to invest and my personal banks checking was all I needed so I closed the checking account and turned off investing. Several months later I noticed that acorns continues to make withdrawals from my bank accounts and the app says they aren’t taking anything but I have withdrawals from the last several months showing they are.,1
b8aad5e1-a480-4655-a246-b349be455848,2023-11-07 19:33:49,"Every single page I click I’m having to close 9 pop up windows, it’s impossible to invest in a specific company. Incredibly irritating, poorly thought out UI.",1
d45cdedd-d896-4310-a1b4-612e6d6103b7,2022-08-10 17:24:30,"Great app when it works but god forbid you need any support. They leave chat the second you ask a question, resend the same canned responses, and close tickets without helping you. You’ll go through at least half a dozen agents to get one question half answered. Maybe consider outsourcing to competent staff who does their job.",1
5df11018-cea7-44db-ab71-c977bb05f708,2022-07-06 01:31:26,Subscribing member for a little over 8 months and it’s still complicated trying to understand all the features and their objectives. App is not as informative as I would prefer. The roundups are the only reason I maintain my subscription. Read disclaimer thoroughly and make sure your absolutely sure and you fully understand before proceeding with certainty in regards to investing anything monetary.,2
2732f327-6bcd-4143-803a-2e81c5db8367,2022-02-01 16:44:42,The returns were decent and with the market avg. The app is very easy to use but the problems arise at tax season when 1099‘s are not available till the end of February or beginning of March. It is ridiculous that I get my 1099 div/b forms from other brokerages the end of January or the first week in February but acorns think acceptable to wait until March 1. I closed my account as a result of this,2
0ec8aeba-f7c1-4977-a8c0-a29e47743a0a,2022-09-22 18:14:01,"This app is quiet advance in the options that you can select with any, but also thought in the simple type of way, easy for a child to understand, but not childlike. Thank you for the great tool!",5
2d4b3605-f000-4000-aaba-926c73af88c3,2022-05-31 21:37:34,"Be careful, once you subscribe you won’t be able to cancel unless you call their support line and it takes a long process to do so",1
793e9d88-1486-4450-97d3-08b7c531b18b,2023-06-21 16:31:21,Make sure you get a verbal confirmation that you have canceled your sub and account because they will continue to charge you.,1
080507ee-9ed8-4377-bf68-0529c2111f1b,2022-10-18 17:27:04,"I love this app because it helps me save money without even realize I’m saving. That being said it can get a little annoying when you forget to update your settings regularly or don’t pay attention to the app throughout the course of a year as your income changes. 
Oh also I think they should have a squirrel as the mascot.",5
2ef8e157-9c48-4f8a-a8eb-7f2ed8f56070,2023-02-04 00:37:35,"I have had an issue with their referral program and have been trying to talk to someone on the phone about my issues. At the end of this experience I was left without a clear picture of why my 5 referrals wouldn’t qualify me for any of their promos even after all relevant info had been accepted from my referrals. Nor was I contacted on the phone after I was guaranteed I would be, twice. 

This company is by far the most expensive option for micro investment, so if you are going to pay for a service where it feels like you can’t interact with a human then go the cheap route and use a different platform. 

And to Acorns directly, no need to respond to this as I have already closed my account and also informed my referrals to close their accounts. Your practices have left me feeling very unconfident in your handling of all of our personal info. 

Again any service you use, App Store peruser, will be better than this. Don’t settle for a flashy UI, that’s all I feel like it has.",1
1d2e6172-3572-437a-9cc7-c4942e7b25d3,2022-12-07 16:00:18,Wanted a way to save for things needed in future and my daughter recommended Acorns since she started account to save for Christmas. I started thinking was a good way to save for Christmas too and when Christmas came did not really need to take out money from Acorn account so just kept on saving. I have the amount deposited from my purchases set at 10x roundup multiplier and it is surprising how fast the account balance adds up!!  Now saving it for major purchases like new HVAC that we had to purchase at end of summer. Now saving for new refrigerator and washer and dryer. I am so glad my daughter suggested Acorns account,5
009e5be7-28a1-4f76-9fc3-a951ab6437a9,2023-05-12 10:35:48,"I canceled my subscription 3 months ago yet I’m still being charged and they won’t respond and they have the worst and impossible customer service to reach. You’ll never speak to real person and it’s a joke, my old credit card was hooked to account that card is cut in half and gone they still taking from that card somehow! DONT WASTE YOUR TIME!",1
c4eff489-590f-41ae-afa4-ad4ba88bc474,2023-08-29 17:45:57,"I should have done my research before hand, but luckily I didn’t go to far. I invested into one account, and had scheduled a small amount into two other accounts on here. They then prompted me to make a checking account, so I did. After it sent me emails confirming the card will be on the way once I put a certain amount in the checking account, the checking account was closed for no apparent reason. I stopped the two other savings account from automatically pulling out however it still pulled money out 2 days later, even though it took them 4-5 days to take out the first one. Then not even a day later, my entire account was locked. In order to unlock they are requesting my bank statements with my name and routing number attached. I attempted to contact them via chat and phone, and agents will assure you they will escalate, but then they don’t. I requested a refund and to close my account, the agents then claimed they couldn’t find my account, then stated they can’t refund or close unless I submit personal information such as bank statements with my name on it and account number to them. When trying to escalate to a manager or supervisor, they say they can’t transfer (I’ve tried chat and phone). After all that, I just had to go to my bank to block charges from this company, after reading reviews it’s evident this company does this where they lock your account to acquire more personal information, and does not unlock it at all all while requesting more information from you. DO NOT USE THIS APP, STAY AWAY FROM THIS COMPANY THEY HAVE LAWSUITS GOING BACK TO 2008 AND USERS STILL BEING CHARGED A SUBSCRIPTION YEARS LATER AFTER GETTING CONFIRMATION THEY HAVE BEEN CANCELED.",1
2e87cc4c-a87f-47ca-9a6b-15d4e437f58f,2022-05-31 15:37:26,"Good product, simple and straightforward to setup….but god forbid you ever change your bank accounts in the system. They demand bank statements to be uploaded before changing any accounts - something I’ve never seen across any financial product in the last 15 years. STATEMENTS? Why aren’t the account/routing numbers acceptable on their own?? Waste of my time and forces you to interact with this CX agents (nice humans, no complaints there) and then never get notified that a fix was made. 

Seriously contemplating ditching this service after being a very early adopter. The hurdles I have to jump through for “simple” changes to my account burns the entire experience.",1
f6178c11-bff5-42a3-a955-63c0cdadd7c3,2022-08-26 16:22:20,"This mentaly slow app, When you try logging in it asks for a verification code from email but when you open the email it makes you resart the whole process starting from the email and password and sends you new codes. Infinite loop and a waste of time! I will never try this app",1
da22d982-9ddb-48c5-ab7f-e3d2ec2d3848,2022-09-09 19:42:53,"It took 6 phone calls today to learn that nothing is resolved. You cannot speak to a supervisor, you are placed on long holds, I am not able to clearly understand those that answer the phone, calls are dropped, and attention to service, detail and quick response are poor. I too was excited when this started, now I want to move my hard earned money elsewhere. Be prepared that if you really need to use any of that money in an urgent situation, that it may not go how they say it will go. Expect longer wait times and possible issues at your bank.",1
d57a98ef-cf40-4d90-8ffd-6aac6af0e10b,2022-01-26 16:28:52,"There are so many options that help accommodate your schedule. Having a family with three kids and not a ton of financial literacy, this allows you just start a great foundation",5
c0510e4b-7926-4614-98fc-78091f10e7b1,2022-02-11 21:37:21,"I had 3 people for the recent 3 for 600 promotion , the same day I messaged customer support to confirm my 600 would be coming and they confirmed. 
After a while I wanted to see what too so long so I messaged support again and they then said one of my promotions signed up a day late which was crazy because if I would have known I would have had somebody else signed up but I was “misled” by the representative . I then asked for a supervisor review. 
The supervisor then calls me and agree that under the circumstances I would still get the 600 sent to me . 
I later received a email from the same supervisor apologizing because they again “misled “ me and I wasn’t eligible.
 This company is shiesty and a big scam and they will reply telling me to call customer service to be back in the web of lies !",1
a7bfcbb4-29ca-413b-880b-9aacfdcb2ee9,2023-03-01 01:26:10,"You guys don’t have us enough time to get the referral bonus, only 5  days it sounds like a scam 
It should be with in 5 days if the referral completed the setup process. Stop scamming people, Webull and RobinHood way better than you",1
678c6285-f555-4bc4-8d24-0756c8bd8fbe,2022-03-16 18:05:14,I canceled my subscription 3 months ago yet my credit card keeps getting charged 5$ a month and when I tried to cancel again they payment didn’t stop,1
dfce6bc8-62f9-4ad5-9b46-658dc3fc077f,2022-01-10 14:10:47,I’ve canceled my subscription with them 9 times and they still charge me every month I’ve tried contacting them and nothing for the last 9 months find a better place to to invest,2
e48c9371-0b00-4ddc-87be-eeb5c35a19ac,2022-04-17 23:22:00,Acorns recently introduced billing fees to users who aren’t even currently investing with the app. It’s a very shady practice that’s meant to take advantage of users who aren’t extremely diligent. Which makes sense because this app is made for people who are lay investors or just want to be completely hands off.,1
5d5e3d7a-7546-4c83-a5f2-76684193257b,2022-03-25 00:11:12,"I have tried about 14 different times to get out of Acorns all together but yet even after all those times of cancelling subscription and closing account, here I am still get ripped off of my $3 every month, this crap is got you stuck paying them at least $3 a month for absolutely nothing !!",1
7e0e2c52-d92d-40d8-9fc2-4ef867a9eb48,2022-06-17 12:36:48,"Acorns is a great app, but it’s not getting better over time. It has stagnated. While they’ve reached that lull point of stability whereby everything works properly, nothing is new. This is always what happens when a company gets investment money; they over-hire and sit on their hands pretending to be focusing on efficiency and scale.

I’d like a Goals feature like Betterment has. What I’d also like to see is their being less attached to the single mode and method. I’d like more granular control over investments, the ability to dedicate funds to specific stocks if I’d like, and just general granularity that can be tucked away so that I don’t have to have 85 different investment apps to buy what I need. What about those who like passive investment for the long haul but are ready for more? A real, percentage-based cashback program would be so much better than this cheesy, commission-based Earn program. Some days I don’t know why I pay the $3/mo. for the privilege of their Spend account when most banks would pay ME to keep my money with them. Spending goals is long overdue at this point, especially for an account I’m paying for.",1
405117e5-cd18-40e5-99bb-7f241f47019f,2022-09-15 15:21:22,"Here is a warning for any potential new customer. I was a customer for 7 years. In order to set up a new funding account due to a bank account change, Acorns requested I upload a voided check from my new account and a copy of my last statement from my old account. I did this on 3 separate occasions. Next they sent an email stating I needed to do a three way call with my new bank to certify the new account. Keep in mind that this is after I verified my new bank and the connection to it through PLAID. I didn’t want to go any further in case they required a blood draw to check my DNA, so I requested they close my account and cut a check to the name and address in file for my account. The next day I receive an email stating “ The check has been requested and will be delivered within 3-6 weeks due to delays in the manual check process.”",1
3379630c-8299-46d2-b7ae-0562946f577f,2023-04-20 12:38:08,Made a withdrawal and instead of going into my personal checking account Acorn withdrew the money causing over draft fees,1
645b426d-3a9e-4473-bb22-cf361c417949,2022-04-24 15:23:44,"Acorns is a great way to learn the bitcoin and stock market with free financial advisors for investing, you pick your risk moderate, high… also start a little nugget for your children, change the legacy of your family with a little guidance and investment. Also has a debit card account and savings so it’s everything you need wrapped in one app!! Great for beginners or experienced investors. Like a tree hunting a nut!!",5
e33ef329-cfb1-4833-bf4f-b5ad377bec43,2022-06-01 15:44:44,"No need for me to waste my time typing the same as everyone else.  Do yourself a favor and simply take notice to review after review stating the horrible customer service, and the normal “copy/paste” response they give to call back and try again. As soon as the market rebounds, me and my 60K are out the door.  I know it isn’t a lot of money and was intended to be a savings account, but I can’t trust folks that won’t talk to you and take things seriously.   I get more respect being data mined by my local grocery store.",1
ee2a59d3-be96-4475-a1a4-29a6044f537f,2022-03-13 17:00:51,"It takes so much to get simple rewards from their promo periods and if you’re lucky enough to get one of their promo rewards, it takes nearly a month or 2 to come to your account before withdrawing it. which takes another 14 business days",1
b464183c-f169-4cbe-ac91-b74ba9f11176,2022-07-07 19:45:07,"Hello everyone , I have recently had probably the worst customer service ever . For about 2 months I have had my account locked multiple times whenever I had transferred larger amounts of money. Talking to the acorns agents was a compete waste of time since all they do is give meaningless apologies and refer back to the customer service number. Recently I had my account locked yet again and when I asked to unlock it and to have my account closed/ liquidated. I would consistently have to “reprove” ownership of my bank and bank statements along with proof of pending amount no matter how many times I keep calling and talking to new agents (extremely frustrating). My but it would not post on my bank because they would close my acorns account. And Afterwards the money would be deducted from my personal bank account but I can’t use my acorns card since they locked it and I would constantly be told to “wait 2-3 days” and the internal team would take care of it and respond by email. I’m simple terms , they would take my money , lock my card and take forever to give it back now Matter how much you complain. You can’t contact internal team directly because apparently they do not have a number and only can use emails. They take forever and it shouldn’t especially when it comes to your money. Even using 24 hour chat support was a joke since they would just refer back to internal team. Point is I’m extremely disappointed in acorns and I was at one point very happy use the app and the card but honestly it’s not worth all the hassle. Hope nobody has to deal with this nonsense in the future. Would highly encourage everyone to discontinue service or do businesses somewhere else. I really hope they fix…. And honest review from an angry customer",1
a8317482-c073-4c54-9bd8-75d2500408df,2022-04-01 19:32:11,"i’ve had Acorns for over a year, I had round ups enabled and never really paid attention to it. Just let the money grow, I got to about $300 in my account and my long-term 35 year projection says I’ll make maybe $30!! I like to have the account more as a back up savings because you really don’t make any return on your investment and the $3 a month charge is WAY WAY more than i’d end up making even if I were to keep it for DECADES!",2
52c479ee-0ac2-40c1-9c58-35001899e796,2022-02-01 13:38:28,"They don’t honor their word at all, they had my bank account frozen for over a month after I provided them with all the necessary documents they asked for and to this date 1/8/22 my account is still frozen. I deposited a check into my account where I cash my check and funded the card, they told me I had to wait for after the holiday Weeknd to use my funds leaving me looking stupid in the grocery store. I never received any rewards from their extensions but I get email saying “ You’ve been an amazing early adopter of our Acorns Earn Chrome Extension. Thank you” But I still have no rewards! I saved the best part for last. If you do sign up for there rewards it takes 120 days before it’s invested for you. Customer service does nothing but send you emails and claims they don’t have a supervisor on duty. I’m embarrassed for the referrals I referred. Receive an email from the app developer team 2/1/22 stating they would like to rectify the situation. I called him this morning from the number they provided on the email and again acorn does nothing the girl didn’t even know what I was calling for I had to explain my whole review all over again and no change nothing , horrible customer service do not come to this place at all",1
b3120969-d099-49c7-9a5f-b7753007e5aa,2023-01-26 23:48:19,"They offered a referral bonus, I participated and fulfilled the signups and deposits, then somehow they delayed one of the deposits to not pay the referral bonus!  I felt disappointed!",2
42a47881-cdf4-447a-a012-1352e980fdad,2023-01-28 05:40:38,"This is a banking/investment group that allows the average person like myself to not only save money and have a checking/debit account, but it also gives us the opportunity to invest in our future with the stock market. 
Anyone can invest in the market with as little as $5 and set up a reoccurring auto debit. You can set up your direct deposit and use the really seriously cool debit card they give you. You’ll be the man when you break out this paper weight for a debit card. I wholeheartedly recommend this app.",5
