uuid,date,review,rating
9d9378c5-bc8a-4729-b083-d4bfd0cd2fb1,2023-09-19 23:02:54,"All I truly need is to marry a beautiful wife (not Igbtq)

that's a good lover to me that wont cheat and mother to my future children so I can reproduce naturally and repopulate my almost extinct race and have a good career a safe home and adventures without hate without fear without discrimination or racism without

experiments or harm or torture or dictatorship I wish to live well and free and be able to provide a safe place for me and my family and so we can always eat well and live well live a wonderful life",3
8b946bd1-c4ee-4e9f-93b6-4dcfeb35de3f,2022-09-08 17:46:22,Honestly this app is actually really soild the fact females have to text u first may seem annoying but thinking about it does make sense I mean if u believe in love at first sight then yeah and luckily I do and it’s not just the in app things I like I always read reviews on apps before downloading them and the fact the developers are actually responding is very and much appreciated all I ask is a lot of these apps turn into tinder after such a strong start what I mean is the developers stop caring at some point and eventually the app will have horndogs and bots as king and queen y’all are amazing just keep doing what feels right and also if another developer replies I hope u know ur currently contributing to something good atm just let it stay that way❤️,5
6a2f8ef2-e964-47b1-9383-507ea9190649,2023-06-18 22:26:57,"First, I’d like to start of saying this app goes against biology in  general, women do not like to take the first step to message a man with saying that the lack of swipes shows a lack of attention from women for almost all rates I’ve seen
Used for 1 year only had 0 meet ups, 1 meaningful conversation and about 10-ish swipes
And don’t get me started on the 24 hour setting that is implemented its garbage no one wants to download a app then have to rush to check it daily 
Lastly the amount of swipes you are given is barely a handful and when you can see that someone swiped on you but you don’t run across them kinda just ruins the experience 

P.S Most ppl laugh at bumble and devs should work on changes or watch app die and revenue dry up",1
5a958f74-49da-4a72-b005-3061ec4bcda8,2022-10-30 01:36:25,"I have been on Bumble for over a year and have made first moves and said Hi and supposedly these men liked my profile, but never had response back from most, so apparently they hadn’t paid their membership, so they couldn’t see my greeting… The second big complaint is that I have had over 4 conversations/ connections with men that were using phoney profiles and were actually scammer Nigerians pretending to immediately fall in love with me, but could never do a video call or meet up and within a couple weeks of texting… start asking for money…
Is there anyway Bumble could do a better job at sorting membership or you just let any phoney fake person join, so the rest of us are exposed to scammers…
It is dangerous joining this dating app.",4
d80afe09-6b1a-43a5-9e92-bb2b80b7810d,2021-12-07 05:03:58,I have met so many weirdos off bumble tinder hily is the worst that is where I met two monsters that I thought I would never even meet these two guys are disgusting and sick please look out for your safety ladies & Gentlemens you never know what you can come across off this dating apps and be you don’t change for anyone love yourself as you are better meet ppl throughout close family members or friends don’t trust dating apps or clubs or bars they can drug you in those public places don’t ever let a guy pick you up outside your house please don’t ever go out with someone at night it’s just not safe ladies,1
7e10c3f0-881c-4872-8936-19ba2994e7ef,2023-06-04 18:25:29,This is what I told Kali the very last time she brought Cheyenne home from the doctor well here yews later I am enrolling Cheyenne at boones elementary school coloring her hair because my daughter didn’t listen and got involved with my father and her eczema husband the one I gave s check for 2500 hundreds a divorce attorney son no going back the lkimg of porn is done!,5
9a847521-d472-483a-8afe-41cb86f597a8,2023-02-04 03:31:05,"this is the worst app ive ever used im constantly getting blocked for no reason and when i ask for an explanation i get nothing im barely even on the app and when i do im jus swiping on people trying to find people to talk to ive never done anything wrong so for me to keep coming back on here and seein that im blocked is completely and utterly unacceptable and ridiculous id give negative stars if i could
ive read the terms and conditions and i know i havent done anything wrong that’ll get me blocked and the fact that nobody can give me an explanation is complete bogus",1
91fbebe4-3469-40bf-864b-805c9ccaaeb5,2022-11-06 03:19:53,I do like bumble but just like every dating app..it just cost way too much..you run out of likes and in order to get more you need to buy them ..you need to buy super swipe..spotlight..boost..and don’t get me going on the subscription price really $40 a month..where in the world you come up with the price..way too much for a dating app..cost more then some people’s internet..none of these dating apps can justify why we should pay $40..$10 bucks a month I can see..we might as well save the money and invest it into something that will guarantee our future or off a bill..I am mind blowing that nobody even talking about the prices..so people get out of your own way and save this money be confident and find your own date it will be worth it since there are a lot of fake profiles..we should not have to pay to see our matches what a scam that part is,1
9a707343-e475-42ad-be9f-5050494a7398,2023-08-06 21:33:27,I love this app a lot because it’s free message and plus I like the speed dating it’s amazing for people for looking for the right person for their future and it’s app it’s the perfect app for me I like what I see on here and I also like about it is 25 likes that’s amazing deal and I have a disability and my reason to join this amazing app is to find the right person for me but so far I have some rejections from the ladies and I enjoy it because I’m learning more about it and so far my part of this app is the speed dating that’s the best thing for me and I also like to swap right or left on here it’s super easy for me to do I’m really happy that I have join this app and it’s safe and secure and happy to use in general I think everybody should use this amazing app,1
9a08d95d-480a-40f0-a5e4-66f7e19bab3f,2021-11-23 12:04:39,"✨Don’t waste my time swiping right if you’re intention is to remain Quiet , 
It doesn’t have to be about “ making the first move “ - if you see a man you’re attracted to wether virtually or in real life , make him aware of your interest in him - simple as that 
______________________________________
This was my bio before what seems to be the entire body of women on the bumble platform reported my page for
 “ bad behavior “
 why’s that ? 
Because I understand that the nature of a woman isn’t to approach a man ?, I simply hold them accountable for their actions respectfully and get blocked with an existing subscription which I’m sure is a waste being that I won’t be refunded the money 

✨To all my kings reading this : 

- focus on yourself 
- delete all dating apps (especially bumble because like I said , it only conveniences the community of women who wanna feel some sense of empowerment being given the right to “ make the first move “ ) 
- approach women in person 
-go to the gym - work on your physical attributes 

and meditate 🧘🏾 

Not bashing this app 
but the creator herself knows 
exactly what I’m talking about 
In everything I’ve stated above 👆🏾 

Peace & Love",1
ef849bdf-21f5-4486-a364-39c65039b14d,2022-11-28 04:58:50,"Horrible app whether you’re using free or paying you will not be shown people who liked you, Additionally I can’t change my pictures on the app because apparently every picture i have on my phone is “the wrong dimensions” and it says I need to pick a video recorded on my phone and women are allowed to post bikini pics but I can’t upload a pic of me in the mirror without a shirt after a workout lol what an amazing double standard on an app that literally doesn’t work, 0/10 app don’t bother installing",1
9c1eee0f-49c8-423d-a095-bd5a9a5946e4,2022-09-04 04:50:48,"I think BUMBEL should allow your likes to stay longer then 24 hours because people have other things to do then to check a dating app when they’re involved with their business and work , i am a married man with a beautiful young lady I feel that you can have a BI SEXUAL app and couples looking for other couples THIS IS ABOUT MEETING PEOPLE, The queen bee from a hive has over 20 males ,hopefully you could add some other options on your dating site this is from a professional businessman and from a professional woman as a couple thank you .",3
b1ab5aa5-badb-47ce-b4b0-3d2aa96cae1d,2023-10-06 21:40:53,i decided to buy one month of bumble premium..for a whole week now i’ve been trying to contact bumble support about the issue of a “cancel subscription” button nowhere to be found(yes i’ve been to the appstore subscriptions and the apple id subscriptions like the internet says to do) i kid you not they’ll answer all my other emails that aren’t pertaining to the payment issue at hand with just a simple “thank you for contacting bumble” coming from someone who has never had an issue out of bumble im surprisingly upset this is going on,1
dd57561d-1be7-46a7-a0ef-d91aad97b2ee,2023-09-15 15:29:16,"UPDATE: I already messaged your Facebook and you told me I was permanently banned and no way of reversing it, for anyone who wants to use it you’ll get banned without proof or cause to show what you did, then if you try and fight it they’ll permanently ban it this app is the worst just go out in person it’s so much better and this app won’t give your money back either

Got permanently banned after no proof because 1 person reported me for no reason, definitely will not recommend this app to anyone and I paid for some features too so I didn’t even get a refund, ridiculous on how with like I said no proof of anything I did I got permanently banned",1
1d706cac-d3d2-4680-b366-f87e117a120e,2022-01-28 13:30:20,I join bumble again after being Catfish on bumble and then I just tried to do it again organically however I said something to a liberal what time conservative Republican Bumble decided to block me and to not let me read my messages or anything after my conservative Republican opinion that I left in a message that someone reported it’s $218 not really worth the time or effort go ahead and a girl at Barnes & Noble or Fresh Thyme instead of Bumble,1
207916ef-d2d8-49f2-ba98-48c2cfd6905f,2022-03-15 16:16:14,"This latest update is the worst—I loved that it used to separate those who were near me/in my required distanceand those who were outside my “distance requirements” were all below in a separate category

Now it’s all just jumbled together and I have to be careful about who I swipe on in my like folder because they could be in CA 🙄 and I know they still have categories like “near me” tabs but it was just convenient to have it all as one group..",2
91166bf4-e6c3-4f8f-84a9-e5f687cbf946,2023-06-07 06:16:12,"I just think bumble has to do a better job of verifying people… especially lately you’ll see profiles where there’s only one or two pictures almost nothing written on the profile- but it looks real and there’s nothing offensive, but
after one or two messages, you realize it’s  a fake profile or a scam -they want to talk on WhatsApp, and move way too fast and act like they’re already in love—

There’s gotta be a way to ask more information when someone signs up on this, think quality not quantity Bumble",2
a059c7c1-bc4f-4c0f-98e7-a64e050a1b88,2023-04-16 21:19:07,App is trash try’s to trick you into paying for vip so u can see who likes you or clicked yes on you then when u do pay for vip everyone that likes you magically disappears and you are left with 2 people who are bots that like you half the girls on the app are promoting their only fans others don’t even really use the app and the ones who do aren’t even real people just bots created by u guys to make people wanna buy vip to see who likes them..,1
6f19e1c9-5ed2-4c04-b67b-4ec43a1adfca,2022-07-27 22:08:14,"Before I just got banned from bumble,then I made a new bumble account,after it I paid for the subscription again it cost a lot of money for me,and u guys banned me again,I felt like u bumble scam me,why if u already banned me ,you keep letting me to made a new account and even offering a discount for monthly subscription after I subscribe you banned me and my money gone,please return my money bumble you said I against ur community but you against the fairness,you letting me in when you already knew I will got banned again,please help !",1
774054f6-ca69-449e-afe0-3d0e3de3f24f,2023-04-07 19:23:18,"Im giving this app a one star main reason being for my photos getting taken off due to supposedly inappropriate content when it’s just a full picture of my face, yet you have number of girls have pictures on their profile with bathing suits or sometimes even half naked I don’t understand what going with the development of this app but it’s happen to me multiple times to the point where my account gets banned for pictures of my face which make no sense",1
f4b57445-303f-42f2-96fa-2fb6f8f50e60,2022-07-08 18:50:38,I like the fact that even though my phone number changed because I have had so many stolden phones and the Mesa police waste everyone’s time and take all there property and kill god on earth for money that I can still get in to bumble now ungortuntly they are so snoopy and such pork and beans that they get in everyone’s private live still through e-mail I wonder if they was a way to have an app like proton mail where if you enter the password so many times wrong that it whips the hackers hard drive wouldn’t that be a concept. Oh never mind my husband Gerrard is working on that snoopy is cool but to be snoopy is not,4
2aacf8e7-e0af-4559-bc27-f6595d7b9df9,2023-10-05 09:43:53,I’ve done everything it said to do on the website for iPhones it was working fine and then I deleted the app because it was buggy and redownloaded it afterwards it wouldn’t give me the option to make a new account it gives me a list of options to login and when I use then it never allows me back into my old account or the app fix this issue a person should have the option to make a new account what’s the point if you get locked out of the old one because of a bug and can’t make a new one,1
78f4aecd-053c-40fb-bff3-8832cfc6bfaf,2021-12-04 22:54:20,It’s literally impossible to get a match with a girl and when you do they will never message you and if they do they are super super dry to the point were you just unmatch them because they’re a waste of time but i can’t even remember the last time I had a match on Bumble it’s been so long but I feel like a lot of the girls on Bumble delete the app but forget to delete the account so there’s a lot of dead profiles on bumble so if you’re swiping on profiles there most likely not even on Bumble anymore and it’s just really hard to communicate with people even if you buy premium it’s still hard,1
36f13bac-ed27-4986-8b4a-0e241c66014d,2023-01-28 00:03:24,"In the pass used to work like 5 years ago, now it filters you or just don’t show you, ALL ABOUT THE MONEY, even if my friend that i liked next to me on the table “to test the app”  and she liked me never showed the match, i canceled the subscription and magically it appears 5 possible matches on the “people that liked you” all of the sudden, so use the app why not but don’t waste your money, trust me i’ve spent a lot of money on it, and it is not about me don’t having matches, it is the waste of money and time, the algorithm is done so you don’t have matches and the cicle  starts again.",2
242b7f0e-e096-4d9f-b86c-75f3bcc43bac,2022-12-11 23:31:25,This is my second try at bumble and sure enough I’m noticing the same patterns I love the way the app is designed it makes it easier if you are compatible with someone but here is what I noticed both times I got bumble I had over ten likes obviously can’t see them because I’m not a premium member so I became a premium member both of the times after that not a single like I don’t know if they are bot at least they didn’t look like bots some verified some not but it’s has been a week since I became premium an not a single like very weird,3
8c52b093-fee7-416c-ace7-a6d4d6fd7362,2022-02-16 01:38:02,"Trying to cancel my subscription and can’t find it now it’s going to screw up everything for me because I am going to have to get a new debit card to stop them from charging me, I have only been on this for two days and I can’t move forward because they want me to pick a cause and I’m sure they are going to charge me for it, not to mention I was looking for a long term relationship and had men wanting friends with benefits, a dating site oh please it is a hook up site",1
b95fe7a7-14c9-4796-9702-413f8afad25a,2022-06-06 18:35:15,"First off the only way its ever worth paying for is if they offer it to you at 50% off bc idk who is paying 40 a month but thats insanity, but if you ever do get it I noticed that they have advanced filters you can add but really the only one that would probably be legitimately helpful is for height, just wondering when we are gona add the weight one, bc that would be worth 50 a month.",3
18ca2543-f0dc-4395-b405-913c869a74bf,2023-03-15 20:22:00,"In today’s climate, I am not advocating for division, but rather for comfortability , it’s very hard to find someone when the people that love you most are usually of your own ethnic background come in as a black man I’m just looking to find other beautiful, black women as well and it’s very hard, considering where I live that the majority is white .",4
24a3dbd2-1449-40d6-9a0e-d7f8ca49997d,2022-08-06 23:46:46,"The app is fine, you get to find friends, date and professional relationships as well, but the fact that I have to pay to see who alphas liked me, after seeing no one that I liked when I downloaded the app liked me back is very aggravating, knowing one person likes me and not knowing who it is, makes this a very bad blue ball to my face, I don’t know how you want to fix this, but it limits people on how they can achieve these goals because of a pay wall, it’s not worth it,",3
5739f381-dcec-449b-af89-4754802ac219,2022-05-12 04:06:49,I just downloaded this to find friends I haven’t had any matches accept for the match that I can’t see without payin In my opinion I think there should be a option to earn free points or gems to see who is a match w us for those who can’t pay :2 other then that I can’t give it more stars yet cause I’m not sure if there’s another way for me to unlock the person who matched w me and is in the lockable match bee timeline.,3
af3fc63f-6a86-410e-a19b-2dba247fafb8,2022-09-04 22:43:54,Hi I was really liking this app at first and I was even thinking about purchasing some of the things on the app but then not even two days from starting up my account I get blocked and it’s saying I was reported for promoting my social medias when I don’t have any even linked to my account I’ve read through all of the terms and conditions and I’m very sad that this can just happen for no reason I really want this fixed so that I can use the app and know that I’m not gonna get kicked off for no reason now I’m scared make a purchase with you guys because what if I do it and then get blocked when I have not done anything wrong my account is appropriate nothing harmful to others and the fact that I see a bunch of people doing drugs when I was sliding through my swipes and that’s bad behavior being allowed and I’m getting blocked for no reason I’m very mad about it I just really want my account back and an answer to why people are allowed to make false reports ruining other peoples experiences. please get back to me I just really wanna answer to why this can happen and why it’s happening to me i’m writing this as a review because it’s not allowing me to email you guys. even if I was to give my social media to one of my matches it’s my choice and normal to talk to someone outside of your app once you meet I’m not just putting it openly on my account.,1
69695562-c85d-4a79-aa6c-2c470c434caa,2022-06-18 02:28:42,I wish there was a way we can get free scroll back like watching an ad or something instead of having to buy it especially if you only wanna use it for one or two people like I don’t need it for a full week month or even a year I just want it for like one or two people Anyway you could create freeways to get some thing it would be greatly appreciated,4
5c82bd43-932c-47d2-aa8d-d3320cfca15f,2023-01-20 00:08:55,Probably one of the worst dating apps to use - super expensive and you get like 8 likes before you have to pay.. the interface is fine but the premise of woman making the first move doesn’t really work - I know it’s 2023 but trying to deviate away from gender norms doesn’t always have cut and dried results.. from what I can tell woman just don’t like making the first move 🤷‍♂️🤷‍♂️,2
fe560440-6619-4c30-9945-83023a895208,2022-06-21 05:27:14,"I’ve used this app for a bit and was getting plenty of matches and met a few people in person from the app, but about a two months ago I decided to pay for a month subscription and got no matches at all so I canceled the subscription and still wasn’t getting any matches, it went from more than a couple new people a day to no one, the exact day that I bought the subscription, I still get on almost every other day and swipe to the limit in hopes that it would be fixed but still a month has gone by and nothing.",2
573a9661-eb81-4190-a1d7-e4b9701f5d83,2023-05-30 12:08:40,"This I by far is better then tinder but my only problem with this app just like the other dating apps is the number of bots you really think is a real person, using real pictures and I really don’t know if the person is real or not maybe I’m the sucker that falls for it but I have definitely ran in to a few bots that really ruin the dating apps for me so I hope there some counter measures for this.",3
f4925579-9cef-4bb6-9690-245d3231dff2,2023-04-22 16:06:37,"though i like the user interface of bumble and i understand that they cant be identical to each other but regardless it is inferior to that of tinders i find it wayyyyy to easy to accidentally swipe on a profile while trying to scroll down it, and for someone who is t paying for the service and has a limited amount of swipes this becomes verrryyyy annoying, also why am i able to post a physique picture on tinder no problem but on bumble its taken down for sensitive content?? a little frustrating, also not a so much of a complaint but i simply prefer clicking through a profile at rapid pace like on tinder instead of slowly scrolling down",2
355f3594-5fa5-4661-9809-2e8ba3955713,2022-10-29 05:05:24,"😁So I was always tired of using bunch of apps like tinder, meet me😔 there was guys always looking for a hook up😒 But I had other plans at first I was like that in a second I just felt like I wanted to find someone you know🥺 but when I use the bumble I was kind of skeptical because I was like you know what bumble is gonna be the same thing like the other ones but to be honest it’s actually not🤔 I actually found my boyfriend who I’ve been dating for two years ever since I met him on bumble🥰 I truly recommend it to anybody who is just trying to find someone special because I just found out a couple of days ago his manager met his girlfriend on bumble so like that gotta mean something rightttt!!!",5
76291f96-3b64-42d6-85a3-567140aaf4ef,2022-01-11 16:18:51,"Is there a way you guys can show more profiles closer to where someone lives, for example I live on Long Island and the app only shows me 15 people then stretches all the way to the city and NJ and so far Can you add more places in New York for your travel mode, like towns.",4
ed9ddd6d-e688-4dec-99c2-0c994b2612e2,2022-02-25 15:24:08,Went upgrading your profile to premium there’s two different levels you upgrade to premium by requesting to reverse a left swipe that’s one way but they don’t give you the option to see your beeline or see who likes you which I think is very untrustworthy either there’s a glitch on my profile which I’ve sent a message three days ago with no reply or that’s how it set up and again that’s not good.,1
