uuid,date,review,rating
c6432a2a-3a10-4841-bc65-84b9ffeafe36,2021-12-17 19:20:21,"I love bumble over all the other dating apps out there… but the most recent update took away the ability to set 2 advanced filters without buying premium, and that’s a huge bummer. A few of those advanced filters are nonnegotiables that I really liked being able to weed out :(

Also the app used to let you swipe by commenting on someone’s prompt or photo… I really liked that feature!",3
a3806315-babb-49d4-a879-7eb79aa4b35e,2023-01-17 00:19:01,I don’t know what to say. I’m a decent looking guy with a great personality but this is my fourth time using and deleting this app. I think the quality of people on here are all a little too judgy and shallow... it seems like everyone is trying to be a model or something... fake and glamorous with ZERO conversation. I’m sure the women are bombarded by sooo many men but I’m not willing to pay after I have been burned in the past on these apps. Sure it works great and you get like 10 swipes a day... but what it really is doing is turning men and women into literal vending machines where all the adventure is tKen out of spontaneous attraction and dialed down to a measly swipe where we all live on instant gratification and people are LITERALLY shopping for a date. I fall victim of this too and it’s just toxic for the human soul to shop around everyday for a date and it never gets a real connection. I would get out and grow so confidence and try to meet people in the real world because I believe this subconscious on demand shopping for dAtes has really destroyed the male And female psyche of attraction. Everything was better in the 90’s,2
af835b09-126b-459e-ac0f-90bab86ef192,2023-09-07 18:06:18,"Bumble needs to either move the SuperSwipe button, have an additional prompt, or at least let people un-SuperSwipe. I understand that Bumble makes a ton of money from people buying SuperSwipes so I get why they have SuperSwipes setup the way they do so people are constantly wasting them and unable to get them back unless they buy more…",3
a677e118-4f9d-4ef0-a97f-75a76a12604a,2023-09-17 05:24:45,I have had normal pictures of myself FULLY CLOTHED LONG SLEEVES and my bio said “dog dad of 2” had a few matches that never sent a first message and one person that I never replied to the initial message. No communication with any other person on the app and nothing beyond G rated on my profile and my account has been disabled and just like you read online they have no explanation. A common theme for these horrible apps. Take tons of money for people and give false hope and have D level algorithms and scores for users and ban people from random people just reporting your account its amazing.,1
686472f1-0dbb-47f9-9e81-9bcdbd4f7fd1,2023-08-17 15:33:37,"This app tends to have the most high quality people on it out of all the apps I’ve tried and I’ve had the most success on the dating scene using this one. 

The concept of it works well because it saves people time in regards to not knowing whether your match is interested in you. 

Allowing women to preselect her matches, it increases the likelihood of compatibility. 

The bad thing is that bumble has the most restrictive character limit out of all of the apps in terms of letting you describe yourself, and the cost of the app means there’s a lot of dead profiles on the app who fled because of the cost so when you’re scrolling through potential matches a high percentage of the profiles you run across are probably no longer checking the app or logging on.",3
b8cb2bb5-16e0-413e-8ccd-8e89802577dd,2023-09-05 15:53:16,"Well to start off, an app where you expect women my age to start a conversation or contribute efforts to first talks is laughable so that already drops my rating to a 3 star. Sadly any matches that most of us will get are either spam accounts, people promoting their nudes to sell and scam people, or possibly tiny portions of REAL people that are not ready for any sort of engagement let alone a relationship.  Hence, you wait 20 hours for their vanity and ego boost then they unmatch. Another problem I encountered was the castle wall of payments to even attempt to change that outcome. 30 likes, literally swipes to say i’m interested in talking, cost $100 freaking dollars. Your premium account price is akin to a Gold’s Gym membership or a nice meal I could’ve spent on a date. 26 dollars a month isn’t breaking banks but it’s stupid considering what you’re giving. All these dating apps must be smoking meth, it is sad to see you set that steep a price and gatekeep what essentially is a gamble on a half built platform. My recommendation would be to try Hinge, I have spoken to and had nice dates with a few women and it didn’t cost me my kidney to arrange it. They were happy with the outcome as well, not being swamped by rich meandering narcissists or creeps because the platform takes care of that.",1
5c85bf32-f567-4162-ac9c-835163e696a9,2022-11-17 22:44:15,Was told by some friends that this was a good app too meet someone but haven’t received one like even though I Completed my profile set up fully and I have the subscription but not a single like in the last two weeks,4
b5fa0b6c-1a78-4e25-a0cf-e62ba8a9d253,2023-08-19 22:36:50,"What this app and its developers fail to realize is, anyone can go on any social media and talk to and see anyone they want FOR FREE, yet they’re dead serious about asking you to pay $60 a month just to like others and socialize, Money grab at its finest. This app is garbage and I recommend never downloading it, the developers of this app should be ashamed of themselves for playing with everyone’s emotions and trying their hardest to play your wallet as well. It’s disgusting how downhill they let this app go",1
3f62052a-545c-465a-bb98-71d4bb14e969,2022-12-16 01:12:50,"I’ve used this app for almost a year now and for some reason u can’t log in or create a new account on either my phone or tablet, i know there’s a lot of people with this problem so i don’t know what the deal is but i know i didn’t get banned because i have no reason for a ban so it has to be because of the app or the services. i wanna use this app again so hope you guys fix it
2 stars for working and no 3 stars because it stopped working when i was talking to someone ):",2
94492b70-a31a-4eba-81bd-4d0b8963e200,2022-04-24 23:13:02,"Has cool concepts and prompts but, just like Tinder, the developers blatantly prioritize profits over user experience. Very basic features are locked behind a paywall that asks for an erroneous amount of money. Additionally my boyfriend and I have been wanting to add a third for awhile, joined bumble, and our account is deactivated not even 10 minutes in simply because we “appear to be a couple”. Those are some of the exact words used by the app and I might have been understanding if there had been a valid reason listed as to why, but this ridiculous rule is in their TOS largely due to the developers views aggressively excluding any form poly relationships. You’ll have better luck meeting people at an Applebee’s bar.",1
c174cfeb-ddd0-486e-935a-f415169ad018,2022-02-24 08:41:35,I really like the concept of the app but have been unable to use it due to their requirement of location services to be on. My phone's location service does not work correctly (puts a state and town I am not in nor do I live in) and there is no way to manually input your location. I have tried reaching out to customer service about this issue and requested even if their tech support could override this and put my correct location in to which I only got a generic response that I needed to ensure my location was on for the app. I wish there were a way to manually put in a location or have a way to actually talk to someone on the app for issues but I guess for now I may need to look at other apps until this gets resolved.,1
63a376e9-78ef-4859-ad67-631072ce56be,2023-05-13 18:55:32,"$60 for a month is crazy 
Just to have unlimited likes (which you only have like 5 likes before they stop you from swiping) makes the app useless so unless you plan on blowing $60 or $30 for ONE WEEK of premium services plan on using the app 3 times a week as you’ll have to wait for it to reload your likes.. 
I feel like if you’re desperate for money use ads like other companies, $30 to see who likes you is just money hungry at that point",3
e1ec78c6-78d7-49e9-958d-16a8c163cde2,2022-03-16 03:05:00,"Pretends to be a women-first app but is actually the worst app for women of all of them. 

Women have to message first but the expiring rules make it ideal for men - they can swipe right on everyone, see who bites, then not reply to whoever they're not interested in - hiding behind the ""expiration."" 

The fact that this is touted as such a feminist movement must be by people who have either never online dated, do not understand or look into actual user behavior, or are just hiding behind a guise of feminism to earn street cred and make money. Gross.",1
5f7d029a-2f47-49b6-aafd-109e92d1a57a,2021-12-02 17:12:58,"I first used bumble when I graduated high school as I was very nervous to really step out and meet people 
Two years later, I’m now in a relationship with a man I met on here and we’re now starting a family. I honestly can’t complain, I recommend this app for anyone who’s excited and has a desire to move forward in life",5
f79d4b8a-01e2-4cee-97d9-6d48b4e46150,2022-03-09 04:11:44,"So Bumble has started limiting likes to encourage considerate right swiping but doesn’t tell their users how many likes they have available before it just arbitrarily stops you unless you pay for more. Is the goal thoughtful swiping and improved experience for all their users or Bumble continuing to move features behind a pay wall? Is the goal of this app to encourage matching, or is it just like the match group apps now? Limiting likes just means more likes for the top 1% of profiles and less matching for everyone else anywhere near a major metropolitan area (if you happen to have an airport in between you and that major city, you’re even more screwed)… online dating is so brutal!",2
0024f58d-6550-4216-9d26-32c5b482bfd0,2022-12-28 16:14:13,"I was moderated for expressing to a religious gentleman who wanted my number immediately that he needed to slow down, and that I had had recent and life-long experiences of people trying to convert me, often coming at me fast and friendly.  The gentleman took offense, reported my description of my own experiences of anti-Semitism,  fear of the church’s missionary activity that I myself had experienced, and request for him to slow down (since he had asked for my number repeatedly), and Bumble punished me by moderating me and warning that my account would be deleted. I am shocked. Also, if you are gay, you will frequently be shown the profiles of cis women. I would not recommend this problematic company.",1
3e52f488-45a7-4d68-b0ea-e09f01f48511,2022-12-21 19:07:32,"The women of bumble don’t know what they want they have an inability to understand genuine short conversation they say hello, hi, at first then later that same day u don’t hear from them. Some might as go far to lend phone numbers. Ghosting is there only means of letting u know they didn’t want to sync up with you which extremely unfortunate because the whole purpose of a dating app is to reach a middle mutual ground between people that want to reach a bond of sorts . All the women you meet are “real” people they just are busy bees 🤭paid for life time service so I’m hoping this changes next year",3
6c63d8aa-7cdf-4d8a-95bd-e7832b588e61,2022-02-08 19:19:01,"I was kicked off the app because of “inappropriate behavior “ when I was doing nothing of the sort, i have reason to believe guys matched me without noticing I was trans until then and reported me for other reasons. The people on here can be rather transphobic and I think the app needs to actually investigate reports instead of just counting up enough to block someone from using the app",5
33b428fe-dde2-41e3-ad6e-7f4bfd4d72b3,2022-04-13 18:55:39,"I can’t tell how many times I’ve tried to scroll through a person’s profile only to end up swiping left or right somewhere in the middle of reading. The left/right swipe motion seems way more sensitive than the scrolling, and there’s no way to really eliminate that problem as a Bumble user in my experience. There used to be a way to go back to the person you just swiped left on once, but even that was a band-aid solution for a more serious annoyance that can cause some really uncomfortable situations having to explain the mistake or else quickly unmatch. Other apps have more responsive ways to show interest in a person, but these don’t have nearly as many users as Bumble.",3
20662df1-07b5-4e54-ad3d-9fed84e5a197,2022-01-02 07:44:08,"I really liked bumble, but the new version takes away the previous “2 advanced filters free” option and makes it a feature of premium only. This puts more work on me that feels unnecessary and puts me off of the app altogether. For me, having similar political leanings is important, and though how compatible your beliefs are will only show through conversation, it seems counterproductive for all parties to make me swipe left on a bunch of people that are completely opposite to me—or, maybe worse, I swipe left on anyone who doesn’t have their political views visible, now thinking the words of them and the unspecified matches this app is sending me.

Change it back.",2
7710479a-ff13-48ae-8157-9267164859f3,2023-07-27 16:06:16,"See the idea is that you have a dating app where women make the first move which is nice except for when guys like me never get matched to begin with. I met my best friend on here so that’s a positive, had an ex on here but now anytime I try and log in it doesn’t load and resets the login screen essentially blocking me from using the app but the thing is I never violated the terms of service or any of the rules and was generally a nice guy to the women I met on this app. It baffles me why I cannot even log in and that’s why I’m giving it only 1 star",1
641c7891-0125-42ef-b38d-3a5bb18b17c5,2022-08-23 07:42:08,"I realize people have preferences on who they like but even though my profile is 90% complete, and I assume I’m not hideous, I’m getting no likes. I’ve even “settled” outside my own standards and expectations in a partner, and started “liking” everyone presented to me; I’m not getting likes in return. 

I’m also noticing a lot of women saying in their profile that they don’t know how to use Bumble so they post their other social media contacts in their profile and that’s how I was able to reach out to those women and communicate with them. I hope a Bumble rep will read this comment and do what it takes for members to have a better understanding of the app before the Bumble Bees leave to find other sweeter resources to buzz over to.",1
f539ab02-ba45-4a10-a04f-7283e75858dd,2023-10-13 08:50:59,"I downloaded this app because a friend suggested it to me, I made an account and waited, saw that someone liked me so I went to see who it was and if I liked them too, but I have to pay a minimum of $30(for one week) a week or $60($14 a week but it’s a recurring subscription) a month which is kind of a rip off. I would post a screenshot as proof but I can’t put screenshots in reviews.",1
5fa1470b-f1f1-4a5a-aa1c-36994857b16d,2021-11-25 02:16:02,"i found my old abuser on this app and reported them with a somewhat detailed response. i received an email from bumble assuring me that not only are they doing everything in their power to prevent him from having/creating an account again, but that they also legitimately are sympathetic to what i went through. the response i got from their support team was honestly more sympathetic than anything my own friends and family had to say about the situation. i rarely leave reviews, but this app is so friendly to women and non binary peeps, it is legitimately the best bet for anyone who isn’t a cis-het male to meet/ talk to new people. from the bottom of my heart, thank you bumble, despite their ridiculous premium fee that i will never pay for",5
14a2a23e-3ac7-416b-bc26-774a23d0d2bd,2023-04-12 23:28:28,"I just got bumble so I can’t say I’m a long term user. What I can say is that there is no shortage of daring apps. I’m old fashion when it comes to meeting women, so to ask for a subscription for an app that should only be used for the short term (by you finding the right girl and never using it again) is like asking an artist to subscribe to an AI art program when they can draw fine enough by them selfs. 
Given the fact that there are some dating apps that encourage you to delete them after you find a woman, bumble presents it self as if to say “just go on dates but don’t actually commit so you can keep using us” and I am no fan of corporate tactics.",1
fcad5c17-151d-4c1c-ae4f-05005d00253a,2022-07-02 14:49:12,"My experience as a queer woman using Bumble:

When seeking, I can no longer access any of the additional filters that used to be free, they are now only available for Premium and Boost accounts. The account that allows access to all features is FAR overpriced now so I wouldn’t even consider paying for it at this point. Since I can no longer filter people by what they are looking for on the app or other similar features to narrow my search for free, I match with a lot of people who are only looking for hookups or casual sex, people who don’t line up with me. 

Additionally, when seeking WOMEN, there is NOTHING but heterosexual couples looking for women to have threesomes, and not actual single women looking for other single women. Bumble absolutely needs to do something about all the couple accounts on this app that are wasting people’s time looking for a one night fetish friend while the rest of us are out here actually using the app for its intended purpose.",1
5f7685aa-28da-43e3-8e7f-b5ab66608b3f,2023-08-20 04:01:30,"Literally had Bumble installed for just 2 HOURS until I got a warning for “inappropriate behavior or content.” None of my pictures contained nudity or even showed too much skin, there wasn’t any offensive imagery or gestures and there was nothing written on my account that was raunchy or rude. I hadn’t even matched with anyone yet to talk to them or go out with them and get reported that way. Never had issues on other dating apps by the way… So say no more I’m out!",1
7e51c9eb-9dff-4de3-b422-0c124eed6ff4,2022-09-25 12:02:41,"This app used to be my favorite, but now all it does is pressure you to upgrade to premium which has tripled in price since bumble first started. It doesn’t offer anything more than other free apps and constantly pressures you through ads and pop-ups that you are missing potential match that I never actually a match based on when I did sign up for premium in the past.",1
817290d3-482e-4acb-a2c3-c66e4061205a,2022-09-14 23:39:53,"So I bought the Boost version for unlimited likes, but recently it’s gotten to a point where I only get about 10 swipes total (both left and right) before the app tells me “that’s everyone” in my area and that I should update my filters even though my range is set to 50 miles and I have an average age range. And when I go back to the app a few hours later without even updating the filters, all of a sudden it can show me new profiles that it had been hiding. So now the money I spent to get unlimited right swipes is completely useless when I can only view 10-20 profiles at a time!",2
6583b343-98e7-435e-845a-505d8e724fde,2023-06-09 20:29:51,Nearly most of the girls are naked or half naked . This is them putting there best foot forward with alcohol in there hand while they go out every night and party and sleep with who they feel like … then expect you to pick them cus they are attractive..😂😂😂😂 haha yeah I’ll pass. Let me leave this online dating world quickly .. B4 I start compromising my beliefs. And give my honor to other men. I only Found 1 girl on hear fully clothed and at least had her priorities in order; “Wife Material” but I’d prefer her over every attractive Female on this sight that doesn’t have any sense… The Beauty I’ll work up to but totally  whoredom I can’t stand .. put on some clothes .. not everyone is interested in ur goods. As much as who you really are as a person. Long story Short if ur reading this; I made a mistake downloading this app.,5
5c6b0e87-ec96-4f0c-ab3a-66ad1d2fc4e5,2023-07-31 17:47:30,"When I go on long trips I pay tend to pay for the month long service but I’ve noticed twice now that under the “liked you” section, I swipe to the point I have no one left but the minute my subscription expires I have over 50+ “liked you”. I’m starting to think Bumble holds back to get you to renew your subscription which is pretty shady in my opinion.",2
f3aa8034-5fb8-427f-9c73-f9558bba48fc,2023-07-09 01:22:42,"Seriously I try to remain humble and I mean that but, I am a good looking guy with a good profile and just nothing?? A good way to tell that it’s another scam app is you get 2 likes once you make your profile and then absolutely nothing beyond that especially if you pay to see who likes you. Also forgive me but, I don’t want a message from bumble saying “we’re sorry for your experience…” if bumble really gave a hoot then they wouldn’t hide my profile from everyone unless I pay top price and even then I’m sure nothing would happen.",1
150fa719-2cf4-439f-8aa5-bdfde2705926,2021-12-02 02:29:15,"So I accidentally purchased a Premium plan a while back, whatever, my fault.  Happened to get off all dating app platforms shortly afterwards until just recently, and trying to get my purchase restored to my new account has been a nightmare.

First off, I’m fairly certain Bumble is the sole app that lacks an in-app purchase restoration option, which feels pretty shady.  As far as I can tell, they also lack a customer service chat AND phone number, leaving e-mail as the only available method.  Initially, I was told they couldn’t find my purchase receipt.  Then, after explaining that I was not the primary account holder in my Family Plan and perhaps it was tied to that email — though it shouldn’t be, as it was made my from previous Bumble account tied to my Apple ID — they stated they had in fact already found it, but they would instead need the payment confirmation from my email.  Ended up providing it in a response, then tried following up and even sent a whole new inquiry, and still have yet to hear anything from them after several hours.

I have to ask, is this an intentional run-around to withhold services despite payment?  Perhaps even aiming at further purchases made out of exasperation?",2
b4ce82b6-60c0-4db3-aac1-8de800fce070,2023-05-24 11:34:14,"I apparently was banned and remain unable to sign in (can't even tell if I was banned because I got zero notification of it). I was a paid subscriber and didn't even get an email back after reaching out via email 2-3x and no response on Facebook after sending 2-3 messages there, too. 

I requested they review my data to prove I hadn't behaved inappropriately, and my pictures most definitely didn't violate any community guidelines. No harassment, no offensive language...and no response or explanation from support, even after I implored them to give me SOME explanation as I'm moving across the country and meeting new folks via the app would be nice. 

Back to the old fashioned way I suppose.",1
32fd8de0-48bf-4454-aa36-91ccaf2a2e91,2022-04-06 18:30:19,"With the facial recognition software Bumble uses for your site, it would be a MILLION DOLLAR IDEA, to ensure the FIRST picture in someone’s profile is just ONE PERSON. 

Half the time you see more than one person in the first picture; it’s “not the one you hoped it would be”. It feels like a deceptive practice and it would help everyone, including them to be forthcoming and honest, rather than trying to trick someone into swiping right and finding out it’s not the intended person that you swiped. 

Otherwise, you’re playing “Bumble Roulette”

I think it’s a sensible suggestion.",4
e5f13ccf-8963-4fa1-91d8-a0d515a7005d,2022-01-16 11:43:46,I can’t believe it’s been over a MONTH and Bumble has taken no claim of responsibility or investigation into the murder of Lauren Smith-Fields who was last seen with a man on this dating site. Bumble has made NO apparent statement on the murder of one of their clients while using their service. This is why women don’t feel safe in today’s dating world. I want to know what Bumble is doing in addition to this investigation to PROTECT its users from tragic events such as this… I’m disappointed and disgraced by your lack of empathy and responsibility. I will gladly change my review ONCE I see the people of this company taking immediate action to right their wrongs and help make their app a safer place.,1
1683c9a6-bf06-47d6-bb13-4dbbea06747d,2022-06-22 03:34:27,"I have been using Bumble dating for a few days and decided to check out the bff part of the app. Now the app is stuck on verifying my pictures and none of the pics I’ve submitted work and it’s stuck on “retake picture” and doesn't let me move out of bff back to the dating site, but none of the pics I’ve submitted work!",3
