uuid,date,review,rating
e8e4c708-3275-4edf-9972-abc80d68c5d2,2022-04-26 00:07:24,"I highly suggest that you avoid this app if you’re seriously looking. No customer support ( they never respond to you when you reach out through the 2 options provided), easily get your access revoked or blocked with no explanation like others have recently stated. I paid for a subscription, and the next day could not access the app (possibly for asking a woman to verify her account).  

Bumble is quick to revoke/block men from the app, but are more lenient towards women’s profile or wrong doings. I’m only going on 36 hours after receiving the automated email response from support, and the FB messenger support never responds and leaves you waiting in que!

Good luck if you’re crazy enough to use. I would highly encourage you to not pay for any additional options and stick with the free subscription, because they clearly state they do not give refunds no matter what. 

I’m going to contact my credit card provider and request a chargeback for the last subscription fee so to BUMBLE’s failure to respond to my support issue 😡",1
75f26e8f-f38e-4951-85fc-7dd9466e46f4,2023-10-01 17:14:52,Not to say it’s anyone’s fault because i understand the quirky women first theme. However our social climate has completely changed people on bumble might not just be the “women” im looking for. (seperate issue) When swiping or getting likes i’ll match with plenty of women or “women” enough as it is but only 1/5 matches will ever turn into conversation because they don’t respond first and you have to end up paying to keep the match there if it’s someone you’re interested in. Personally it makes me think why not just have the timer count down for the “woman” to make the first move and after that you’re given a change to talk to them. Bumble can’t be that blind to the real world social aspect of dating interaction to where they seriously think the match rates and actual conversation rates are in any way similar🤷🏿‍♂️,1
573a5f91-b593-4d50-b9af-8323a30baec9,2022-02-28 16:00:02,"This dating app is absolutely terrifying and the men are rigorously into some other agenda I would say the majority of men on here are out to hurt women. I can see why a woman was murdered on here and the app will not justify this, there are SO many predators on here and if you are a woman not into hook up culture, I advise you to run as fast as you can from this dating site and don’t believe everything you see. Even if couples have successfully met someone in here, I guarantee most of them will have a horror ending and I’m sure most can vouch on this. Good luck ladies.",1
5b9fb23f-eb76-4079-846f-16796d6bfa83,2023-08-04 04:15:13,"This app has the best questions and profile-building prompts and whatnot, and I like the layout, but be warned you may be somehow reported at some point as a minor if you are an adult. I am currently 18, and got the app on my 18th birthday. I’ve had my account deleted twice, and don’t want to send a photo of my ID in order to prove I am in fact an adult. I’ve looked into it and seen a lot of others going through the same thing, too. Either way it’s pretty bothersome as an adult to open a dating app and be told to return when you’re 18, and have to provide legal identification via email to prove otherwise",2
de6af001-72cd-46c4-900f-8a4749efc534,2022-12-10 14:29:46,"I’ve had this app downloaded for the last 10 minutes and within that time there have been 7-9 pop ups past the introduction while I’m swiping.  I’d appreciate it if your company cut it down to 2-3 pop ups a day maximum. If I continue to get more pop ups that disrupt my activity throughout your app I will uninstall, change this rating to 1 star, and use a different dating app.",3
78319ab0-8693-4be1-a16a-c914f6aff553,2023-08-02 17:33:10,"Trash App filled with fake “women” profiles. It’s worse than Tinder now. Great place to find a land 🐳 with a bunch of crotch goblins from random deadbeats. This app is sexist against men, women flaunt their bodies all over their profiles but anything even slightly risqué posted by a man will get you banned without explanation even if you’re a paying member!

Forget trying to get in touch with customer support it’s the same generic copy/paste nonsense you see on all the replies to negative reviews on here.

Also the whole premise of “women messaging first” is so dumb because majority women have no clue how to start an actual conversation that Bumble wrote a whole article about how men can reply engagingly to women openers such as “hey” & “👋”. Great job Bumble y’all made the most trash dating app",1
c39f6274-f671-4063-bf18-2c19ef214d2f,2023-06-06 19:44:44,"Bumble thrives on the loneliness of people and if they genuinely cared about match making and did so properly, they’d eventually not have as many paying users. Therefore, it’s in their best interest to actually stifle your success at finding someone. With that said, they have a plethora of paid tiers all aimed at getting you SLIGHTLY closer at meeting someone, but there’s also some other service you gotta buy: boosting your profile, unlimited swipes, leaving complements, etc.

One night I wanna a bet with a friend and had some extra cash and decided to give bumble premium a try. I thought that with the ability to swipe unlimited, for SURE I’d make a good number of connections—WRONG. At one point it got so ridiculous, I stopped reading profiles and just mindlessly swiped just to test my theory that their algorithms were actually geared towards preventing me matching with people. Unsurprisingly, even after quite possibly HUNDREDS of swipes, I got maybe 2 matched, no lie. Either I’m that ugly of a dude (which I don’t think so since I match reasonably well on other apps) or they’re putting me in some kind of queue that, unless you pay for their “boosting” service, you won’t be seen ever. 

Don’t buy premium, in fact don’t pay for anything on this app, it’ll be a waste of your money. I won’t be buying premium again, stupidest waste of money.",1
d469299d-7242-46b6-b12c-bd36e8a2c5df,2023-05-31 11:50:40,"If you choose non-binary, as your gender in the app, they match you with genders you’re not looking for, which makes the conversations that much more awkward.
They also moderate out photos that would be appropriate for one biological sex, but not for the other; killing my ability to express my true self to potential friends and partners. then, when you submit a Support case, They reply with the same canned response multiple times.",2
07f1fb3f-08e4-4836-ad40-0f5d2ca48a3c,2023-01-10 22:42:19,"It’s great idea, puts the ball in the woman’s court or contact me. However I don’t like the fact that I only get a handful of swipes every day, I’m already at a disadvantage in the dating world being older and not as attractive as I use to be, so limiting my likes seems punitive cause I’m a guy. I will never pay for anything that I don’t get a guarantee from, so when the makers of this website can guarantee me some sort of success, I won’t pay for it.. I find myself straying to the other dating sites that don’t hinder my activity in the dating world.",2
cc38aee4-029b-4c27-8fc1-bd8da3eb9ae2,2022-10-18 20:32:06,oh right you tell me how something can be validated for over a year and then all of a sudden not be adequate enough for verification. also explain how a headshot that works one minute doesn’t work the next minute this app has some serious issues and the developers need to fix it or else how is anyone supposed to use this app if you can never upload a photo. this is beyond the worst experience I’ve ever had with any app.,1
e7004529-efc1-4e76-bab0-832e0740ee03,2023-02-13 21:49:59,I’m getting married to someone I met on bumble 😭and honestly i didn’t even know what bumble was until my coworker told me about it but this was second date on this app and bam! Next thing you know our wedding is on July 20th 2024😘 thank youuuuuu,5
abecf668-0227-4095-8dde-ca3840a732fc,2022-12-13 04:13:17,"I’ve only just downloaded bumble a few days ago, but I’ve been experiencing a ton of freezing and glitches. Every time I accidentally hit the Beeline info tab, it freezes the whole page and I have to close out of the app and go back in. If you swipe out of the app to go to the home page without closing it fully, when you return to the app it’ll be frozen again and you’ll HAVE to close the tab fully to get back in. 
Other than that, I feel the algorithm has been helpful so far, and though there are more rules about the profile pictures allowed on the app than tinder for example, it’s not annoyingly so. I like the extended profile style and the questions make for interesting conversation starters.",3
f4c28cdf-1e18-4df1-b8e0-d94cfcc8a160,2022-01-07 04:13:59,I have been using this app for about 3 years now and unless you pay don’t expect to match with the person I’m not saying you won’t match with people you do but the time goes by and they never responded probably because u match with them 2 weeks after they match with you so for the best experience you will have to pay,3
9ad37c90-0165-472d-8d21-d8c4e33d4133,2023-06-01 03:56:23,"Not only is this site a desperate ploy for party-line “feminism”, but the user experience is wrought with ad pushes, fake notifications, and obviously, ads for purchasing their premium products. To top all of this, they will withhold your potential matches from your feed until you pay for their premium service. I really tolerated all of the other nonsense until I got fed up with the bumble ads popping up on my Lock Screen throughout the day. To everyone, I hope you find something better",1
9ffbe5d4-5066-4751-9e20-91c52756a017,2021-11-20 13:11:35,"There are so many areas of improvement needed
To name a few
1 why limit my searches to your set number of available partners? I should have unlimited previews
2 you allow partners to post their profile without answering profile questions. This this ruins my view of partners as the defined categories I set are not adhered to by others
So I am forced to erase all my parameters just to see the availability of potential partners. So in truth the number of available true partners is very limited
3 omit the women whom have noticed me from my search for partners. Once i go on search you place those women at the forefront of my search. Thats unfair as it hasnt given me time to look at their profiles

To name but a few",1
a526012e-88d3-44ef-b336-1e598b3dfc5f,2022-06-14 16:18:19,"I’ve use the app for a while now & while the idea of a woman messaging first isn’t a big deal, the guidelines for photos are ridiculous. I see plenty of men shirtless or in swim trunks while not in a pool but their photos are still allowed. I live in a warm place where you are constantly in a swimsuit so a lot of my pictures reflect as much. However, per there guidelines, these photos are removed due to me being in a swimsuit while not in a pool. That’s not only ridiculous due to me wearing a one piece, it’s verging on sexism that men are allowed to be equally as unclothed but can keep their pictures.",3
03e15b86-5332-473c-9829-871a32d60899,2022-03-24 00:59:35,"It’s awesome that it asks however when asking who they should show your profile to there are only two options men or women and it won’t let you select both. And there’s not a both or gender neutral option, which means I assume you’re asking do you have a male anatomy or a female anatomy. Kinda disappointed and not sure if I want to continue using the app because I’m unsure if my profile will be reaching the right audience",1
35efc987-9ab4-42fe-9972-d00fc09cb0c1,2023-08-12 23:24:37,"If you’re a guy who lacks confidence and needs a woman to make the first move, then welcome home to Mommy. If you’re a girl who has bought into the victim oppressor narrative but is fine with controlling and dominating men, then this app is for you, actually all dating apps were made fore you. Except for one thing, the best men left apps a long time ago and are looking for relationships elsewhere. Not because they want to go back to a time when men dominated women, but just because they want to be in equal footing, and feel free to embrace the positive side of their masculinity. Like being bold, decisive, courageous, protective. How can you do this when apps like Bumble force you into a submissive posture and give women too much power to kick men off the platforms for acting “inappropriately” as defined, or not, by women. Are women happier with this new found power? Not in my experience. Statistically, they are opting for other women, or dogs, or seeking out therapists to figure out why they can’t achieve satisfaction in their relationships. And apps like Bumble are part of the problem. But the good news is that this is mostly a US phenomena. So update those passports boys, because it gets much better as soon as you cross the border in any direction except North 🇨🇦 hahaha. And we’ve got a great group of men and women working on a solution to dating app disertification, so stay tuned.",1
9f90d49a-dfa0-4889-b96c-657c8aa83936,2021-12-12 14:47:54,I’ve had a lifetime sub to this app for a year but never used it. I not only heard but saw that swiping left on too many people causes your profile to be virtually tucked away and dead. So participating with the app on that part is non existent with me while I am looking for either man or woman it still dose not jive well with me that the app is primarily focused on woman alone. A minor complaint but it definitely makes me feel unwelcome on the platform.,3
e64b5283-fcad-4399-8e0d-f774586300a1,2023-07-03 19:36:42,I have been trying to get my account verified with the photo for a week now keep getting the run around with support they said it’s fixed once I logged in something with this photo just find a different dating app as they do not have live reps to even help with issues with even getting the account started. I have the same smile. I recommend just snapping a picture for profile so you will have on same clothes and all but shoes to say that will work as I asked for my profile pictures to be removed and I still keep having the issue mind you I have also connected my Facebook which I didn’t want to and still not verified.. I SAY FIND ANOTHER DATING APP THIS ONE BOGUS SEEMS,1
1b447d81-7146-4fca-b136-fb0473cc9adc,2022-03-22 23:59:53,I used this app before but deleted it and then reinstalled The app when I visited Raleigh for 3 days and I met the love of my life on the first day. That was about two years ago and I just got back from taking her to Paris to propose to her….so yea there’s that.,5
ac5c4cfe-57a4-4133-88b5-ae9366f3af97,2023-09-10 13:28:18,"Bumble used to be the best app out there — in a world where everything is owned by the super greedy Match group. But over the past year, I have noticed them slowly going down the rabbit hole of valuing money over helping their users build meaningful connections.

They’re taken away the two free advanced filters for users who are not subscribed to Bumble premium, meaning if you’re looking for a relationship, certain values or anything else, you’ll have to swipe through a sea of people who do not meet your wants/needs.

Even when you pay, which I have, they continue to show your profile to men who in no way shape or form meet your filters, which is frustrating. Once my pay period is up, I will be deleting this app for good.",1
a6f3c532-bd04-4264-9969-c2a35e1eda45,2023-02-28 18:33:17,"Great app, plenty of talent and if you do opt for any of the upgrades available for purchase, I have found them to be well worth it.",5
993c961e-a4d1-4c37-b61c-f19041d927bc,2022-02-07 03:20:32,"I think all dating apps has its pros and cons but what Bumble lacks is putting it behind apps like Tinder (I hate to even compare it to Tinder) and Hinge. For example, Tinder at least has the feature where you can search numbers through your contact list and block them from seeing your profile in the app. I wish Bumble had a similar feature because you do see a lot of the same user profiles in most of the dating apps and I’d like to be able to block someone that I didn’t necessarily connect well with or from having a family member or coworker see my profile. Also the 24 hour match feature where the woman has to message the guy first and wait for him to respond during that time or else the match completely disappear is just not right. I sometimes go days without checking the app because I’m busy with work and life in general or choose to take mental breaks, before logging back on and then finding my “match” has disappeared. I’ve lost many potential matches this way or some that I’ve messaged and they don’t respond with the 24 hours. At least give the woman (who has to message the match” an option to extend that message time so that maybe when the guy logs back on, he has a chance to see the actual message.",3
cc907fac-9089-4b38-8e9b-f80c44462e6b,2023-04-24 15:18:17,I don’t think it’s fair that I paid for Bumble Premium and was disappointed. It says you get a spotlight every week HOWEVER if you didn’t use the one from the previous week it doesn’t stack. So I was saving my spotlight and waited another week so I could use the 2 spotlights I’m entitled to but end up finding out it doesn’t stack so I essentially didn’t get to use the spotlight from the previous week. I feel cheated out of a spotlight that I could’ve used and if it gives you a spotlight every week it should say you need to use up your previous one because you’re not gonna be able to stack it with the one from the following week.,1
5320b3fe-1cdb-46c1-9a99-3baed3e10125,2022-04-08 15:02:32,"Someone used another person’s pictures and created a fake account. They really played me, made me buy into their whole story about how they’re a neuroscience post doc researcher at OSU, naming buildings on campus where they had labs, etc. They were using all the buzzwords and lingo a neuroscientist would and I fact checked everything they were saying, so I wouldn’t doubt that part is true. It went on for two days until they finally came out and told me they’re not actually the person in their profile, that they were just trolling me, and calling me gullible for believing them. I cussed them out in literally 6 words and reported them. It was so depressing and I felt like an idiot. Then get this… Bumble bans ME?! I reached out to customer support and they said they “investigated” it but they’re still going to permanently ban me because the company is “rooted in kindness, respect…” If they actually read through our entire conversation history and did their job right, they would know how royally they messed up and have it completely backwards. I am just appalled by the whole thing. I also paid for the premium membership which I’m sure they’re not going to refund me for, so add getting robbed to the list.",1
52f14ad7-490d-4b8a-aaa3-9bd0149c19a2,2023-04-12 17:26:28,"Bumble flips the social norms so women get to make the first move, however many women still want the man to make the initiative and first move making any match on bumble pointless. 
From the point of view of the women friends I know that have used this app, they’ll likely get ~100 matches in a day and of those they’ll decide which 2 or 3 they actually want to talk to and leave the rest to expire. What’s the point of ‘swiping right’ if you have no intent to contact them.",2
b49174eb-b41a-4dad-8ebc-62c8e4330278,2022-03-27 20:34:53,"I find a lot hilarious that bumble has recently started asking me to give my matches some sort of information about myself (past what’s already in my profile) to help them send the first message. I love the idea of girls messaging first but only ~1/20 of my matches say anything more than “Hey”.

This new feature completely defeats the whole business model of Bumble imo. I use almost every character in all three prompts in my profile so if that isn’t enough for a girl to start the conversation then maybe the idea of this app is slowly failing and I just need to go use a different dating app.",2
e9a63e6b-9838-49c9-ac27-dc85cb438ecb,2021-12-01 13:29:33,"I suppose I sort of understand the ladies are given the opportunity to communicate first because there are so many stupid males (not men) who don’t know how to act. But it does put a burden on the gentlemen who frequent the site in that we are deprived of the opportunity to initiate respectful communication. In the proper role of leader, just as asking to take a lady in a date or proposing marriage, initiating conversation should be on him. If she chooses not to respond that is certainly her option. And those males who don’t know how to act should be given a warning if they are complained against then barred if it continues.",3
688a88e7-f57f-41cb-a774-3425ff9e5db2,2021-11-17 15:54:13,"So I’ve downloaded this app several times and I’ve been banned 3 times because I am “not older than 18” I’ve tried with my email, phone number and Facebook and the 3 time I’ve been banned. It is very frustrating that just because I look young they assume my age and tell me that I’m not older than 18. I contact the support team and they were like “oh yeah we blocked u because ur not over 18, and if u think it was a mistake you’ll have to send an ID” I TOLD THEM SEVERAL TIMES THAT IM WILLING TO SHOW MY ID CAUSE I AM FREAKING 21, they never apologized and treat me like I was a teenager when I’m obviously not. 
I had the same problem with tinder but they were so nice and apologized for their mistake, they never treated me how bumble did. Such a bad costumer service",1
08c74f64-abdb-4c85-8e1e-f0b1c2dfc739,2023-05-10 14:23:30,"I’ve been a loyal paying customer since Bumble’s inception with a multitude of positive experiences had. Unfortunately, it appears I’ve suddenly been banned without rhyme, reason or a refund for my paid subscription I just purchased last month. What makes it all worse is the utter lack of response from every single channel— from creating a ticket literally designed specifically for figuring out why an account is banned, to direct messaging on twitter, I have received absolutely no assistance. Refund me for my purchase, or renew access. It’s one or the other. All else is illegal and will be pursued further as such. Judging by the myriad of identical instances throughout these scathing reviews, I would prepare for a Class Action Lawsuit coming your way.",1
28e3a0ba-46ec-498d-863c-d58edd276461,2023-02-16 05:32:55,"The app is fine, but no matter how many times the two men (one who sexually assaulted me and lies to women as a habit, and one who found and harassed me on other platforms after I blocked him) get kicked off for their bad behavior, they keep showing back up in my stacks.  These men should not be on dating apps and they keep getting around the bans.  It’s traumatic having to see them pop up over and over again even after I’ve blocked them multiple times.",3
0d5a8562-0553-4e50-8a37-47ef8caecac0,2022-03-26 13:51:18,When I initially joined Bumble I liked the idea of messaging first but now it’s irritating because sometimes I don’t get response back. When I do get a response back they last maybe a few messages then nothing like they think it’s alright to end it without saying anything. I wish it went both ways were the guy could message first because that would let the person know it could serious if he started the conversation. Overall it’s good dating app that brings awareness to present day things and a good way to make friends or more it just takes time to weed out the bad apples to something good.,3
0a2f5ece-e921-487f-9881-28b06f688474,2022-02-02 19:07:45,"Like almost all of these dating apps, they don't care about you meeting people or making meaningful connections. Dead giveaway is the fact that you anything of value is behind a paywall (10 swipes per day, not to mention Bumble is ridiculously overpriced). Certain features like spotlight are understandably going to cost extra but I’m not paying you for a “backtrack” on a stranger due to accidentally swiping left lol. Better environment than tinder but worse features and most certainly a worse app.",1
7f3dc4f7-de68-416e-906b-d2a7a753fa4f,2023-05-03 00:22:40,"The gesture detection is AWFUL. Literally half the time I wanna scroll down someone’s profile, it swipes left and they’re gone forever. Beyond pathetic UX from your talentless hacks you call engineers. Fire them all.

Yeah no I just swiped for another five minutes and I literally just can’t stand it anymore it is just so clear that you are desperately trying to force user error so that you can compel users into buying your premium service. This kind of emotional manipulation is frankly, vomit inducing, and every single one of you involved in it should feel ashamed and not be able to sleep at night.

I’m deleting this app, and I literally never using it again and you’ll never get a single cent out of me. And every single time the topic of dating comes up I will make sure to rip this pathetic app to shreds so that people do not use it.",1
40c6114a-19fc-4899-abf2-09b4784c9332,2023-01-02 22:53:08,"So it’s been a few years now since I’ve used this app, we have two kids and married last year, but this is the introduction that led us to meet. We both did long distance hikes the same year, me PCT and him AT, and coincidentally should have met, but this app helped make the connection!",5
