uuid,date,review,rating
40a24e1d-099b-4100-952a-3f5e7a9cce3d,2022-08-03 07:00:25,They block my account due to sexual harassment I’m premium member as well if I’ve done something like that they have to warn me as well but they didnt and they block my account infact they not responding any of my email very bad .,5
7dd5e4b6-970e-43e6-9ba8-228ab33bce9c,2023-03-04 15:49:53,It’s a good concept but there are a few things that ABSOLUTELY MUST BE FIXED first of all I’ve had over 30 matches and out of them maybe 4 have actually responded why are people on here and matching with someone if there not gonna talk second I try to play this stupid speed dating thing every single week and it always says there are over 3500 people playing and 200 in my area yet it constantly says there’s no one in my area so I can’t play . It’s ridiculous.. there should be some sort of penalty for people matching with your not even bothering to talk if you can’t make the first move,1
fdf01b85-facb-43cb-b70e-16cc6bbbbd71,2022-12-06 02:07:16,"I’m 21 years old and got banned off this stupid app because someone reported I was under 18 when I’m not and bumble refused to do any type of verification process before just banning me; therefore, I wouldn’t use this app because if some decides to report you bumble will just listen to them without doing any kind of verification process for you to prove you’re over the age of 18

Bumble I don’t know if you are going to respond to this again but no I’m not going to do that do you wanna know why? Because when I try to y’all just said oh it’s because you’re under 18 when I’m not you guys have no customer service number no email you guys are a terrible dating app",1
d0730acc-5f48-4561-b0b2-b22cef7f3ba8,2023-04-18 22:29:23,The app interface seems pretty decent I haven’t unlocked all the features just yet wish they offered a trial period because it’s kind of pricy for something you’re going blind into,5
5a368628-5387-41aa-aae8-0d822b962cb0,2023-04-13 11:11:48,"This app is so quick to ban someone because they put an Instagram handle, all the girls do that and literally almost all the profiles are girls shaming guys for anything and everything and they don’t ever get reported…sometimes these women will have racist bios and it’s ridiculous this is a feminist app and all these girls get away with whatever they want and the guy gets his money taken. If you try to report someones profile for promoting misandry you get blocked..that’s so dumb.",1
40b647eb-6c7e-4c44-92f0-896cba715295,2022-11-03 22:53:19,There was another review on here saying how it doesn’t allow guys to text girl even if they add each other which is ridiculous this has to be the dumbest app you can get to meet people get Wiz instead they’re not money grabbers like these guys.,5
7b7f3deb-454a-49f4-b3a6-562f3d006051,2022-12-22 19:18:46,"This app really needs work on photo verification, I’ve sent multiple pictures to get verified denied every time even thought it’s me.. I’ve contacted support but I got the same generic response, I tried again today for the last time same outcome had to cancel membership no need to pay for no reason. Either the system is racist or I’m just too ugly for the program to notice me for verification I guess hmm…",1
a0974dea-860f-449c-90f8-dea4261400e1,2023-09-11 03:16:53,"Let’s try this again since my last review was deleted Bumble, like many other dating apps, employs a freemium model, offering basic features for free while enticing users to pay for premium services. While profitability is essential for any business, Bumble's strong emphasis on monetization at times overshadows the user experience. The continuous push for premium subscriptions and in-app purchases can sometimes detract from the platform's primary purpose of connecting individuals.

Bumble's unique approach and focus on female empowerment have contributed to its popularity, it is important to acknowledge the impact of its profit-driven approach on customer experience. The app's heavy emphasis on monetization, limited free features, technical issues, inadequate customer support, and intrusive advertising are areas where Bumble falls short in prioritizing its user base. As a consumer, it's crucial to consider these factors when deciding whether Bumble aligns with your expectations and preferences for a dating app. That being said look forward to the generic response of contacting customers supporting via Facebook, twitter 😩😩",2
d763426c-02dd-4def-bda6-dfea92df474e,2022-02-27 20:12:18,Not only did I have to pay through itunes which is my least preferred method of payment (would way rather just enter my credit card or use Apple Pay) but I paid $7.99 for bumble boost and i checked my bank account payment was posted and i went into bumble app and the unlimited extends feature WAS NOT UNLOCKED I GOT SCAMMED BY THIS APP. Will be disputing the charges with my credit card if this is not fixed immediately . UPDATE Bumble support never got back to me after contacting them via multiple avenues so I had to contact my bank and cancel the charges.   They also intentionally designed the app to swipe left on the slightest touch to the screen so that you accidentally miss a match and have to buy bumble boost my review is still one star I would give zero stars if I could,1
699a5fd7-3fe9-4f1d-8615-64db333f1405,2022-11-05 16:38:17,"Bumble use to be awesome when it first dropped, now you get 5 swipe rights unless you pay, it’s full of people who “never on here follow my insta”, a month or so back all the matches just stopped or if you do match they just time out after 24hrs, seems like it’s turned into a money grab instead of focusing on being a good dating app to help their community! I’d rather use tinder or Hinge at this point because it’s just not worth even trying bumble unless they fix whatever stupid decisions they made a few months back!",1
e5987357-d1c5-4574-9f26-649ce762f709,2021-12-25 07:46:09,"If you’re working 40+ hours per week, it’s gonna be hard to meet someone when you have a limited time to “go out.” With Bumble at least, at the minimum, it puts you on the radar —> that you are single and interested in meeting someone 🙂",5
970b01f8-54a5-4f63-b1e4-197e672f6659,2023-10-06 19:16:46,"It seems like every dating app is pay to play nowadays and that’s fine - but Bumble has become just another micro transaction money grab scheme; constantly bombarding me to purchase “Spotlights” and “compliments”, pushing the narrative that my projected success on the app hinges on spending more money for greater visibility. 

A $30 monthly subscription obtains only the most basic features like unlimited swipes, 5 superswipes (which supposedly gain a greater level of attention from potential matches) and 1 spotlight per week. If you want any greater visibility it’s $60 or more per month which is absurd for a mobile dating app. 

Speed dating almost never works, and after “searching for matches” and “expanding search distance” comes back with a prompt to buy spotlights at $2 a pop, which actually bare zero relevance on the speed dating function - yet another sign of a money grab scheme preying on a man’s loneliness. 

Overall I have not had much success with this app, and while I readily accept my part in that, I have to say a lot of it comes down to an app which seems far more focused on gatekeeping and maximizing profits over quality of user experience, especially for male users. 0/10 would not recommend this experience to anyone I know. I’m better off at a bar.",1
18b7271e-d0fa-4c51-adb3-2ac08b8dac0c,2022-08-24 01:27:29,It not a good Choice someone asked me to verify my picture 25 pictures later still can’t get back to the main page after six emails they still will not fix it but they will get their money so my choice would not to sign up with Bumble,5
a441f2bb-baad-4f46-9266-bb4b64369266,2023-02-18 19:13:00,"I tried to log onto the app, but every time I log on it, it won’t let me go into it and most of the times it will work, but the problem I have with it’ll stay on the screen with the login options and I did an update for the app but I’m still having the issue’s and this issue has to be resolved because this is ridiculous.",2
025da8a0-1b00-4586-8cd4-ab8f859c0d3c,2023-10-07 22:24:47,"The app is good, easy to scroll by…
however, at least in my case, it has successfully accomplished its purpose, thanks to it, I met the love of my life about 8 months ago, we both swiped, I hit him up first, ended up in one marvelous date that turned into more dates and lastly a wonderful relationship, I love my boyfriend and never thought I would meet someone as lovely as him thanks to bumble. ❤️❤️",5
d043dad7-9507-459e-9ca8-2068f3c92d23,2023-06-10 02:48:38,"Somehow, no matter how hard I try to only use it for hook ups, Bumble finds someone that makes me reconsider what love looks and feels like, the second try healed wounds from the first. I found someone to make me whole and when that left I returned calloused from past pain, only wanting to hookup, but instead I found someone that changed my world again.",5
602d6c4e-f797-4027-b118-c1098fbc0d2b,2022-05-16 01:04:35,"I loved bumble, used it more than all my other dating apps because I felt like I had better luck with it. Even used to pay for one of their packages because sometimes I swipe too fast, but then randomly one day I open the app and I was banned 🥲 and I’m not the type to try and get banned and always followed the rules and I truly enjoyed how safe it seemed, but when I tried to appeal it or at least understand why all of a sudden I was banned they refused to tell me and said the decision was final with no reason. This was pretty upsetting mainly because I’ve tried reporting people for being weird/creepy yet I would still see their accounts and somehow I got banned with no explanations.",1
e46054e3-d074-4761-b055-294beba4133c,2023-01-01 23:10:30,"Unless your “tall” (6’-6’5) have colored eyes, light colored skin, that’s the only time you have a chance at getting woman to respond first. Any guy 5’7-5’10 is too “short” apparently, and if you have a semi dark complexion you 100% wont get swiped on or just ignored, the best part of all are the woman on this app who put “text me first” as if the app isn’t designed for woman to be the ones to message first.",2
b92abcef-c6c1-48ea-ae7b-0f55bb19cedf,2021-11-19 19:54:34,"The concept of the app is great, and I've purchased the one-week premium subscription a couple of times over the past few months (I'm not on the app all the time), but I hate how - once the subscription ends - if you didn't use the bonus Spotlight and SuperSwipes that came with the premium plan before the end of the subscription period, you lose them forever. It feels like I'm getting scammed when I can't keep the things that I've already paid for... Annoying.",2
4953a8f4-caa9-4683-86b9-8e8ae3f8e8ad,2022-03-12 06:33:11,I purchased the premium version for one week and I went through all of my likes and had none left and at the end of the week the app updated and it said that I had exactly over 200+ likes so I waited a few days then finally decided to purchase the premium for one month and after my payment went through the number of likes dropped from 200+ to 50 instantly. I honestly enjoyed the app and wanted to continue to use it but after my one month is up I’ll be deleting the app due to the shadiness of the number of likes  just to get you to purchase a subscription 👎,1
6a7482d2-3fa4-4869-8a5c-6263766d5a0c,2022-01-30 06:27:55,"I have used Bumble for a few years now and even though I haven’t found a match, I like the little reminders when I don’t check in after a few days. I really like that you can confirm in real time using pictures that the person your talking to matches there pictures and are not a cat fish (the blue shield). I also like and don’t mind the tracking of my location and find it very helpful when seeing other matches locations to know about how many miles away they are from me ( especially when I don’t recognize some smaller towns or county’s). I do think that part of the app needs an update because my home location isn’t listed as an option and it doesn’t differentiate between different county’s very well ( like my locations of Summerfield, Belleview, Ocala or Wildwood FL).",5
268779ba-7aca-47d7-a997-f482a1401c08,2022-02-21 13:46:51,"I’ve used every dating app at this point and I saw bumble had a deal for permanent members for a 100$ so I bought it.
I kid you not I get 1 match per month on this app and their response was my pictures are blurry. 
I really only date other girls of my culture just to make my parents happy but ya out of all the apps bumble had the weakest results and it’s bad cause I bought premium…

On Hinge I get 1-2 likes per day without premium and as a guy I guess that’s a lot versus the standard 100 per minute a girl gets.

Bumble said: use “clear photos” but my accurate guess is they did something to make my account show up less or they make it so your seen a lot when you first start using the app and when you make purchases. 

Try 
Hinge 
Culture specific dating apps (if you have to please your parents)
Tinder
- Bumble is at the bottom

End experience for a daily user for a month and I’ve had it for about 6 months 
I’ve gotten 9 matches… 

On hinge I’m sitting at about 200 
On tinder I’ve had about 60 ish over that same time using an identical photo setup

Best of luck!",1
990b99ba-add0-469b-ac3d-6675401867f1,2023-10-24 04:52:57,"I decided to test out the paid features for a week, lost two of the five super swipes already to simply trying to scroll and touching the wrong area of the screen for a moment as that button activates immediately. Making matters worse in my opinion, they clearly would rather charge you to fix mistakes than design a better UI. For example if you accidentally decline a match, it is possible using the paid tiers to “undo” that swipe (although it is not possible to undo a right swipe, even if you wanted to go back to actually see the profile). This sort of design leads me to believe that the ease of accidentally activating super swipes is likely intentional design, not an oversight.",2
e08fcb6c-41e5-4bbb-9c1f-a59f86fabe04,2022-10-10 03:09:14,"Having used this app on and off with no success so far, it seems populated with roughly the same kind of people you would expect on Tinder, though the app is made to provide more detail and help ensure you find someone with the right personality, like I tend to want to instead of simply engaging in hookups. However, the dual features of matches expiring after 24 hours and only women being able to respond first to curb harassment makes it rather difficult for people like me, the good-intentioned though usually overlooked users, to be easily ignored. I have actually seen less engaging matches on here compared to any other site, even Tinder, and those matches usually have me requiring to respond first to start anything. It’s a shame because the app is structured well and provides great features, but it fails to let anything flourish for someone that normally does not make first approaches out of fear of rejection but does so on these apps. It can make using the app feel worse than simply doing nothing, something I have experienced multiple times.

Also, I have been both a free and paid user with the same outcome of nothing when using this app as either status.",3
a3fa7375-a60b-4c61-85ab-b73e622d7df9,2023-07-09 14:17:30,"When they say they want women to message first, that’s fine however the biggest thing this app is filled with are sex workers and onlyfans models who are looking for a quick paycheck. Bumble banned me because I didn’t let this girl scam me with getting me to buy her onlyfans content. Essentially this app is ran by the lunatics encouraging women’s horrible decisions, steer clear of this app and use another one unless you want the 9/10 matches you get trying to convince you to get naked on camera, watch their boyfriend do gross stuff to them, or get you to pay for their stuff. I think it’s ironic how they banned me for “Sexual Harassment” over a woman telling me i’m a misogynist for not buying her onlyfans.",2
7f14bb92-f4e0-40c7-ae09-6b455183afac,2023-09-06 04:09:13,"I just got the lifetime premium which I’m so glad is an option and I’m enjoying the improved experience; still, at night and early mornings when I most want to be online I can only do so for 15 minute intervals because the eye strain of not having a Dark Mode is significant. Also I wish (Ultimate) Frisbee was an interest option.",4
38c6246f-48a8-493f-9822-71b0d62ec6cb,2022-12-09 16:37:09,"Once we reach the end of the accounts in our area, we’re asked to increase our distance I don’t think we should have to do that I think we should be able to recycle the ones that we said no to and the ones we said yes to an a chance for a greater connection in the future",4
d2a73d5d-953b-4205-992b-60a325519db3,2022-04-15 01:03:36,"I’m not a big fan of online dating but bumble seems to be the best out a flawed system which often leads to both sides trying to take advantage and manipulate the other before they get used and manipulated. However there are a few kind and sincere people who aren’t looking to play games on this app so if that’s what you’re looking for and have a lot of time and patience then you’ve got a shot, and if that’s not what you’re looking for then you’ve got a bigger shot!",4
464bd3a5-67de-4f4e-baf4-9e7cc969cb1f,2023-04-24 13:12:23,"The app works well however…

I received a warning for promoting commercial content, however I had absolutely zero commercial content promotion (i.e. I wasn’t selling or promoting anything), yet many people promote their OF profile or direct people to their insta profile.  Whether this was an AI scan or a legit report from someone - they need to be more transparent about how their reporting works because their current model is “guilty until proven innocent”",1
d0a8aa67-6fc5-49b4-b4e0-bbdbf117c1f8,2022-05-31 22:52:25,"For example: location preferences don’t seem to work very well; also very frustrating how potential matches can pile up (even into the hundreds) without the app ever showing a single one to swipe on - only seems to be temporary though. the verification feature is nice but I’ve seen a few profiles that were “verified” while displaying photos of the same person - still, it’s helpful that you can filter out most (if not all) of the fake profile by choosing to see only other people who are verified",3
308a8e73-afc2-491b-a9cb-278b090dac3d,2023-08-14 04:09:00,"Listen we all know there’s a large percent of people on this app that are only here cause the other banned them (probably for no good reason) i like the function of this app and it normally works well except for the worst feature; the expiring matches, I have missed so many matches with awesome people because i was busy in the 24-48 range you get to message someone. It is ridiculous and not helpful for meeting people especially when you have adhd like I do",3
59207826-a8b9-4b39-91f2-ca796afc9f78,2022-01-03 07:29:58,"My Bumble account was “moderated” - meaning my bio was deleted entirely- simply for having the words “kink-friendly (Dom/sub)” in it. After changing the wording to reference only D/s, my account was blocked. When I reached out to the customer service/feedback team, they refused to provide any transparency into their decisions and instead kept referring me back to their opaque “guidelines,” which effectively give them unlimited power to delete your content or block you for any reason, based on their sole judgment. Bumble claims to be supportive of all sexual orientations and gender identities, but this does not extend to people who openly and decently communicate their kink identities only to other people who choose to engage with them about those interests. This ought to be illegal.",1
73959e2a-cb74-425a-817e-d2023a28f2cc,2022-07-05 14:28:23,"Before being able to continue to swipe, bumble forced me to affirm my gender but to add insult the option for BIOLOGICAL WOMAN does not exist but rather the made up terms those in society with gender mental illness made up for biological women is an option. I’m not a cis woman, that term doesn’t exist because it was made up. How dare bumble an app that’s entire premise is to give women power in dating literally exclude the actual woman that exist under science, biological women who have ovaries and can actually procreate as female in the human species or better yet not to insult those who can’t have babies, those with the XY Chromosomes. It’s insulting and the opposite of female empowerment. You can’t be an app for women and only list non women as women and use made up insulting terminology to identify women. Biological women need to start coming after companies like this to defend ourselves and protect the future of our children.",1
b1cfaeea-dfd4-434a-aab1-5d877a42e8ef,2023-01-19 22:03:20,Me and this woman matched and I like how it has the females have to msg first however after a certain time of you both being matched and no msgs I think it should allow the male to msg first. Cause I really think this person seems cool and would love to connect with them and maybe even take them on a date to see where things go but I can because there is no socials linked and I can’t msg them no matter how many times I extend our match.,3
55e58bc6-ff9f-4f67-a1f7-6d4341c20066,2023-05-08 02:20:45,"Guys not trying to be a downer but dear god $120 for 3 months.
Why not just call it sugar daddy’s R us and at least be honest.I mean half the females are just insta ho’s lookin for money anyway your already 70% of the way there.(not blaming the app for the clientele just saying) I remember when this app was reasonably priced a few years back so I thought I’d give it another shot saw the prices just to see who likes you and noped outta there. Also yes you do occasionally put them in the deck for the opportunity to match for free users but they don’t stay in the beeline long enough in most cases due to running out of swipes making it extremely impractical if unwilling to pay those crazy prices. I know you need to make money but you’ve priced out half the under 40 community at least.",1
ecb69384-4a6c-46fb-b1f6-5a1cff52634e,2022-08-08 00:09:21,"Can you provide an explanation as to why its so expensive for premium features?? Other apps with similar features do not charge as much, just hard to justify why I would pay almost 50 dollars a month to see who likes me.. so i’m curious to hear from developers as to why it costs so much. I know I can use it for free, and I do, but from a business perspective, if you cut the cost in half, im sure more than double the people would opt in it… 20 bucks from 10 people is the same as 10 bucks from 20 people.. no way your market research shows that 45 bucks a month is the optimal pricepoint…",3
d692027d-41be-4bc2-93c5-3ea64c382fcf,2022-02-09 20:34:06,"I have tested this twice already, you pay for the subscription then they scam you by blocking the account so you can pay another subscription. Genius scam for such a failing company to rescue what’s left of the failed IPO and save the leftover shareholders. I will file a BBB complaint  ( not that it matters to them ) to attempt and get my money back that I never got to use, I deeply pray I can do a class action lawsuit so anyone who got scammed by them get their money back.",1
345faa66-25a1-421c-b710-48d7c2b73c63,2023-03-28 10:12:44,"I made a lot of good people, one thing I don’t like about it is, when you match for the person, the lady has to reply your message first and sometimes they forget to send a message which limits people from imagine really 24 hours range",5
2fbcdf5d-5b58-432a-a1fd-6809f6ae2347,2023-01-21 15:31:20,"I don’t mind using a site to find a connection but it’s pretty annoying that as a curvier woman, my pictures are removed every time I’m in a bathing suit or in a dress with cleavage showing. I’ve written about the moderation a few times and how the algorithms aren’t very accessible or friendly for women who have a delicious curve to them, but nothing seems to work. If you app isn’t accessible, that’s problematic, no?

UPDATE: Moderator response continues to be contact us “if you think we’ve made a mistake.” I have contacted Bumble to complain directly at least three times about this and have the email chains to prove it. If the algorithm is not going to be updated so it doesn’t find my bikini pictures on the lake “revealing”(despite seeing thinner women in the same attire with their pictures cleared), I’d rather not reach out every time this happens.",3
ed853111-4d39-4ed9-814c-6352dd6a6569,2023-09-12 14:23:01,"App is fundamentally unusable without premium severely limited likes all features paywalled, constant bots and repeated profiles and algothrim prioritizes profiles that don’t match what searching for and ignores filters.

Update: if I possible I would rate zero start developer contacted to say contact support showing they have bots go thru reviews to make it seem like they care. How would support work will they actually let me use the app instead of overcharging just to like a person?",1
