uuid,date,review,rating
3d0cc198-b57f-4192-8081-029ac06f8fac,2021-02-03 20:48:08,"Then Robin Hood app introduced me into trading back in 2017 I started doing my research and developing my trading skills so I will feel more comfortable linking my bank account to the Robinhood app and be able to make my investment from my own phone, butRecently after everything that happened on Wall Street I wasn’t able to put money into my favorite crypto currency because due to the high volume on users and a high risk on losses for new usersI was restrictedTo only be able to invest on crypto once my deposit was confirm from both parties my bank and “robbing hood “ I am really upset by hall Robinhood change policies for all users overnight, they could’ve led people with seniority still be able to make their investments with the instant deposit, overall it’s a great platform it’s a great appAnd it’s available for almost anyone that wants to start investing on their own bud let’s not forget it that this is a lucrative app linked with hedge funds and others.",3
6243f037-9d59-43fa-b98a-e8d6d4082021,2021-03-20 01:22:38,Have something in the home display where it calculates and shows your current portfolio’s yearly income from dividends and maybe a section with a graph to show that growth or maybe a bar graph were you can compare the dividend income from one year to another by month for dividend investors so they don’t have to use third party programs to track it and can quickly see their approximate yearly dividend income and maybe you could come out with something like a drip loyalty plan where so that if they agree to use drip only that they get a percentage off of those shares from it because if you already know so much is going through to that stock maybe you can plan for this in advance by getting those from the market makers in bulk for cheaper because you know those dividend drip payouts boost that stocks volume,5
3206f60e-c6cd-4912-bcf6-c7986112f41a,2021-05-12 22:15:23,"This app is trash it was OK when I first got it but now absolute trash I just missed out on crypto because the app wouldn’t allow me to purchase it it told me I had zero buying power and yet there’s over $1000 worth of buying power in my account tried to contact them wouldn’t let me send a message multiple timesI tried now I’m wondering if I can even get the money that I originally put into it out save yourself time money and aggravation don’t get this app absolute Trash with a capital T 

update
They finally wrote back to me too little too late the opportunity has passed they were unable to fix or even have any idea what the problem was they contacted me about margin which I have no intention of using or wanting to use The problem was I couldn’t purchase a particular cryptocurrency I don’t know why I couldn’t at the time now I can but it doesn’t matter because the opportunity is gone and I can confirm again with absolute satisfaction that this app is trash with a capital T if I could give you zero stars I would don’t bother wasting your time.",1
aa786bf9-2c50-4ec1-82c3-c83c1d6adc82,2022-08-11 23:13:28,I’ve contacted you guys for months I told you somebody took administrative control over my email that was connected to my Robin Hood account illegally I told you that after I closed my Robin Hood account they opened it back up or it never closed on their phone told you they took money from me I haven’t heard back from Robin Hood in months I would hope that I finally hear from you after writing a review because now the federal government has finally picked up my identity Theft case of I sure would hope to hear from you and we can make things right before they come in I just want what was mine back and I want to know the people that did this to me aren’t going to be able to do it again but if we don’t make this rightBefore this hits the quart room it’s gonna look really bad on your guises part I don’t think you guys need any more bad publicity then u already had,1
8629796c-ed48-48ca-9eaf-6cbaab1572b1,2021-02-01 16:52:33,"Want a loop around customer service and wait for days for any help for another loop around of crappy customer service 

I gave ID and now they want me to email social security card after I gave last four of my social ..waiting over 2 months and they give you a spin around put you on hold nonstop..hopefully it’s not issues they purposely place on minorities...

Also they keep throwing at you an email a 3 day wait for customer service to assist but not really assisting .... one of the worst services you can expect and they ask you to send picture copies of your social security card ...usually they ask for last 4 of the social ...is that really legal to ask for copies of it through an online app that has bad customer service (over 3day wait ..same letter when you respond too )",1
643bbfff-69c5-40ac-9d0a-47cd00bf4b5b,2022-06-21 15:12:55,So I’ve had an incident where I recently got a new phone and was trying to log into my Robinhood account and I didn’t realize I had to update the phone number after I got my new phone so I called the customer support team to help me and it’s been six months and they still have not updated my phone number so I can use my account and at this point I really feel like they’re kind of just withholding my money and it’s kind of uncomfortable considering that they have all my bank information and credit card information and they even contact the support team and ask them to fix it and they said they would get right on it and it’s been six months and nothing has happened really really bad customer service would really recommend never using this app they don’t do very well in helping their customers when there’s a problem and they don’t seem to really care very much as far as the fact that I asked for help and it seems to be that nobody’s helping you within six months very very bad customer service would never recommend using this app again,2
f4a8add4-ff0b-44c3-b297-963141282b90,2021-01-28 21:14:42,"I got the app to be able to do all trades, small, big or whatever, but seeing the market manipulation hapoening here is simply horrible, rich people managing the app can't take that healthy competition from your average Joe, just because they started trading for stocks that were believed to fall in price and when they saw a lose they couldn't take it and in a temper tantrum removed the trades on those stocks you tell me if that is not trade manipulation, they end up shooting their foot, lawsuits coming for the app don't look nice and in a way well disserved, the app is good but this kind of actitude is childish and shows that maybe it is not as trustworthy of an app, who knows maybe they can go to your account and be like, hey you have to many stocks no more trade for you, you are making to much money and I don't like that.",1
bd4469fa-d87f-4184-a5f8-2135f7bad58e,2021-01-29 19:53:55,they are the complete opposite of a robinhood as they so call themselves they manipulate users into their game of buy buy buy into these stocks providing you with a false sense of security by not allowing you to buy in or sell out and times most critical to you and your wallet the operation of this app isn’t as free of a market as they make it seem they will cancel your orders and sometimes the orders do not even go through and they still proceed to take your money for a failed or non executed order once a sell is made with their crypto the funds do not immediately return so you could buy in at a better price they instead make you wait long periods of time before you can reinvest this is saving the rich from the working class because the boys in the suits are losing at their own game and robinhood is backing the rich instead of the working class people that are just trying to make some money like everyone else so my advice don’t invest with robinhood they are very sneaky and have proven this week to be very untrustworthy!,1
047d0962-b820-48c2-ba76-df0dcd0ea2a8,2021-02-03 19:46:03,Taking my money out ASAP biggest manipulative company and app I’ve ever seen you say your for the little guy but take the only win we every had so far in decades and cut it short well sir in charge you have layed your company to rest I hope for the sake of what ever soul you have left if any and I pray you see just how you hurt the human race with your actions it’s written into history now nothing you or anyone related to you can do to erase or correct that wrong you a stain to the human race not in anyway good you sir are a puppet and I hope you stay trapped behind your strings for ever,1
a18e43ac-a801-4360-a637-cf113dad674e,2021-01-28 21:43:56,"Robinhood otherwise know as the people’s retail stock trading app today has caused heart ache to many Americans across the USA, they failed to allow a free and fair market as we were always allowed to do prior today they have halted stock and completely disallowed buys and sells on certain securities, today is Robinhood reckoning i pray in a year that this review won’t even be up anymore as Robinhood brokerage firm goes under and files for chapter eleven may the new age of trading be Upon us brother no longer will we be held back by the hedge fund and 1% who believe they are the only who have the right to a free market they think they have one the battle but we will win the war.",1
86b7b68d-a2d5-493e-8def-e40270921f7a,2021-05-05 23:50:27,"Robinhood reminds me of the new world that I discovered when I was exposed to windows 3.1 in 1992 back then computer was so difficult to deal with and boring 
My whole lives changed for the best
No more DOS writing commands 
I remember looking at someone computer screen in Manhattan whiles I was doing an electrical repair 
He was buying stock  placing orders over the phone while looking at his computer screen 
Then he looked at me and said this is not for everyone 
Thanks robinhood for opening a window of opportunity that was once denied to me 
Today I am economically better than what I was in my younger years 
Thank you and keep up the good work 
Financial freedom for everyone",5
aae11845-185e-4ff5-aeac-356d3af5b300,2021-02-17 16:05:05,Someone please fix my account can someone please explain why is my account restricted I need this problem resolved I can’t bye  cryptocurrency or stocks due to restriction I tried to contact RobinHood but still no response I don’t want to transfer my Brokerage account to another I want to remain with RobinHood and I want to continue purchasing stocks and cryptocurrency whit RobinHood I like and love the platform of RobinHood but I can not do anything because I am restricted from buying oh and I can’t even use my RobinHood debit card that’s also restricted oh and I almost forgot I can’t even transfer my cash value on RobinHood to my bank account if someone from RobinHood is reading this please The only thing I want is for my RobinHood account to be fixed if this cannot be fixed within this week with Shame  and forcefully I will have to close this account because of your guises mistake restricting my account with no explanation,1
cb2a67cb-159f-48ca-ad4b-58e369dadce2,2021-05-20 12:38:39,Better the news report make it faster make it as fast as it came out Select of buying by percentage we set up Let us buy with bid or ask Lets us sell by percentage When we are selling stocks and fractional shares let us sell everything Shows us the graph when buying or selling Copy your competitors and implement the most useful things just like you did with options recently Notifications for out watchlist earning coming soon let us put at less 1 month in advance or out time desire Alert .just copy your competitors and make it better simple Let us borrow against our investment implement what rich people do with they money that’s what I’m saying Make the app feels like for rich investors even tho they are not make it happen,1
5267f089-8c95-4f4a-aa62-611124c62e5c,2021-01-30 11:33:01,I ended up buying some riot stocks last at 18$ and when it went up to 24$ I tryed to cash out but of course the app didn’t let me log in was telling me my password was wrong the funny thing is that I have the face reader on so I don’t need the password but I still ended up getting a new password but guess what it didn’t work so I tryed to get in toutch with someone at robin hood but guess what that would never happen bc this app is a joke there phone # don’t work n what they did to me should beIllegal n from what I seen in there Twitter this has happen to so much ppl n Google help hide things this app had 1 star bc they take your mom so just stay away ...,1
35c3740c-1b18-40d4-b8c6-87bf0615d1d6,2021-03-15 21:07:21,Robin Hood is a great app for the beginner with that being said there’s a lot to improve it’s very difficult to get Lehmans responses you get generic responses back when you contact their customer service via email Robin Hood is supposed to be for the beginner it doesn’t really explain a lot of things for them to understand like margin calls being locked out if you do more than X number of day trades that you should look up will call you a pattern trade or just look at that you’ll put a buying or sell of your options and Robin Hood will cancel it without any email is to explain why it got canceled somethings will sell really quick in Robin Hood other things will sit and ponder the universe for the next day Very hard to sell pre-market or buy pre-market,1
84b73e4c-4909-4c9e-be12-e81710bc2a5e,2021-02-03 05:53:11,"Here is a few things other than Robinhood’s recent restrictions on buying stocks 
1) Robinhood sells your options an hour before the market closes, let’s say you have an option contract worth 50$ at 2:00 P.M. and you chose to wait till 3:00, Robinhood sells it for lower than market price ( it doesn’t market sell )
2) what happened with Reddit stocks can happen with any stock on a volatile day, however it didn’t happen with KODK, let’s say the volatility was too high with GME, Robinhood is still unprepared for future events. To understand this better if everyone at Reddit chose AAPL instead, Robinhood would’ve still done the same as it doesn’t have enough money to clear the sales, which again brings back false advertising 
3) people committed suicide cuz of Robinhood’s exploitation of amateur traders by lucrative margin offers and stupidly ridiculous user interface which is claimed to be user friendly however in stock market you need informative interface over bright colors that make it seem like a game 
4) options are going to ruin the stock market due the bubble they create, Robinhood made this worse by approving amateur traders to trade options, for example I convinced my friend to create an account in Robinhood with a portfolio value of 300$ and 2 days later he got his options enabled, same guy who banks with chase and had an investment account with them for over a month with 2000$ in portfolio value got denied.",1
a16631b8-1346-4046-9401-3a7a232e733f,2021-04-16 13:24:44,"If you want to make money go to a different company,  i was in line to make several thousand dollars in profits when the price started to soar like i had anticipated it would and invested accordingly to only to have robinhood block trading 2 times during the peak rise of price on me and prevented me from selling at the peaks of the run and they only did it to the one stock/investment all other stocks you could buy and sell but when my pick rapidly climbed they block trading and allowed people to buy at high price but blocked selling untill price dropped again,  robinhood will manipulate your trading and selling ability to prevent you from making a large amount of money in a short time they are a fraud and should be put out of business i am looking for a new company to do business with because robinhood is a fraud and will screw you.",1
6e9e1785-6770-41a1-b4bd-fd90398f00e0,2021-01-09 15:25:45,So apparently I couldn’t recover my account because I need to verify it with either my phone number or my email but when I try using my email they said they didn’t support email verifications anymore so I had no Accra to my account because I don’t have the same phone number anymore and I tried logging in my old phone and when I did I tried changing the phone number and apparently to change my old phone number I had to verify it with the same old phone number so it made no sense how can I verify it if I don’t have the Same old phone number and why can’t ya let us verify it with our email on top of that I call and Robinhood don’t even answer phone calls and when I send my I’d pictures apparently my case number and the documents couldn’t be found,1
f1bd39ca-6aa4-4394-bd2c-ec461d192fba,2021-02-08 18:48:42,I love what you guys have done you guys have revolutionized trading for retailers like us app is amazingly user-friendly for beginners really well thought out but the biggest thing we have to have is a level playing field what happened with the GameStop and a few other stocks recently really hurt could trust that I had for your platform and I ended up losing chunk of moneyBecauseYou guys didn’t allow us to purchase any more stocks have a lot of money but instead I lost money but it’s the principle of what happened to lose trust I personally still feel like you guys do care about us the small investor and some of your explanations were helpful but still not too sure other than this incident I would’ve given you a five star rating thanks for all that u do,5
c09bcdb8-b20f-4ce4-b287-9f63997efa39,2021-01-29 02:12:12,"Just opened up my Robinhood a couple weeks ago and was initially enjoying the experience then the game stock event happened, while many of their users were heavily interested in a number of stocks they froze all access to the ability to continue buying those stocks, thus preventing them from being able to protect their investment by purchasing more stock as the prices dropped and giving all the advantage to the large hedge companies, this event is exactly the opposite of what the original Robinhood stood for so once this trading event subsides I’ll be deleting the app and finding a new one, until then I plan on investing some money in the stocks they froze because what they did was totally wrong, gotta join the good fight!",1
4404d357-a9c9-4cd2-93f0-e279ee35389a,2021-10-29 15:25:41,I don’t recommend this app at all they take your money I do not recommend this app whatsoever I started with them last year and I had a lot of problems every time I will make option trade on option call they never sell it for you every time I made a trade I will make money ready to sell it I will sell it and they will hold it until you go negative and then they’ll give it to you not good they are thief and they will take your money eventually Robinhood will take you money 💴 eventually Robin Hood will fall down also I was trying to sell an aoptional trade for the past two weeks they never sold it they waited until it was negative and then they gave it to me I still believe Robin Hood is a thief my experience with them was not good I don’t recommend this Aapp for anybody that wants to invest and make a progress with your money,1
135f4d47-4b56-4978-a891-bc18c841f975,2021-03-28 23:51:15,The only good thing you can expect from robinhood is user friendly for beginners because of the easy interface other than that i dont see any pros the cons tho smh theres too many first of all the daytrade restriction that you cant day trade more than 3 times a week unless you have $25k in your portfolio which is retarded and not to mention the lags between the fills and also poor customer support which takes days to get back i'd say save yourself some time and download thinkorswim its better in everyway easy customer support quick fills never lags and better charts + more stocks and etfs!,1
7178647a-8294-42d7-a95b-7774acada68a,2021-06-01 02:02:32,Well I’m know nothing about investing but I been please since day  first then I follow my intuition with cryptocurrency I to told my son and lots of the employees to invest cause this is the year of crypto worldwide many of them laugh about me saying something that sounds very crazy to them... but finally I changed their minds they have start investing their afraid to invest but said to them don’t be is the year of the ox so lots of money will come to US so you deserve a five star though lots people for whatever it happen with game stop and Robinhood love your system is easy to work with (forgive and forget and start from zero.,5
c69c036b-4135-4aec-9abf-ba347cadb5f7,2022-05-09 14:13:50,I’m new and for some reason cannot use my personal email address to sign up and if I can’t get simple help with that like how TD Ameritrade customer service with quick live agent help me and to get my bank account connected with sooooo much great help did just to figure how can I get my normal email address in system instead of me making or using another… it’s saying My email address is already being used so I go to reset password and it keep giving an error… so I’m imagining what if I had a money issue how would I communicate to get an explanation front fast🤔… nah you y’all ain’t Robin from This Hood….😂👎🏾✌🏾,1
bbe2673f-111f-4aca-a06d-41d80465d535,2021-01-30 21:09:54,It appears as though Robinhood will freeze your account whenever they feel like it I put in a limit order to buy Dodgecoin it disappeared 25 minutes now $738 don’t know if it’s coming back put an order with the last eight dollars I had to buy some more despaired no notifications can’t cancel them the menu page just says check your net connection my Internet connection is fine everything else works fine except the Robin Hood app they froze it because of the volatility of the trading on the market right now I’ll be getting my money back I don’t recommend using this app at all,1
8b70cfdd-8538-4f16-bc5f-5dfea82a15f8,2021-01-28 16:26:49,Robinhood was about stealing from the rich to give to the poor but when the poor finally win they shut down the stocks we are winning on because Wall Street is mad January 2021 robinhood has shown it’s true colors and intentions the same people that own robinhood is the same hedge fund manager getting shorted they can treat the stock market like a casino but when we do it as smaller dudes we are stopped immediately Robinhood is rigged to keep the poor more poor even in the middle of a pandemic when people have learned to trade as a source of income Robinhood shut it down and screwed over the smaller trader who don’t have thousands to toy with ....Scammmmmm,1
596271d4-7b2a-43c7-84a0-9f566d0c20ce,2023-03-06 19:08:26,"Don't waste your time , its very easy to set up and they will take your money and verify your identity very easily , but if you switch  devises or try to use another devise you will not be able to transfer crypto , they treated me like i wasn't me after months of transferring money in and out of my account ,  I had every piece of identification you can think of , but i had a issue with my device so I had to wait 3 days to get  verified in the meanwhile I lost money     , I missed payments i needed to pay with crypto    And was treated like a criminal by customer service , don't waste your time  and money ,,, look at their stock and review's it will make you think twice about the platform",1
ec4ad3c5-c98d-4a86-a758-6cede852eee1,2021-01-28 16:39:42,"Listen Robinhood made me over $10,000 over the last year alone like the platform very simple easy to use this whole thing about them wanting the people to get into stocks the common folk and then today they restrict free trade where we can only sell our stocks instead of buying into new ones because Robin Hood is being squeezed by Wall Street and is caving in to Wall Street’s demands Robinhood is not standing with the people Robin Hood off their actions have sided with the big banks and Wall Street I’m taking my finances and going elsewhere somewhere where I can actually buy the stocks I want to whenever I want to so I can make the best money I can instead of being forced to do things because Robin Hood is being manipulated by the suits",1
ffe1ed6f-2799-4c5b-972b-5c8f80123e15,2022-11-24 00:37:42,They will ban you from trading if you try and day trade then will take your trades out when ever they want even tho you have been holding for over a month because they said there was a bank error even tho they took the money out of my account without problem when I placed the order and didn’t change a thing about my bank account then just one day they will just take your trades off the market and put a mark on your account that says u can’t do trades without putting a new deposit in so u can’t get your money I tell u give them more money to me that sounds like a scam and when you go to try and get costumer support it leads u yo a Q&A about everything but no way to contact someone about your problem they want u to go through hundreds of different problems to find out why they took your money,1
