uuid,date,review,rating
e17636ae-8c5c-4caa-8792-ed1d86ed74f8,2021-01-28 14:37:38,"Understand and take your time reading this, we entered an era where trading in the “free market” should be accessible without a hassle of expensive fees for ever trade, Robinhood made that happened, in the recent dilemma, Robinhood didn’t seemed to be troubled and failed to stop Tesla for its parabolic growth and destruction of short squeezes, ramping the stock from $200 to $800 in 1 month and $4000 in 5 months later. The short sellers were average individuals and little hedge fund, destroyed by massive institutions and bigger hedge funders. But when $GME, $NOK, $AMC, heavily shorted stocks by institutions and hedge funders, it becomes a problem when they lose money, Robinhood does not respect the idea of free market and trade to protect the elites, boycotting will result penalizing your revenue, the money that we pay premium subscriptions to make you crooks wealthier. 
Millions of your users are young millennials wanting to get a taste of using technology and free market trading, but deliberately unfair when we want to see growth on a stock, hedge funds and institutions go the opposite and juice our money out.",1
f9b562b5-534a-4cca-99e2-b701eab01711,2021-02-01 23:28:57,"Robinhood cost me a lot of money, I’m a college student with not that much funds, so I was buying crypto as I submit it it does not goes through and it’s not even pending and the crypto was go higher and higher and not the price I wanted to buy, and then it showed me pending order the one I submit it, I was like okay let me cancel it and it wasn’t canceling I tried over 19 times in 15 mins and at the end it went through, when it did the crypto immediately dropped and I lost money and I said I okay it might go up and it didn’t I waited and it was kept going down and I complained to RH plenty of time, they didn’t get back to me at all, and I had no choice to sell it for a loss, and the amount I sold it at, I was really upset and RH didn’t get back to me. I suggest go with a different broker, I wanted to stay with RH but seems like they don’t care about their customers.",1
a5aac26a-4c6a-4cd3-9180-1797736d0f5b,2021-02-05 15:11:29,Over the past few weeks I have noticed Robinhood cares none aboutSmall retail investorsOr anyone but themselves at this point I’ve never been so angry and frustrated with not being able to invest. They stopped instant deposit but still took my money out of my account and stillHave yet to make the money available to even buy stocksWhich in fact is actually cost me money as the stocks I want to invest seems to be going up.. truly frustrated and was truly in love with this company but the past two weeks have been horrible awful disgusting so many negative words that I am really reconsidering taking my money to a different place.,1
6c791646-ce3a-409b-bf7b-b3d7db1c6596,2021-06-09 15:24:14,Robin Hood is okay they just needs to stop taking large amounts of investors money but I do get the ideas but still for small investors it should be free for certain things and they should also take off the sell a share then get in trouble if we buy it back maybe some investors would like to add more money to their investments or simply need the money instead of waiting for it but their doing a good job overall,5
d14aee7d-11f2-4ffe-8e90-8c9c22c658e3,2021-11-15 14:28:24,"I love Robinhood more than many things in life that I once held dear to me. I do not mean my regular basic Beehive checking account app from Big Banks, I also mean social media apps for fun and sharing/connecting and even things in real life that I would waste money on; this “app” has LEVELED UP my financial game and Cherry On Topped if you catch the vibes, Mate. Oh yeah get new Crypto selection RH come on my friends are trying to convince me to try other platforms but you should know, atleast for now, some Homes are Loyal LOL JattBrotherhood Peace Out bruvz sisters n non binaries yaaDigg",5
0b773e79-bf56-4231-a08f-c212f2f9364c,2021-02-05 22:08:37,"Although I wasn’t impressed with being unable to trade DOGE on the morning of the GameStop hype and I don’t necessarily agree with how that day was handled, I’ve come to understand that until blockchain tech fully takes over the financial markets, there will occasionally be issues out of the brokers’ hands.

I wasn’t impressed with the MSM coverage or the interview with Elon, but the interview I saw with “Meet Kevin” caused me to be significantly more confident in the safety of the portion of my portfolio that I keep there.",4
992e1f4b-c4fd-4a26-9a92-5b950a4402f0,2021-04-16 23:30:33,I love everything about Robinhood you can see diagram and graphs see how much it used to be or local time the only thing why I put 4 stars just it’s take so much time to Process to add funding and also withdrawing to the bank I wish they do a quicker funds and sending it back to the bank that’s all it needs to update,5
1b781419-2d1c-4c29-bd44-7b25654402dc,2021-04-20 18:38:19,Absolutely junk service I have deposited money over a month ago and still can invest it on anything good luck getting someone on the phone or to answer an email I definitely feel like this is a scam I have sent approximately 84 emails because there is no option for me to withdrawal my funds it’s extremely easy to make a deposit but when it come to getting your money back it’s not gonna happens ol of the contact numbers online just refer you back to the app and then hang up and there really no good way of getting ahold of anyone on the app except with pre selected questions. I don’t recommend using these people,1
f3aa5234-fbee-4b6d-84cc-593f3ca1ec13,2021-05-09 10:32:20,"I have been trying for over two weeks to get an account open I had crypto I could have bought at .003 that is now up to .68 and all in this time I have had the worst experience getting my account set. First get signed up and ever since has been stalled wanting pictures photo ID an ive tried several times and nothing all while my brother was able to do it an have his done in a day no ID no anything so I have decided to go else where, had no response from any help desk or replies that say may take up to 5 days since high volume but now on 2 weeks no response no help nothing, maybe they get it fixed for me some day and I can give them something of a rating until then it not worth the hassle.",1
91491050-ddc1-4d54-9f3b-656fb2d60ca8,2021-05-21 05:56:25,"If you plan on trading here and buy trending stocks before they rise it’s worthless and your profits never happen because anytime any stock goes up a sharp spike in 10-15 mins robinhood has “technical Issues” that
 disables any buys of the stock to continue the rise and only allows sales to put fear in investors that a massive sell off is coming becusse all you can do is sell and if you don’t sell now your gonna lose all the profit so far etc .that and all they do is sell and track your data look at the list of permissions and giving up of your data required to install and use this app. Don’t use.",1
fd8c9b67-ed7e-4f7d-bd26-ec2147f6a960,2021-01-31 16:44:44,"They lied to us and led us to believe they were in support of the retail trader and everything about there app incentivizes users to day trade and theyre entire layout is based on the day trade model, get in and get out with a profit. Well they made that impossible last week by restricting buys on certain stocks while only allowing you to sell(if anything and they HAD to stop buys they shouldn’t have allowed sells either bc that is blatant market manipulation in favor of the hedge funds short positions) then not only that but they restricted buying of certain crypto currencys like Doge that just happened to be making a lot of retail investors money while not so much for RH and theyre buddies.",1
ffa7e47e-ca5a-4d8d-8edd-75d7b4772dee,2021-05-12 20:33:21,This app is a scam it says commission free trading until you go to buy a crypto or stocks and you pay one price and only get a slightly smaller fraction of a share you’re ordering you basically pay 5% or more each transaction and the fact there’s been liquidity issues during volatile trading moments you can’t sell at the max price you’re looking to cash in on why is that? Because this app suspended trading in key moments young or new investors could have their life changing money to live better ripped away from them until the price drops back down again and Robinhood saves VLAD the bum from getting his profits off of our hard earned gains!,1
676c7907-4225-4133-86be-c50eb41bf432,2021-01-28 19:35:36,"During the biggest short squeeze in history - Robinhood has decided to cooperate with the Fed and SEC to organize the biggest market manipulation in history - halting trading in more than just one stock.

Before you say halting is normal - it is when it’s the whole market that freezes - instead they allowed big hedgefunds to drastically lower the prices, completely decimating people’s fair investment choices beyond -100%  to allow short sellers to cover losses at a tremendously lower cost. 

Easily the most corrupt trading app, even besides this incident you can google ‘$65m Robin Hood pays’ and you’ll be disgusted when you see they paid $65m in fines - without even trying to be heard in trial to avoid the fine - essentially plead guilty without making it a trial.",1
8c9a9d2f-8bd3-4791-8f0d-115c4603d9cd,2022-03-02 11:59:45,I have been with Robin-hood over a year .I have traded several thousand dollars buying and selling stocks and crypto .I have been  very satisfied with the company however I would like to see more clarification about Credit about how we can use the margin account about the charges and it would be very nice to have access to customer service so we can ask question especially for people who are not experience and like to go further thanks,4
7d666888-8001-44f3-ba19-c14431424536,2021-04-16 14:13:50,"At the beginning I have to confess that I was afraid, but with the time and practice I really find very interesting and profitable app, you have to study very well and take your own decision, but for sure I will recommend Robinhood, easy to deposit, buy, sell and send your money back to your account that it’s the most important transparency and loyalty .",5
4541a530-eb9c-45fd-bc4e-766af3396869,2021-01-28 13:43:35,RobinHood  apparently will now prevent you from buying stocks their owners don’t want you to be able to buy - even when competitors - including ones in other countries allow trading on the Same stock - they don’t want lower income American to make any money - they are unAmerican market manipulators - use other services like TD Ameritrade,5
81d6a0c2-5a71-4ce7-93bb-e88233178179,2022-09-01 13:25:03,I love using the Robinhood app I love investing my spare change I love how quick and efficient Robin Hood is on the other hand I don’t like the fact that I can’t transfer anything from Robinhood to another app e.g. Cash app Venmo and PayPalThere are moments in time when I don’t have my Robinhood card but I do have one of the other and I’m unable to move my money from Robinhood to Cash App I’m sure this problem can be easily resolved with just a couple codes and a new update in short I would appreciate it greatly if the next update involves being able to do exactly what I just said,5
2ceda75d-27c5-479c-8484-0f546607acda,2021-04-23 16:13:29,Some of the options too sale your Stocks is the worst in this app out of all apps if u want to see how much you will receive when you sale your shares and touch the screen it executes the trade with out asking you are you sure you want to and you can’t speak to a live customer service when your putting your hard earned money into this app this app needs customer service that’s live,5
5351d342-8037-4e98-87e5-2224e0a5f955,2023-03-29 14:34:54,Minor Account issues and app technicalities cause me to be restricted from trading and transferring funds customer service has failed to fix this matter after months of emailing and calling Robinhood this matter has not been fixed I have referred my family and friends to use this app and now I can not even speak to someone qualified to fix a simple app error glitch on my account which has cause me to transfer positions out of Robinhood and trade elsewhere. I pray that Robinhood resolve these minor app glitches and technical problems that causes its customers accounts to be wrongfully frozen and restricted.,1
82a69d22-b5d6-4895-b62d-73cac268b238,2021-07-21 17:36:36,"Brillant app I just love it , very easy friendly to use , and to do a quick research. I also like their goal according to the ceo :  to try to educate and make more accessible the finances. It worked for me , someone from working clase trying to meet ends , my portfolio grew smoothly and relatively safe with all time growth averaging 60% it just fun visually  appealing when I open Robin Hood if I compare with the design of other apps that I get lost  . In terms of fees and the controversy of AMC and Citedel , can’t give my opinion , I safely gamble a small portion, I from the humanities and foreign languages field I like to read and love statistics as well  so I’m  learning this finance language🤓 , just to be able to  buy a house, earning $13 per hour would take me for ever . The owner or CEO of RB I’ve read is the son of two formers central bank directors or employees maybe he truly thinks this is a good way to give a tool to the millennials … we’ll see , as for right now my experience is good so far and I recommend it, but I m prudent so I put my money pennies in other apps as well  just to be on the safe side .",5
aaca9e92-ebca-4706-a100-c2a03ee67c36,2021-02-25 06:11:37,"I understand both sides of the game, but we chose you guys because of what you were selling the vision of the retail investor finally getting the opportunity to invest minimal amounts of money that they could afford to try to have a good financial future for themselves and their families, but you have forgotten just little what it feels to be the little guy since you’re no longer the little guy and you’ve been allowed to sit in the good old boys table, and I also understand that too, you must protect your company from the same hypocrisy the big firms have done from the beginning of time. Continue to try to be better and don’t forget who you use to be, one of US.",5
466ca2cd-0331-4462-8d6c-541f5b0ac569,2021-11-09 03:17:23,So like every company it has its good and bad so I’ve overall made money ivesting on this app.. especially through refferal bonus stocks ... slowly though Robin Hood is making it more and more difficult for people to sign up and it’s harder for me to get referrals like one of my friends they wanted a picture of his ss card and then wouldn’t accept it bc it was laminated the same card was 55 years old if it wasn’t laminated it’d be dust . I had 2 other friends that weren’t able to link bank accounts bc it kept saying incorrect login when it was correct login so I’ve been missing out on many free refferral stocks I could’ve had and it leaves those friends wondering if I sent spam …. Also it’s annoying they don’t have stocks under .50c really maybe a few but that’s it,5
a705a57a-fd34-4e33-a86e-5dd42cc58570,2021-06-23 15:54:11,When you have any problem you try to contact them you have to give to them email when you send the email if it is get also big issue they said you 3 to 5 business days they contact with you if you use Robinhood you have to be careful because they don’t have any contacts number you can contact to them phone number PpolI nvestbest million million dollar,5
d2033f58-3304-4325-8d69-b1d4f304aec8,2021-03-19 23:59:18,I like the platform very easy to use for beginners I appreciate all the news that you can do research And the search capabilities the only thing that I have concerns about is if your investors want to do the same thing as the investor tycoons do by cornering a market like what happened to GameStop I think it should just be allowed why is a good for one but not good for all makes no sense,5
423e776c-7d6e-498f-bae1-f58a107bd75d,2021-10-28 21:36:45,I started out as any poor chap as many do and within 6 months of using the hood I learned a lot! It’s great entry level platform as it will let you push buy and sell buttons on your favorite stocks when they are being neglected. But as I advanced my strategies I learn more and more about the advanced strategies being used to con the investor and thou I lay in bed with these RATS and I say that politely cause think of how rats live But the biggest problem I have is not rats it is that it’s hard to rid rats when when your use to city rats you don’t know how big these rats can get unless you have millions to buy the light to expose them. In conclusion you wanna buy and hold find a better broker but this one will do if you wanna learn if you wanna be successful find another broker it won’t take long for you to see they are just like rats on city streets and I’m not talking about there employees I’m talking about there platform,1
5dcfa03b-23b1-45c8-aef6-1f176f1e2a71,2021-03-24 13:06:35,"So easy and practical to use, I’ll like more news so we can read under each stock, hopefully that’ll be added later on, also a customizable graphic candles with either MA, IC or SAR indicators would be a big help...
Updated comment: I’m still not seeing any additional help in the charts but the sole line that goes up and down and the usual flip side volume chart, MA at least should be a must have 👍🏻 so please consider it for a future update 🙏🏻",4
f5d87d93-8771-48da-b5b3-04606f132613,2021-09-01 03:20:32,"Robinhood restricted my account for over a year and after 1 year attempt they responded and asked me to tell my family member which is i don't have contact with to ask when he logged in from my device which is impossible to retrieve that info due to i lost contact with that person , sent them my id ,bank statement and else ...  and they approved that its really my account 
Now its there last excuse not to give my money back to me  , i don't know how they are still in business 
If anybody reads this and wants to download this app please DONT DO IT!!! Before downloading read all the reviews if you care about your money
They are the biggest scam",1
e591fcb3-ba1f-45fc-bd0a-1eba0b72cd1c,2021-10-12 13:53:31,Amazing app honestly I’ve learned a lot from stocks and crypto currency here smart way of investing your money as well only thing I’d recommend is just bigger menus and more things to offer but it’s a great app just hopefully down the road there more crypto to be offer that the only thing I believe is lacking but other than that it’s a amazing app,5
b6b447da-7862-4120-a76b-4d0dc9ea4c3c,2021-01-28 17:19:45,"By stopping the buy of certain stocks Robinhood feels are “too volatile” and thus supporting hedge funds and institutions to allow prices to fall so they can get out of short positions that those very institutions drastically over leveraged and caused said volatility in the first place is against the very business charter of what robinhood claims to support.  They are supporting the big institutions and manipulating the market, not for retail investors but for the interests of bailing out the large institutions when they are on the loosing side of their positions, deplorable, and frankly illegal activity.

They have proven they are in the pocket of said hedge funds, money managers, and institutions that are against free retail traders because they present a new factor to market against the ways those institutions manipulate the market and factor in risk.  Manipulation by stopping buying should be illegal, transparency to the ways hedge funds, money managers, and institutions manipulate the market should be the answer (causing short laddering, allowing short positions to exceed available stocks or risky positions, uncovered options)

Robinhood is manipulating the market ... simply stated.",1
2b045a2e-55ff-44d2-aa33-61df9b31b5e0,2021-03-11 23:00:04,"A great app. Hodls the line even with recent increases in traffic as the user base grows. Unprecedented coverage of the recent GME uptick and subsequent increase in users has shown that RH’s disruption will remain indefinite. During the recent hearings, utterances such as “I’m not an FA, I just like the stock” or “apes together strong” have become de facto rallying calls like the Astros banging the drums in the dugout (Ex. “... the Friday stimulus effect on hypothetical tickers like [$ARLO] & [$NKLA] were sent moonward Friday morning as the market prices in the expected amount of savings that would be invested sustainable energy alternatives, data management/migration and cyber security software, and creating opportunities for wealth/income equality).",5
4a078b63-f39a-4bef-9c8d-491880301767,2021-08-08 04:34:06,"There are legitimately a few pros and cons.
Pros: charts, aftermarket info- even if accessible on other platforms, ease of buy and sell with instant credits, the ability to see differentiated time frames of your gain/losses(week, month, 3month, year, lifetime)
Cons: we all know what happened when Robinhood blocked trades during high traffic of gme and amc, when there is a company split the contract options go to .1(so it’s an automatic loss), loading time is a little delayed so sometimes I’ll have a price on Fidelity that would be slightly different from Robinhood, and last but definitely not least- I dislike that there is no customer service number like, SoFi or Fidelity.  It’s frustrating to “chat” when you get the same automated responses.",3
e8611096-5686-4460-b212-c73525464d71,2021-02-01 12:20:06,"I’ve used the app for over a year. I’ve held a few shares nothing too valuable, but all of the sudden i’ve got a message saying there are stocks that are being restricted... come to find out they are blowing up... now in the message they state “All investment has some risk” yet after some research, these actions benefit a single group, a hedge fund... which wouldntyaknow owns a portion of robinhood... and they never happen to mention THAT in their message... to me that seems a little dishonest... in my opinion they should just be honest about it... and stop abusing its users by telling them they can trade freely... we can only buy what you “allow” us to buy...",1
6cc8767e-ab97-4d2c-89bb-76e1543c592e,2021-05-09 11:09:30,"Thanks for providing a platform for the average Joe who wants to invest in the growth engine of America and the world, usually the domain of financial giants and the rich clique only.  Commission-free trades enable small investments to grow and allow ordinary folks to use the latest technology in smartphones and apps to do what only Wall Street professionals could do in the past - so Main Street has been enabled to benefit from industrial growth and emerging technologies too.  There are risks of course - study, training and experience are essential tools necessary to be savy in the markets.",5
6056545e-cebb-4322-b031-9ef252e121cf,2022-04-25 21:37:59,"Robinhood always has super nice people on the phone and will even fix things that where caused by other companies on your behalf (Coinbase taking more money than they should, or Letric ebike company I spent some earnings from robinhood not shippiing it or wanting to refund my money).. I don’t normally trade in robinhood; I use it as a holding or transfer account. I do use it’s charts as reference tho. Several times I’ll find they have lower prices in the dip and higher prices in the upper bollinger band than what’s listed on kucoin … and unlike kucoin my market orders don’t get ignored when the price I put gets passed … also unlike kucoin I can reach them and they don’t block me from contact when I have a case of missing money… I’m just saying don’t use kucoin but robinhood isn’t real set up for scalping as good… 

Ps … they got by far the dopest hold music Iv ever heard",5
085c23c1-861b-4ce0-ac2a-08133b799838,2023-04-17 17:10:01,"I Downloaded Robinhood app in 2017 and put my short name in the app, I just wanna update my name in the app but they are asking for the name change documents, I told customer service That I never changed my name, I can provide you my drivers license and other supporting documents but they keep sending me different agents to chat and never resolved my issues poor customer service. App is awesome!!  But customer service is poor, they put you out of the chat and keep sending “are you here” “ I want to check are you here” but you cant chat because chatting prompt is not available on your side, then They asked me the name change documents through an email which I never changed allready explained many times to the customer service agents but they don’t listen, just wanted to change my name which I put mistakenly in the app that’s it.",1
5f045abd-0641-41aa-a1be-5e769c608004,2021-02-08 17:56:31,"It’s a cool and functional app, makes it easy to understand the gist of the stock you’re investing into, graphs 9/10 the reasons are because it allows you to see a good accurate representation of the stocks you’re looking at without any bothersome extra unnecessary info, allows for switching between lines and candle sticks, would recommend they bring more crypto currencies to their app besides Bitcoin, ethereum, dogecoin, litecoin, ethereum classic,Bitcoin SV and Bitcoin cash. In my opinion giving the current customers more access to more cryptocurrencies would hook more ppl to them. This is just my opinion tho so who knows.",4
