uuid,date,review,rating
6608c25a-e1b3-4f50-bcbd-3fd15c8ee1bc,2023-02-21 12:38:45,"In comparison to the competition I find Robinhood to be significantly easier to look at and more intuitive and natural to navigate through and find information in.  My honest  opinion is that I think apps like Webull and robinhood ect. All pretty much have the same data points to put on a chart, it’s l subtle but I think important IMO. To have “a clean chart” the information you choose displayed in a way that’s easy to visually digest. If your chart gets “to busy” then datapoints you have chosen to be displayed get absorbed into the background of your chart and they end up missed or overlooked . Robinhood displays the information in the most clean and easy to digest way; while Webull comes off as more advanced  I’d really argue it’s busy and/or messy and that Robinhood has all the same features and function of Webull minus the feeds (social aspect) Of webull plus having a Roth IRA option with a 1% match on funds is a deal sweetener for sure… so is the spending section/account and the bank-ish features and services that it offers not. Last but not least… “Instant deposits” a feature that’s optional but allows you to invest and spend incoming to Robinhood, pending funds, so you can get to losing it faster",5
c260ff63-a84e-468c-944f-959ed870458d,2021-01-28 21:50:19,"This recent fiasco with GME and the other “extremely volatile” stocks marks in my experience with the app the second time this app has taken away control from my portfolio. I understand the high volume to the platform and the strain it causes on their servers, however removing my control, as well as other users’s control, from their personal funds in inexcusable. This is especially despicable as trading on these stocks is still permitted by the “professionals”.

For a company whose name is based on taking wealth from the rich and distributing to the less fortunate, they have certainly displayed where their alliance truly lies. 

I am looking forward to monitoring the upcoming legal actions against this institution and others like them who continue to exploit the 99% through actions and loopholes they are so quickly to fight and plug when not in their favor. 

Ultimately this app was a great idea with a decent interface but the underlying principles and execution leave me yearning for increased scrutiny, regulation, and accountability for the vampire class that permeates Wall Street and its surrounding institutions.",1
1671f27d-0ff9-4501-83f4-4c898eb480ac,2022-03-08 19:56:30,"App is great love the new feature that allows you to track and view options and see the price movements. That’s a great way to allow people to get used to the platform in general and trading options there but one thing that I think would help a lot as well tho is if the app could indicate when certain numbers have gone up or down since last them or if it could be in real time . for instance if I were to go and view and options Delta I would like to to see it flash green or have a green arrow next to it indicating that it has gone up or red to show that it is going down , with Greeks it’s sometimes hard to keep track of the movements in values as to whether it went up or down because you would have to rely solely on memory or meticulous note taking . Hope this helps … ps whoever added that feature or whatever team worked on the feature for the watchlist on options actually deserves a raise forreal. Shout to you 😮‍💨",4
5866bcad-5840-4a8f-8549-3c6b721bd7f2,2021-01-28 21:00:18,"While I understand that there is likely a ton of pressure from higher ups to prohibit the sale of GME and other related stocks, I find it to be completely spineless. How is an app/company that is literally called robinhood whose mantra revolves around empowering retail traders capable of such blatant market manipulation to favor hedge fund managers who are throwing temper tantrums because they lost at their own game. 

While I personally use robinhood for its simplicity and beautifully designed UI, it’s recent decisions have been unethical and should be investigated after this fiasco. Let’s see how many “little people” return to this company after they decided to punish retail trainers for doing the same things that these companies have been doing for decades.",1
8556890f-8100-4981-b07a-c949fecf58ed,2021-07-29 00:40:38,"I have been on this platform for years now and will admit only recently really committed time to investing. Within the last year I have been seeing very, very, very poor transaction executions sometimes watching a security or crypto blow well past and hold past an execution price only to return back MINUTES later, not instant at all because of their payment for order flow system which can bit only rob you of opportunities to buy or sell at optimal levels but of you money as well. I have also asked repeatedly about if or when we will have access to our crypto wallet keys as I would like to utilize that which I hold and have been given the exact same response every time with added fluff sometimes to pretend that their “commitment” to customer support was being upheld, but anybody with a third grade education can tell it’s the same response just barely reworded, so they either think you’re stupid or not actually worth helping. Bottom line if you plan to invest just take the commission fees and use a broker that at the very least pretends to care in the slightest about the customer.

Tl;dr they will not prioritize you as a customer or your orders at all. Go literally anywhere else.",1
44cb3586-df9a-4c69-a2da-d3dc184a3a61,2021-01-28 21:02:27,"They claim to be on a mission to democratize finance for all but, when volatility gets so intense due to what the venture capitalists THEY ARE SUPPOSED TO BE SUPPLYING FREE FINANCE TO want, they revoke our right to BUY stock the hedge funds want to short, yet they don’t halt the right to SELL?!?!

Tells me they’ve been swayed, or someone in that office is getting pressured and doesn’t have the backbone to push back publicly; they don’t even make a public statement about it. Until the person/people in charge of this reprehensible act is/are apprehended and removed, Robinhood’s dream is a piping fraud and they are unworthy of their name.

Until that time, they’re robbing the hood, not democratizing finance.",1
589fdc33-75f1-4b17-a22e-31b743ce1fad,2021-01-28 17:03:25,"“Our mission at robinhood is to democratize finance for all” pretty convenient that when retail investors are squeezing hedge funds you stop supporting the stocks in question because the bank you run OUR trades through also happened to give 2.75 billion to one of the firms involved. I’ll be looking for a different broker who doesn’t want to screw with average people, and will keep on the lookout for a class action lawsuit.

Other than that you have a very user friendly app with a good interface, you don’t crowd the screen on the free version but robinhood gold still gives you access to more advanced metrics (volume and depth are all I’ve gotten into so far) for the past year you’ve helped me get into trading and learn, but I will be trading elsewhere now",1
9e7cd968-acba-4df4-b317-40611646e450,2021-06-02 15:57:25,"So, prior to downloading this app, I had used a number of other simpler apps for basic investing. I suppose I was a little bit tentative about using an app that allowed me to grind down to the gritty details of investing, but once I used Robinhood, I’ve got to say I was super impressed! Being able to Nick partial share investments, even down to tenths, hundredths, or even thousandths of a share, makes a small scale investor like myself feel as capable as a highroller, or a pro in the field.",5
e25f4d92-bb0e-4241-a27f-019858816ecb,2021-01-10 16:55:40,"The address verification, during signup, is broken. The lookup data they use in the back attempts to be diligent but it’s broken as I’m guessing there is a layer that validates the string input doesn’t contain certain characters the devs did not foresee as used in addresses and/or their address lookup service is missing addresses. Even when allowed to manually enter, you’re not really being allowed to enter manually, because the aforementioned still happens.

Not worth further troubling with this app, as my confidence they’ve got a handle on basic app functionality is broken. This bug creates a regulatory liability because it actually encourages some people to use a different address than their actual address if they want to continue registering to access full app features.",1
49aaf3c5-9833-4a3f-bdfd-474abcdff52a,2023-06-24 06:42:28,"If you do, Robinhood will want you to upload your state issued ID card to prove your identity. And given they’ve had data breaches in the past, im sure they will once again get away with leaking pictures of your ID to the bad guys eventually. It’s a bull crap way to verify someone’s identity (given the fact that people sometimes change there phone numbers, but not there email addresses) and is very clearly nothing more than a data grab designed as a data breach whoops I mean a verification method.",2
67e9c1fc-dd03-4df8-891e-4b21a9ba749b,2021-01-28 20:53:04,"Just like Facebook takes your data and monetizes it for their true customers, Robinhood sells data on your trades to large institutions on Wall Street. Despite issues with handling the volume of trades on their network last year they have not improved their systemto handle surges in activity which means you lose ability to make decisions on and control your investments and your money during critical times.",5
b9cee235-df0b-48cd-a62a-8ff43e6abf27,2021-12-30 18:38:48,"I have tried other self-directed investment apps/environments, and Robinhood is hands-down the best! To start with, commission free trading allows you to make (practically) unlimited tweaks/optimizations to your holdings, and to react quickly (as fast as humanly possible - computers are obviously faster) to changes in the market. Real-time alerts and market analysis gives you important up-to-date information to inform these decisions. The month of free Gold Member status (currently need to enable this manually), which comes with instant deposits, is a great way to fund your account and start building your portfolio quickly (I haven’t tried transferring money out as yet, but this will likely take 5 business days). The phone app is very user-friendly, making various types of trades simple and convenient. The only bad thing is that trading in Robinhood is ADDICTIVE, and don’t be surprised if you want to spend several hours per day (or night, with cryptocurrencies) trying to optimize your gains. Some suggestions for improvement include (1) access to other types of cryptocurrencies and the ability to do more complex trades beyond just market or limit orders, (2) the ability to ‘shift’ the time range being displayed on market data plots (e.g. to center a 1 week display range to be centered a few days/weeks in the past), (3) the ability to do more advanced analysis of market data by superimposing trend lines/curves.",5
aca4d2e6-e239-4057-96be-1a079dfd184b,2022-03-04 22:53:02,"It never explained that I could only add $ so many times a day I’m very upset because had I known it would have made all the difference, also there is money being pulled out of my account and I have no idea how to know when or why, I hate that I have to have multiple accounts just to be able to day trade, to be honest I use this very little, if there was a better way to do day trading with a smaller amount in your account I feel like I would use this app way more. It’s very user-friendly which is the main reason why I continue to keep it the phone app is really nicely done. All that they got rid of the confetti whenever you make a deposit I felt like that was a cute little fun thing, a feel good moment bring it back lol",2
ac99eef9-2aa8-42e0-bca4-5ad06390de6f,2021-01-30 19:21:54,"In terms of simplicity and design Robinhood blows all competitors out of the water. Its a shame they restrict buying of specific stocks with no notice & due to this I simply cannot recommend using Robinhood and have transferred all assets due to their continued failure to support retail investors, which is the very premise the business was built on.

Beware that Robinhood will do anything they can to save themselves & that has been evident the past couple of days, whether its restricting you from buying stocks when it SUITS THEM or closing your positions/options unexpectedly at the lowest possible cost point.

Would highly recommend using other brokerages to insure you can trade freely without fear, as the companies actions the past couple of days has potentially lost thousands if not millions for retail investors and everyday joes.",1
16e3f327-0641-4656-93ff-0600e4e39a4f,2021-12-23 04:56:31,Me and my family have been used Robinhood for after one year as our bank account now just got account restricted for actually not the right reason never been negative balance in my account and also never been failed bank transfer to Robinhood and also it’s said got restricted for purchasing Crypto this is something totally wrong it’s not fair or doesn’t make any sense. we’ve been struggling right now my family depend on every penny from this account now my account was freeze I can’t even able to pay any of our bill it’s been stuck our fund very disappointed. it’s been sent all the documents they needed still didn’t get my account back yet I’ve been blindly over trusted and deposited all of my paycheck from every month. recently since happened I was lost hope and very sad about it I was hopeless for serious until now for this account don’t know when I’ll be able to use very be careful I really do feel they do not care about it how’s the other side of family life was struggle because of that.,5
6ea2f7cc-6993-4f89-a552-734cac16dce5,2022-03-18 03:16:45,These are great. I just hate when I want more information or explanation from story and click only to be confronted with “the dreaded become a subscriber subscription” not that I don’t think WSJ or Barton’s Or whomever wouldn’t be subscriber worthy and maybe someday but if Robinhood puts an article down than they should pay content provider if a Robinhood Gold subscriber clicks on further links for information. It’s not like I’m looking for free stuff. I just hate having to exit and find further information and than log back in it’s kinda annoying. And all along like Wikipedia the internet through DARPA was free source of information so make the clicks free if I am reading your articles and sometimes want more information definitely pay whoever so I can have the information as I wouldn’t click if I didn’t want more but if I get confronted by a “subscription” requirement I just exit elsewhere. Although I am appreciative of the few sources that let you have limited articles but I’m still not Subscribing in Robinhood so as to pay other sites maybe you can change the industry model.,3
9f4125a7-be57-4229-844b-a36e1fd99a30,2021-01-28 22:36:14,"As I’m sure everyone is at least passingly aware— robinhood has instituted policies in the last few days which would force their consumers to sell their stocks at a loss “in the greater interest of everyone involved” and “to protect against volatility”. 
This is in opposition to any of their users’ best interest, and only serves to benefit the corporate/hedge fund conglomerate sponsor for Robinhood. 
Citadel holdings is Robinhood’s founder and continued sponsor, and they held billions of interest in a hedge fund which was hit by the recent short squeeze. The policies instituted by Robinhood this last day only serve to hurt their consumers and only benefit the interests of their corporate sponsors. 
I encourage anyone seeking to involve themselves in trade to look elsewhere from the app which puts itself forward as a means of the little guy taking his part, before turning around and crying on behalf of the ultra rich.",1
e48d172e-42ab-4df5-948c-1eaefc64c9d5,2021-04-16 01:12:30,"Love the simplicity, 
Love the way the app is formatted 
but there’s random times where they won’t let your order go through because you’re buying a volatile stock and (you might know what you’re doing) to make some quick money and out of nowhere there was scheduled maintenance that they didn’t tell you about, very sketchy, but aside from that I love the app but I use Webull to look at trends news and stock analysis. 
They’ve done that with AMC, GME, DOGE, Express that I know of.",3
f4f8b664-3c31-4fe5-a255-0da72663076c,2021-01-28 15:02:30,"If you’ve watched recent investment news, you’ve seen the volatility on GME, AMC, and a few others impacted by short squeezes and retail investors. I’m not in any strong positions on these stocks, but it’s been interesting to observe and participate in from an app that claims to democratize the investment process.

Imagine my surprise this morning when more than a half a dozen stocks (a couple of which I have small investment in) suddenly were listed by Robinhood as “not supported”: if you owned them, you could sell them, but buy no further. While I do not condone overly risky behavior or investing beyond your means, this was extremely disconcerting; that the investments I may choose to make as an individual could be locked as such at any time and without notice, forcing me to either hold or liquidate my position with no option to buy, is unconscionable for a platform whose image is shaped around making investments (the good and the bad) available to everyone. 

Until now, the app has worked well for me: I had no problem adding money, buying, selling, monitoring, etc., up to this point. But, observing this behavior significantly degraded my trust in its use; if my choices as an investor can be disregarded so suddenly and my portfolio put at risk by the platform in addition to market forces, I cannot recommend it.",1
2c43d39e-74ce-464c-9550-52bdf5845a3a,2021-05-19 08:57:36,"Easy for new traders to get started,
But, crypto traders should be able to use stop loss orders.
Options traders are allowed to buy puts and calls, which are notoriously risky, but must have longer time of experience before using defined risk strategies such as vertical spreads and diagonal spreads, which can have much higher probability of success.
Robinhood should allow options traders to take a test to demonstrate knowledge of risk management and mechanics of trading advanced strategies to add trading privileges.",5
3f1f130d-fdb5-4568-8de1-20e5a8d85270,2021-02-03 21:54:01,"Robinhood, I as a investor I forgive you, but please make sure this dont happen again because I do enjoy the app and being able to invest for my kids future just please, have a plan to execute in times like this with proper steps. I believe in you even tho I did not got to make $ yet like others have but I know one day Ill be buying my own house for my kids and future plans while I still alive.",5
83d2d98e-62b9-4e41-9c2f-c84ff19f2e10,2021-01-07 18:14:05,"Robinhood is such a friendly app that gives the power of personal investing and keeps you updated with notifications and news as they are evolving. I have not used their community yet so I can not provide any comments on that however I love to use my app several times in the day to see how the market is doing.
I love the way it is displayed that gives you the info of your buying power, your daily and YTD graph and market movement at your fingertips 
I do wish they can improve the transfer process to and from Robinhood in real time also rather than dragging for days 
I recommend this to anybody who wants to take control of their investing and does not want to spend hours of learning how to navigate the app",5
817c8abe-70c6-4c89-9892-81b050025168,2021-01-28 15:34:50,"As right-wing pro-business individual who voted for Trump I have always been highly skeptical of “left-wing conspiracy theories” about Wall Street. However, the potentially fraudulent actions committed by Robinhood to limit the negative effects to hedge funds via the GME Short Squeeze are completely blatant and unacceptable, and I feel I have no choice but leave Robinhood as soon as I am able.

Up until the actions taken by Robinhood, I had no spite towards Wall Street and other individuals on the potentially losing side of the GME Short Squeeze. All I ask is they be fully accountable for their investment risk just as I have also risked a significant amount of money on GME.

If Robinhood is able to cite legal statutes (e.g. from the SEC) to justify their actions I will consider retracting my statement although at this point it is likely they have already partially achieved their goal of limiting some losses to high-risk short sellers.

As for the Robinhood interface, it is the first brokerage I have used aimed towards individual stocks (I use Vanguard for ETF’s and mutual funds) and I find the Robinhood interface to be streamlined but also a little simplistic.",1
581d964b-5115-4a9a-a3de-2bd3c0dedc42,2021-07-16 14:00:10,"Yes investing platform with Robin Hood is the best way for beginners , hands down . I am completely new , I have been researching learning and Next step is Robin Hood - if I can learn and feel relaxed and competent anyone can — haha I am 65 yrs an ex - Hare Krishna monk , i became a Monk when I was 20 — says all No college — so come guys if I can — there is no excuse - get your first foot in . I did and boy am I glad I did — now Sky is the limit .",5
3fc44cf1-a328-41b4-ba60-44ab253145c3,2021-01-29 03:27:15,"I’ve been trading since November 2015 , and have different brokers, I used Robinhhood ( Robbingus) and have found shutdowns when I would have been selling at a profit, freezes and stalls on getting executed at good prices and the worst fills I’ve ever encountered - because they sell order flow to market makers to skim from. 
Also up to a minute to two for 1 option buy at market, SMH in disgust!
Don’t even think about customer service...only email , while you can wait,for days- you get confusing double speak instead of admission of the problem and money they cost you....",1
0c0fe232-0bd0-4b9d-a243-e44531fc0156,2022-01-24 17:40:49,"Robinhood makes it easy for a new investor to get started in investing and holds your hand when dipping your toes in options trading. However, glitches and wide spreads between sell and buy options orders make it difficult to get orders filled at desirable prices. The training wheels when attempting to complete relatively risky option spread trading can also become frustrating as Robinhood will sell your orders at losses when options are determined to be risky even though your option has well enough potential to expire in the green. Overall robinhood would be considered best for those starting in investing but can quickly become outgrown as one becomes more experienced and can find better brokerages for price execution and more advanced style investing.",5
6fd9c492-6035-4d39-a909-c98b2546dcec,2021-04-18 18:13:27,"For a long time I have heard about investing money in stocks and what to do, what it takes, that scared money doesn’t make money. I really never had the confidence or the grit to actually do it to take the chance. I have another stocks app that is very difficult to use so hard to use I still have money in it because I cannot figure out how to take it out but Robin Hood has made it very simple and easy to understand and what you were doing, easy to navigate and easy to follow the market.  I started with very little experience and through the months I feel like I am pretty aware and know what to expect I’m very thankful and appreciate all the people who convinced me into doing this and to take the chance I honestly now have more money in my bank account then I’ve ever had before in my 36 years of life because I started to invest and Robin Hood has made it all possible thank you I’m forever grateful and thankful for the people Who are behind the scenes and thought to develop such an easy, doable, profitable product for us all to use.",5
672df48c-9996-4f8f-92f2-6b8a0d4dda08,2021-03-22 20:01:18,"The app and Robinhood as a brokerage are ok, though not great. I use them mostly for the easy access to Bitcoin and Ethereum, but with what was previously Robinhood's greatest benefit (zero commissions) becoming the norm across much of the retail brokerage industry, I seldom use it for much else beyond crypto.

Coming from someone with experience using Interactive Brokers' app and desktop software, ThinkOrSwim, Schwab's app and desktop software, and who has regular access to a Bloomberg terminal, I can tell you the Robinhood app is nothing special. The way orders are entered is probably helpful for newer market participants, but I find it cumbersome and drawn out as someone with more experience (I don't need to go through 2-4 different screens just to say I want a limit buy order for X quantity at Y price!).

Probably my biggest gripe, however, has to do with the price charts. To say they are lacking in quality, detail, and functionality would be an understatement.

Overall, Robinhood is an ok brokerage that makes it very easy to open up an account and start trading or investing, but with the playing field in terms of zero commissions having been leveled and other firms offering much better options in terms of their technology and customer service, I think it's worth your time to look around once you have some experience.",2
