uuid,date,review,rating
db7cd1d7-87ce-47c8-9a38-f49a1ebec904,2021-01-28 16:38:05,"Robinhood claims it’s mission is to democratize finance for all. It also offers a platform they call Robinhood Learn to provide educational resources for new investors. However, there is no mention of the app including a ‘feature’ of serving as a gatekeeper restricting access to transactions on certain securities when the company feels they’ve become to volatile. The stated mission is not to protect investors from making risky investments and this runs counter to the “democratization” they claim to be their raison d’être. I would not use an online shopping ad that suddenly stopped letting people buy cookies because they can make people fat; and had I known Robinhood could suddenly deny everyone the right to buy stocks through its app “in light of recent volatility” I would have never held my money with them. I do not know whether Robinhood’s motivation for this act was some ill-conceived attempt to “protect”its retail users or an attempt to manipulate markets in favor of institutional investors, but neither is acceptable nor in line with their alleged mission.",1
48a8512e-259d-472e-90ee-38ea09fd9458,2021-05-14 08:43:07,"While Robinhood is a great platform for the average Joe and Jane to invest in the stock market without having to pay enormous broker fees or even go through the trouble of finding a broker, in the end Robinhood is the only one truly benefitting. The lack of regulations on crypto has made this the perfect way for them to rob you blind and then blame on a volatile, ever changing market. Earlier today a purchased a few dollars worth of Dogecoin at “market” price, however, I was somehow bought in at rate over one cent higher than Dogecoin had hit in over an hour.... but what are you going to do about it?? There’s no one to call, there’s no one to make them stop, and if you want to buy and sell stocks and crypto without all the hassle and fees involved with a  legitimate broker.... then you’ll take it and you’ll like it!
...Or after it happens over and over and over again and the few dollars here and there start adding up to major losses purely because of Robinhood’s screw ups and poorly timed website “updates” or crashes, you’ll take what’s left of your money and head out.",2
0dbe0c9f-d40a-4327-b03e-fde63f3995cc,2021-05-09 12:37:59,Pros - Can buy doge Cons - Crashes constantly - Upon submitting a request to sell the app will freeze and sell your shares at random (easy to be manipulated) - Deletes stocks when they feel it’s best for you (even when one of the biggest stock market movements in the history of the United States is happening) - Will freeze upon attempts of purchasing shares or crypto - Little to no options to prevent or protect you from bottoming out such as stops for crypto - Graphs with data randomly disappear and reappear - Canceling orders will not work at times and just say error. Won’t tell you. Then out of the blue either cancel or sell your shares (out of the blue) - There’s more. Enjoy the class action lawsuits.,1
e415bf90-f923-4e70-b82d-a85fb326ba3e,2021-06-02 10:49:54,"So the other day I had about $1,100 in my “Robinhood account” which has a virtual debit card. I tried to use that money to make purchases and it declined everywhere , I contact the slowest email support that exists and they said they need to escalate this issue. 5 days later I get an email to submit my ID.... all of a sudden robinhod needs to verify my ID again?? After I have just spent $2,500 inverting on their app, they NEVER had an issue or needed more verification when there were deposits being taken out of my checking account into Robinhood account but now that I want to use my earned money that’s sitting in the Robinhood account BOOMMMM there’s random issues , they are definitely shady and I had to write this review because their email support is taking over a week just to help me to figure out why I can’t use my money anywhere 🤣😂",2
39defe84-149e-4ec5-a3b6-6680c614a793,2021-04-16 03:41:13,"There are several times where I’ve either lost money, or had a money making opportunity cancelled because the app doesn’t fulfill buy and sell orders, it’s a real shame considering some cryptos are only available here, I’m moving my money to a different service as robinhood has proven unreliable when it comes to money making opportunities. There is also a limited time promotion offering 3 free stocks for every person you invite, yet it doesn’t work, as the person I invited is still having to wait for “approval”, yet they are still able to purchase and sell stocks and crypto, that sounds approved to me, so where is my friend’s free stock and my 3 free stocks for the referral??",2
1aa771d9-28c0-4fb5-ad53-8b36c81c0cb5,2021-02-04 08:11:43,"Stopping customers from buying $GME at peak demand last Thursday 1/28 while still allowing it to be sold was the move that broke the momentum of the MOASSes and cost people a lot of money, hence the class action lawsuit they are now facing.

I understand that their underlying clearing house raised collateral requirements, but not being prepared in some salient way either means RH is incompetent at best, or worse complicit. They allowed the hyper-aggressively shorted hedge funds to unwind their positions and caused more FUD than the hedge funds normally cause with their paid-for analyst lies and disinformation tactics. I’m using Fidelity from now on, never ever Robinhood again.

I’m revealing their shortcomings as a company they achieved the literal opposite behavior of their namesake, Robinhood. Two stars because some people did make money while the app was still selling GME and has been a good app previously, but I’ll never use this app again.",1
ba507e7c-02f5-46d6-92fe-5e0eab883430,2023-07-12 20:32:12,My name is Roman I was born in Guyana South America I came to the United States when I was 11 years old . I’ve seen the wealth in this country but never knew how to get it until now I will stop using this platform it gave me a chance at 45 years old I love you guys and thank you for helping I’m not an expert but my portfolio says different thanks to Robinhood. My aim is to have Robinhood as my only bank ty ty ty and god bless you all,5
c7cd8a7a-f158-45a5-a05c-ff4ceed4f2ce,2021-02-02 23:17:14,"Robinhood prevented me from trading in crypto, despite outright stating that my state (Indiana) supported crypto trading in Robinhood, by telling me that they would notify me when my state was added to their lists. This prevented me from making several hundred dollars in profit in Dogecoin, and delayed a transaction that began when Dogecoin was at <1¢/coin and finally went through when Dogecoin was around 3¢/coin. What was about 1000 DC should’ve been 10,000 DC, and what could’ve been $400 was instead a much more modest $80.

This isn’t the first time such an unreasonable and unsubstantiated delay happened. Despite several deposits into Robinhood clearing quite quickly, a deposit for $100 when oil ETF $UCO traded at absurdly low rates (<$10/share) due to the oil crash last year was “delayed” until it nearly doubled in price. This ETF has previously peaked at over $10k/ share, and cut my future profits in half. 

Not to mention the restrictions on buying $AMC, $GME, and other stocks affected by the Citadel short squeeze, which still allowed owners of the shares to SELL stock - when logically an injunction on buying would ipso facto be an injunction on selling (can’t sell what no one will buy). This was an obvious ploy by Citadel to recoup some of the losses from the short squeeze.",1
7978c838-d7b2-450e-bfd2-13c280a8a7ad,2021-01-28 20:04:35,"I doubt anyone will ever see this review because corporate interests gotta stick together right? No one is falling for your pathetic excuses about “volatility,” you are covering for your rich buddies and trying to keep filthy working class people out of your club. You are protecting people that ruin the lives of working class Americans to save spoiled little trust fund babies from being less rich. It’s really hard to spin a narrative that the economy works fine and doesn’t need to change when the majority of America is suffering and the stock market is doing JUST DANDY. Reality does not support your lies, you’re burning through any goodwill you’ve built up in a matter of hours, and you’re putting the spotlight on yourself to take the hit for people who are just using you for their own gains. For example, I learned that Robinhood sells your investing data and gives other corporations the opportunity to act on that information before putting your order through, never would have known that if you didn’t insert yourself between retail investors and hedge funds. Robinhood is untrustworthy, self-serving and devious, they deserve less than a single star because that’s still too good for these lousy snakes.",1
077c86d6-9523-42aa-8dab-277e652fece3,2021-01-30 17:53:48,"Robinhood advertises itself to new investors enticing them with claims of democratizing the financial world.

However, once you make an account all hands are off as Robinhood uses a  gamified UX to encourage investors to add to their cash balances (the interest from cash is a source of income for them) and buy popularized stocks (order information sold to hedge funds is another source of income) often with no information about how the stock is doing. While their website provides limited tools such as RSI, Moving Average, MACD, none of those are available on the app even with a pro account.

Their interface is intuitive to use if you know what you're doing, but if you are experienced you’ll find yourself googling basic information that is normally provided to you in other broker platforms about a stock.",2
b41f5f4c-e26b-4e71-9f96-afabafac8891,2021-05-09 17:30:04,"Like its legendary namesake, the Robinhood App allows the average Joe to access the potential financial benefits of the market. If you read all the comments from the millionaire/billionaire naysayers who disparage the site, you tend to understand the disruptive power of this concept. After decades of saving in annuities, CD’s and savings accounts and making next to nothing in interest, Robinhood has finally provided me easy investment into the public business realm. Thank you Robinhood for removing the shroud of mystery in respect to investing for the middle and lower class person.",5
ddf30d54-250c-4b0b-a7e2-feb482a152a7,2021-02-02 21:36:50,"Robinhood is currently embroiled in a giant scandal where they have stopped allowing retail investors (you and me) from being able to purchase stocks that could cause their hedge fund donors to lose money. Essentially taking from the poor and allowing the rich to get richer. 

They are also in the midst of being sued by millions of users via a class action lawsuit (not the kind of company you want to be handing your money over to)

Please don’t support RH, use etrade, fidelity, or td ameritrade. The illegal activity going on behind the closed doors at Robinhood is astounding and should result in bankruptcy and or complete liquidation by the SEC as millions of reports have already been filed.",1
8df8d9e8-be60-41fd-9141-46292bf99d9f,2021-01-28 15:43:49,"Robinhood is an absolutely excellent platform that was built around the central idea of investment for the masses. The interface is easy to use and the information provoded is well summarized and concise. HOWEVER, the events of the last few days have definitively proven that Robinhood is NOT a platform for the masses but rather a coral for the money that they earn to force the masses to play a disadvantaged game with corporations, hedge funds, and short sellers. We all know the game and the risks and accepted them when we put money into the market, but censorship of our investment opportunities because of stellar performance IS NOT OKE OF THESE RISKS!  It is althe embodiment of the problem with bug tech these days and sadly, this great platform is nothing more than a way for the rich to take your money and make themselves richer.",1
ad262258-7d7c-4449-8806-18a2de2cd9a9,2021-05-12 03:49:24,I had never done my own stock trading I tried it on one of the other sites seem very difficult Robin Hood makes it very simple and all information is on one page of every stock you own I started with $1000 to test it and I’ve got a lot more than that now I’m trusting it totally and I’m planning to put a lot more money into it. I want to add I’m not a youngster I’m 80 years old I’m trading my own stock so thank you Robin Hood for making it a lot easier than what I thought.,5
83d94ccf-e282-486a-aad1-d27457a23bd5,2021-01-28 18:10:55,"This app should undoubtedly pay back everyone that lost money on the stocks they knowingly manipulated. The whole basis of this app is for beginner trading in a free market and the people who use this have been taken advantage of and cheated out of their own hard-earned money. This was a formulated attack on the other 99% of society trying to better their lives and take what is rightfully theirs. I hope to see Robinhood own up to this disgusting act against their users that trusted them for so long, pay back every single dollar lost from the shorted stocks, be taken off the App Store, and for the CEO to be taken from his ivory tower to a concrete cell for a lifetime of solitary confinement.",1
08d94bb3-7481-4749-9714-5c1c641270cc,2021-01-30 21:00:42,"I have used the application in the past, it is intuitive to use but it unfortunately looks like it is nothing more than a mechanism to collect users data to sell to hedge funds to allow them to have an edge over retail traders. I can see being the product in the same way that I am the product for advertisers with social media applications but I am receiving a service in return. The idea with robinhood is that you are receiving the service of free trades or low price trades via there brokerage in exchange for your data they sell hedge funds however the difference is Facebook doesn’t bankrupt you or cause you to lose millions of dollars if I don’t buy the advertisers products that they try to sell me on there platform. Because of this I would advise all people to avoid using this application as it is dangerous to free markets and our country as a whole.",1
b04576ec-13a5-4c25-b4d5-06a7d820278a,2021-03-10 15:37:29,"I have really enjoyed the experience and the opportunity to be able to get in on the market for the first time in my lifetime, for the pure fact that I do not have to go through any of the brokerage firms, and I can simply do it myself. I give Robinhood a five star rating for the simplicity of the app and the security protocols that are necessary to make sure that you are you when using the app, because there’s a lot of scammers out there and it is very important to me that I feel safe for my investments.",5
37862837-8827-43d3-8f01-f6e092e5b6cc,2021-01-30 08:19:22,"Robinhood allows HFTs to pay to see what you buy and then they get those stocks in front of you but have their own interests at heart. HFTs get paid via the stock purchases pushed by Robinhood and provide a cut to Robinhood for their part in your purchase. So bottom line, Robinhood’s customers are really the HFTs rather than the individual investors on the app itself; similar to how Facebook customers are ad companies, not the individual users of Facebook itself. 

In the most recent GME stock squeeze, Robinhood limited people’s ability to purchase the stock and only allowed people to sell. This is primarily because the HFTs were looking to short the stock, however after the backlash from hedge funds going under because Redditors purchased all stocks and options available they only allowed people to sell stocks to flood the market with sales and bring the stock price back to a lower price— clearly utilizing this feature to enable stock price manipulation in favor of their real “customers”",1
fd18c70a-9e80-4c11-b5e0-ad542609f952,2021-02-20 23:38:25,"I’m thankful because Robinhood (and the hype/marketing during it’s rise to popularity) got me to start investing in the stock market mostly due to its ease of use. Unfortunately, as a risk averse and timely investor, the lack of reliability of the platform is unacceptable and exposes far too much unnecessary risk for even the most risk-seeking investor. I had my first gut-instinct to leave the platform when their entire service was down for a significant amount of time during the early pandemic-related market volatility around March/April (can’t remember exactly-2020 just felt like one long month). I cannot deny that have experienced returns I never expected possible. I owe my significant returns to my own research, instincts, and investments. None of my returns were a direct result of any benefit or feature Robinhood has over other trading platforms. As such, considering the unnecessary additional risk Robinhood exposes their investors to, specifically during severe but precedented market volatility, I do not see it as a viable platform to buy or sell financial instruments on, nor do I believe it is a safe platform to store any assets within, whatsoever.",1
08be38b3-911b-4d81-afea-ac30452da3a4,2021-01-29 04:11:58,"So market manipulation is bad when the little guy does it huh? Don’t ever do this ish again. You know you f’d up when all ends of the political spectrum are mad at you. You’ve lost the support of the people and the government one side of the triangle won’t help and to be honest you’re only preventing something that can occur again if there is more regulation then the hedge funds will still suffer, it’s a zero sum game and you lost. Also if this is how you’ll act then fire your marketing team and change your name because it is misleading if this is how you conduct yourselves. Robinhood would’ve supported what is happening y'all can screw right off and if apple tries to remove these like they did on google then trust me the storm will be MUCH worse don’t underestimate angry young people who’ve been f’d over multiple times by big money and who like memes and trolling

Short answer I’m pretty sure what you did was criminal and I understand that stocks are all you sacrifice the riches of tomorrow for those of today but this was extremely short cited and open limited investing again isn’t enough now they’re coming for you too",1
d3afa990-6228-4914-aceb-7d26d486a26e,2021-01-28 15:06:06,"I signed up for a brokerage account, not a babysitter. Recently they’ve disabled the option to continue buying gamestop, amc, etc similar stocks, only allowing us to sell it instead, in order to scare retail investors (us) into selling them off due to robinhood’s hedge fund associates/investors losing money on shorting these stocks that we keep driving up. This is disgustingly corrupt and clearly market manipulation in service of those at the top, and I’m even bringing a lawsuit forward in hopes of getting the SEC’s attention on this to punish robinhood for this blatant manipulation. This app is clearly not meant for the people, nor is it a platform for equal/fair trading opportunities, so look elsewhere if you want to trade without whatever restrictions the 1% decides to put on you any given day.",1
f2ed0417-b409-49a8-b39d-11f90d47f5e8,2021-08-10 11:59:32,When I originally had started this account they had different styles of debit cards available. So I chose the one which was black and clear watch originally wanted then I get an email that they’re no longer available and get sent the AMERICAN FLAG design of which I really did not want. I have asked them for three years since I’ve been with Robin Hood to change my design I did not request the American flag nor do I want it on my debit card and they refuse they say they don’t offer that so therefore there’s really no need to keep Robin Hood closing and deleting my account,5
025c9041-04c2-41ed-9292-d13800fc5c68,2022-03-04 06:58:33,"By far Robin Hood is it is the number one contender at least in my opinion when it comes to a cryptocurrency exchange and for purposes of investing into stocks. Fortunately I have never had the need to call Robinhood support but I have had to contact Coinbase Support 55 times but to no avail. Clearly Coinbase was in the wrong when I lost $30,000 because they prevented the seal from going through not want to Customer Service with sympathetic North high to resolve the issue but give me a $10 credit at the very end whereas I would’ve made $187,000 from my 30,000 investment then they froze my money and returned one percent of it I’m going through arbitration proceedings to resolve matter. Both hands down to Robinhood  as I have never run into an issue with a Sale or purchase and transparency is key and I don’t think you find that anywhere else especially the cryptocurrency platforms.  

Dictated but not read to avoid delay",5
706071bb-a211-4e4e-8cc7-cc4fece417ac,2021-06-18 12:24:34,"I’m an avid user of RH but it is difficult keeping up with which is the oldest and most recent purchase date (high and low dates) for each stock in my portfolio. This is important because when a stock is sold on RH , it is done using FIFO method and knowing what my oldest and newest dates are for a particular stock in my portfolio, will assist me in making a more informed decision on whether to sell a stock in less than a year of holding it as this may have capital gains tax implications. 

Thanks and looking forward to this feature being added to our RH stock details.",3
7c346865-85d6-4a13-965c-8d2d2d4b3323,2021-02-02 17:01:09,"Robinhood management saw fit to put hedge funds and short sellers over average people while advertising that they were an investment brokerage for normal people. They clearly showed that they will hurt and burn their own customers to help those people and I will be transferring my portfolio elsewhere.

That said the app has been decent to use, there are some features that are nice and allow you to see your total earnings with particular stocks but to track trends of stocks the app fails, it does not show the value of a stock at different times just a graph with an unlabeled y-axis, this makes Google or the Apple Stocks app better for examining the history of a stock before purchasing it. This should be improved to help users get a better gauge of long term trends.",1
3ded01dc-d976-46f4-8f98-1aea064bbd17,2021-01-28 17:14:32,"Robinhood suspended public buying of multiple stocks in order to protect the big fish companies and investors and purposely drive down the prices. The average person buying Gamestock stock has been a rally and culmination of frustrations to stick it to the fat cats who take advantage of the average person day in and day out. Robinhood has made their position very clear choosing to side with investment companies over the public by restricting buying of rallied stocks, and raising the margin requirement percentage to force sales trough a margin call all under the guise of “protecting users.” The only ones who are getting helped by these moves are the massive companies. Forcing the sell off directly hurts the average user and it’s never been clearer what their intentions are. I was a long time Robinhood user but after seeing how blatant they are in suppressing free trade, I don’t think I will be any more.",1
78c0ed51-beac-43ce-8032-0fa53ea018d7,2021-02-04 20:51:04,"Robinhood was created to enable unlikely retail investors the opportunity to play their fair share in the market. Last week, however, CEO Vlad Tenev showcased just how incapable he and his company are to serve their retail customers with a fair playing field, or transparency. In an interview on two news sources as a result of the fallout from last week Tenev cited that the issue with Robinhood was not a liquidity issue, and that it had to deal with clearing houses. Despite his statements last week, this week he has in-fact admitted that it was a liquidity issue, displaying just how dishonest he was in the first place. If you are to run a company that claims it’s for empowering normal people, you might want to be up front with just what kind of issues you encounter. Definitely do not trust this app, it has frozen on multiple occasions during volatile markets (beginning of COVID this happened for weeks) and then this last week with their crippling of a volatile stock through their limitations placed on retail purchasers. Genuinely disappointed in this company, and their bold-faced lies when it comes to answering liquidity issues.",1
24c8de1d-0c1e-40d3-89d2-9b18b222cad4,2021-04-23 21:44:49,"I’ve been very critical of this app and more specifically the company itself; They have a bad track record of being unethical in the trading world, but that aside there is no other trading platform that comes close when it comes to user interface, fast deposits & trades, and most importantly the largest selection of stocks and cryptos for those like me who like to have all their investments in one account. I hope this company does better in the future to gain their user’s trust back.",3
d92b3dd5-fca0-4ff2-b899-7cd18fd969fb,2021-02-04 18:35:59,"Robinhood Now blocking 50 equities - CEO lies, saying they have no liquidity issues, 1 day before getting a 1 billion dollar bailout - look up how to join the lawsuit against them if you were affected. GME and AMC were two of the stocks that were on the rise and could possibly genuinely change lives/or really give a chance to put a lot of money in peoples pockets - if you knew up much to put in and when to take it out. I would definitely recommend finding a better broker to deal with don’t let this be the one to stop you from actually making profits and getting good equities.",1
